418,"[경기광주24시] 남한산성 계곡 불법 영업시설 자진 철거 ""대변신""--0","경기 광주시는 최근 자진 철거한 남한산성 계곡의 불법 영업 시설에 물놀이장과 생태공원, 경관농업단지 등을 조성키로 했다.	시는 계곡과 국·공유지를 무단 점유해 온 남한산성 인근 불법 영업시설 11개소를 모두 자진 철거시켰으며 주민, 상인들과 협의를 거쳐 올 연말까지 '남한산성 시민 생태·문화 거점 조성사업'을 추진키로 했다고 2일 밝혔다.	불법 영업시설 대신 합법적인 친환경 공간을 조성해 특정 업주의 이익이 아닌 남한산성 일대 지역경제 활성화를 도모하겠다는 취지다.	그동안 남한산성 일대 불법 음식점들은 계곡과 국·공유지를 수십 년 간 무단 점유하며 사회적 물의를 빚어 왔다.	시는 지난해부터 상인들을 대상으로 '하천 불법행위 자진 철거 계도'를 벌이고 '경기도 민생특별사법경찰단'과 합동 단속을 벌이는 등 강력한 불법 근절 의지를 보여 왔다.	이 과정에서 시는 남한산성면 주민들과 협의를 통해 생태·문화 거점 사업의 청사진을 구상, 불법을 합법으로 대체해 남산산성면 전체의 경제를 살린다는 합의점을 도출했다.	광주시에 따르면 11개소의 불법 영업시설에서 천막 17개와 평상 116개, 계곡으로 이어지는 철제계단 2개, 간이교량 1개 등을 자진 철거했다.	남한산성 시민 생태·문화 거점 조성사업은 불법 영업시설이 사라진 자리에 친환경 휴게 및 레저 시설을 올해 말까지 조성할 계획이다.	신동헌 시장은 ""유네스코 세계문화유산 남한산성은 연간 330만명이 찾고 1천만명 이상이 접근 가능한 수도권 요지에 자리 잡고 있다""며 ""생태·문화 거점화 사업을 올해까지 완료하고 주민들과 함께 각종 프로그램을 운영할 계획""이라고 말했다.	해당 사업부지는 남한산성 계곡 번천천 일대 1만7950㎡이며, 총 사업비는 40억원이다.	이와 함께 시는 남한산성 생태·문화 거점을 인근에 위치한 '한양삼십리길' 12㎞ 구간과 경기도 건설본부에서 4월 착공예정인 '남한산성 보도 설치공사' 6.36㎞구간을 연계할 예정이다.	광주시는 관내 사업장을 두고 있는 12월 결산법인은 오는 5월 4일까지 2019년 귀속 법인지방소득세 확정 신고 및 납부를 해야 한다고 2일 밝혔다.	법인지방소득세 신고 시 둘 이상의 지방자치단체에 사업장이 있는 경우에는 사업장별 안분해 각각 신고·납부해야 하며 소득금액이 없거나 결손금이 있는 법인의 경우에도 반드시 신고해야 한다.	특히, 둘 이상의 지자체에 사업장이 있는 법인이 한 곳의 지자체에 일괄 신고할 경우, 나머지 사업장은 20%의 무신고 가산세가 부과되므로 신고대상 법인의 각별한 주의가 요구된다.	또한, '코로나19'로 인해 사업에 현저한 손실을 입거나 중대한 위기에 처한 법인에 대해서는 지방세 납부기한 연장을 지원할 계획이며 납부기한에 한해 연장하므로 법인지방소득세 신고서는 5월 4일까지 제출해야 한다.	법인지방소득세 신고·납부는 위택스를 통해 전자신고·납부가 가능하며 방문, 우편, 팩스 신고도 가능하다.	시 관계자는 ""관내 법인 및 세무 대리인에게 안내문을 발송하고 홈페이지 등 다각적인 홍보를 통해 납세자들에게 신고·납부 편의를 제공할 것""이라고 말했다.	광주시는 남한산성면 광지원리 중부고속국도 교량 하부에 공용주차장을 준공했다고 2일 밝혔다.	이번에 준공된 중부고속국도 교량 하부 공용주차장은 광지원초등학교 인근에 있으며 1억3천여만원의 사업비를 투입해 지난 3월 한 달여간 공사를 진행, 4단 35면 규모의 주차공간을 조성했다.	이에 대해 최정원 남한산성면장은 ""이번 공사를 통해 인근 다중시설인 광지원초등학교와 광주시육아종합지원센터 이용객들의 주차난 해소 및 지역 생활환경 개선을 통한 주민 생활편익 향상에 기여할 것으로 기대한다""고 말했다."
419,"[단독] ""군 경찰"" 해군 헌병 前 단장도 ""전관예우"" 의혹--0","해군 헌병단장이 전역 후 사기업에 재취업해 군 인맥을 동원하는 방식으로 해군 진해기지사령부 보안설비 수주를 따냈다는 의혹이 제기됐다.	 해군 헌병단장이었던 A 전 대령은 입찰 과정에서 해군 간부들과 다방면으로 접촉한 것은 물론 해군 헌병단에 자신이 재취업한 기업의 제품이 '뛰어나다'는 식의 인증서를 발급해 줄 것을 요구하기도 했다.	 헌병은 최근 '군사 경찰'로 명칭을 바꾸기까지 했는데, 비리를 단속해야 할 곳에서 '전관예우'가 일어났다는 지적이 나온다.	 이와 관련해 A 전 대령은 ""진해기지사령부 시설단장 등 후배들을 만난 적은 있지만, 사업과 관련한 어떠한 청탁도 한 사실이 없다""고 해명했다.	A 전 대령은 2019년 초 전역한 직후 보안설비 등을 제작하는 B업체 상무로 재취업했다.	 B업체와 B업체의 모기업이라고 할 수 있는 C업체는 남편-	아내-	아들이 대표와 임원을 맡고 있는 친족기업이다.2019년 진해기지사령부에서는 고속침투 차단시설인 '로드 블록' 설치 사업을 진행했다.	 C업체 역시 이 사업 입찰에 참여했다.	  해군 내부 관계자에 따르면, A 전 대령은 입찰 과정에서 진기사 헌병전대장, 시설전대장, 해군 헌병단 중앙수사대장 등을 접촉했다.	 이 외에도 해군 헌병단 소령급 장교를 대상으로 향응을 제공하기도 했다.	 해군 내부 관계자는 ""전형적인 '전관예우' 행태다.	 어떤 민간인이 군 부대를 자유롭게 출입하고, 지휘관들을 마음껏 만날 수 있단 말인가""라면서 ""헌병전대장의 경우, 시설 규격을 결정하는 '부대 요구서'를 제출하는 등 입찰에 결정적인 영향력을 미칠 수 있다.	 C업체는 A 전 대령을 통해 엄청난 특혜를 받은 것이나 다름없다""고 지적했다.	 해군본부 관계자는 ""A 전 대령이 일부 지휘관 등을 만난 것은 사실""이라면서 ""그러나 확인 결과, 입찰과 관련한 얘기는 전혀 하지 않았다""고 밝혔다.	A 전 대령은 입찰을 따내기 위해 군 고위 관계자에게 이른바 '품질 인증서'를 요구하기도 했다.	 해군 내부 관계자는 ""A 전 대령이 해군 헌병단 중앙수사대장에게 'C업체에서 설치한 로드블록이 해군 기지의 경계태세 강화에 큰 기여를 했다'는 인증서를 요구했다""면서 ""이는 공문서 위조에 해당할 수 있는 중범죄""라고 주장했다.	 이와 관련해 해군본부 측은 ""A 전 대령이 이와 같은 문서를 요구한 것은 사실""이라면서 ""그러나 실제로 발급되지는 않았다""고 밝혔다.	C기업은 결국 로드블록 사업을 수주했다.	 업계에서는 A 전 대령 덕분에 C기업이 입찰을 따냈다는 말이 파다했다."
420,"[단독] ""군 경찰"" 해군 헌병 前 단장도 ""전관예우"" 의혹--1"," 이후 해군 내에서 A 전 대령과 C기업에 대한 문제 제기가 나왔지만, 해군 헌병대가 '전관예우' 때문에 전임 단장에 대한 조사를 진행하지 않았다는 의혹까지 제기되고 있다.	 해군 내부 관계자는 ""A 전 대령이 현역에 있을 때부터 재취업을 바라고 이 사업에 개입했다는 의혹까지 나오고 있는 상황""이라면서 ""해군 헌병단이 A 전 대령에 대한 조사조차 하지 않고 있는 것은 전임 단장에 대한 전관예우 말고는 설명이 되지 않는다.	 지금이라도 엄중한 조사가 진행돼야 한다""고 강조했다."
421,"""모리셔스 기름유출"" 日선박, 110억원대 오염 복구 지원책 발표--0","'모리셔스 기름유출' 사고를 일으킨 화물선을 운행한 일본 해운업체 쇼센미쓰이가 피해 복구를 위한 110억원 대의 지원책을 발표했다.	 11일 일본 언론인 교도통신에 따르면, 쇼센미쓰이는 총 10억 엔을 출연해 모리셔스 기름유출로 인한 환경오염 복원 등에 쓸 예정이다.	 다만 손해배상과 관련한 법적 책임을 부인한 채, 환경오염에 대해 책임만 진다는 입장이다.	 해당 지원금으로 '모리셔스 자연환경회복기금'을 조성해 기름으로 오염된 산호초 및 맹그로브 숲의 보호·복원 작업을 추진하고, 희귀 바닷새 등의 동물 보호 활동을 지원한다.	 앞서 모리셔스 정부는 기름유출 사고가 난 지역에서 조업을 못 하게 된 만큼, 먼바다로 나가지 못하는 어선 100척과 어부 500여 명에 대한 훈련 비용으로 36억 엔을 지원해 달라고 요구한 바 있다.	 그러나 일본 정부는 아직 입장을 밝히지 않았다.	 모리셔스 기름유출 사건의 시작은 지난 7월25일이었다.	 당시 일본 해운회사인 쇼센미쓰이가 운항하던 화물선 MV 와카시오호가 모리셔스 남동쪽을 지나던 중 산호초 바다에서 좌초됐다.	 이때까지만 해도 기름 유출은 없었으나, 지난 8월6일부터는 좌초돼 있던 화물선의 연료 탱크에서 기름이 유출되기 시작했다.	 총 1000톤 이상의 기름이 유출된 것으로 알려졌다.	 유출된 기름은 모리셔스 해안가까지 밀려와 산호초와 환초호 보호지구를 덮치며 해양 오염이 심각한 수준에 이르렀다.	 이후 지난달 15일에는 풍파에 배가 선미와 후미로 쪼개졌고, 선박 선체의 일부는 인양했다.	한편 지난 10일 모리셔스 경찰은 기름유출 사고가 화물선 선장 등의 업무 태만으로 발생한 것으로 초기 조사 결과를 발표했다.	 선장은 와이파이로 가족과 통화를 하기 위해 모리셔스 섬에서 약 8km 부근까지 다가갔고, 배의 운항 정보도 제대로 확인하지 않았던 것으로 나타났다."
422,"영웅을 자처한 악당 ""디지털교도소""의 최후 [시끌시끌 SNS]--0","성폭행범 등 강력범죄자의 신상정보를 임의 공개하는 사이트 '디지털교도소'를 잡기 위한 수사망이 펼쳐졌다.	 9월10일 대구경찰청은 ""운영진 일부를 특정해 검거에 집중하고 있다""고 밝혔다.	 디지털교도소는 과거 ""해외 벙커에 서버를 설치해 절대 안 잡힌다""고 장담했지만, 8일 갑자기 폐쇄됐다.	 해당 사이트는 최근 대학생 정아무개씨의 사망으로 논란이 됐다.	 ""정씨가 지인을 능욕했다""며 그의 개인정보를 올렸는데, 정씨가 ""사실이 아니다""고 억울함을 호소하며 극단적 선택을 한 것이다."
423,[울산24시] 울산경제 여전히 코로나 여파 못 벗어나--0,"울산지역 경제가 여전히 코로나19 여파에서 벗어나지 못하고 있다.	 특히 울산 광공업 생산이 3개월째 감소세를 보이면서 소비 등 주요 산업활동 지표도 감소했다.	 동남지방통계청의 '6월 부·울·경 산업활동동향' 자료에 따르면 6월 울산지역 광공업생산이 지난해 같은 기간 보다 9.4% 감소했다.	 이는 지난 3월 4.7% 증가 이후 3개월 연속 감소세다.	품목별로 보면 운송장비, 기계장비 등이 늘었고, 자동차, 석유정제 등은 줄었다.	소비 동향을 보여주는 소매판매액도 지난해 보다 1.3% 감소했다.	 대형마트 판매는 0.2% 늘었으나, 백화점에서는 줄었다.	 상품군별로 보면 가전제품, 기타상품은 증가했고, 신발ㆍ가방, 화장품, 음식료품, 취미ㆍ경기용품, 의복 등은 감소했다.	건설수주액은 5834억 원으로 지난해 같은 기간보다 424.2% 증가했다.	 발주자별로는 지방자치단체와 기타공공단체 등 공공부문 발주가 늘어 지난해 6월 대비 155.5% 늘었다.	민간부문에서 화학·석유는 줄었으나 ,건설업이 늘어 지난해보다 112.7% 증가했다.	 또 신규주택과 사무실 및 점포는 각각 늘어 지난해 같은 달 대비 785.0% 증가했다울산시는 올해부터 아동학대 신고 홍보 활동을 적극적으로 펼친 결과 신고 건수가 크게 증가했다고 3일 밝혔다.	 올해 상반기 아동학대 신고는 총 547건으로 지난해 같은 기간 449건에 비해 21.8% 증가했다.	 특히 이중 신고의무자가 아닌 일반인 신고도 총 457건으로 지난해 같은 기간 332건에 비해 37.7%나 늘었다.	일반 시민의 신고율이 이처럼 크게 증가한 것은 적극적 홍보 활동으로 아동학대 신고에 대한 사회 전반의 인식 변화가 점차 이뤄지고 있기 때문으로 울산시는 분석한다.	 울산시는 올해 들어 시와 구ㆍ군 누리집 팝업 게시, 공공청사 승강기 내부 모니터와 전광판 등 온라인 매체를 이용해 아동학대 신고 홍보를 집중 실시하고 있다.	 또 울산시ㆍ구ㆍ군 등 공공청사 배너 제작ㆍ비치, 읍ㆍ면ㆍ동 게시판 현수막 게시는 물론 아파트와 연립주택 등 공동주택, 읍면동, 일선 파출소에 아동학대 신고 안내문과 포스터를 부착하는 등 오프라인 홍보도 추진하고 있다.	 언론사 홍보, 간담회 등 회의, 아동학대 예방교육, 협의체와 모니터링단 구축 등의 홍보 활동도 강화하고 있다.	울산시 관계자는 ""앞으로 각 구ㆍ군, 경찰청 등과 함께 아동학대 예방 홍보와 위기아동 발굴을 위한 협력을 지속적으로 확대해 나갈 계획이다""고 했다.10대 미성년자에게 2차례에 걸쳐 마약을 투약해 환각증상에 의한 이상 행동으로 입원 치료까지 받게 한 40대 남성에게 실형이 선고됐다.	울산지법 제11형사부는 마약류관리에관한법률위반 혐의로 기소된 A씨에게 징역 2년 6개월과 추징금 50만원을 선고했다고 3일 밝혔다."
424,[울산24시] 울산경제 여전히 코로나 여파 못 벗어나--1,A씨는 올해 1월부터 2월까지 울산 남구의 모텔과 차량 안에서 3차례에 걸쳐 필로폰 약 0.05g씩을 투약한 혐의로 기소됐다.	 그는 또 10대인 미성년자인 B군에게 2차례에 걸쳐 필로폰 약 0.05g씩을 투약했다.
425,"극단적 선택한 창원 50대 택배사업자 ""수수료 착복 당했다""--0","최근 전국에서 택배기사가 잇따라 숨져 논란에 휩싸인 가운데 경남 창원에서 50대 택배 개인사업자가 숨진 채 발견됐다.	 경남 진해경찰서는 10월 20일 오전 6시 8분 창원시 진해구 한 택배회사 하치장에서 A씨가 숨진 것을 회사 동료가 발견해 신고했다고 밝혔다.	 경찰은 현장에서 A씨가 작성한 것으로 추정되는 유서 2개를 발견했다.	 A씨는 앞서 이날 오전 2시 30분쯤 회사 동료에게 자필로 작성한 2장짜리 유서를 촬영해 메신저로 보냈다.	자필로 쓴 것으로 추정되는 유서에는 ""가족과 부모님께 죄송하고, 지점장 등이 직원 수를 줄이고 수수료를 착복하는 등 업무를 떠넘겨 부당함을 겪었다""는 내용과 ""사업을 하면서 시설투자와 세금 등으로 수입이 적어 경제적으로 어렵다""는 내용이 담겨 있었다고 경찰은 전했다.	경찰은 타살 혐의점이 없고 A씨가 생활고에 몰려 스스로 극단적 선택을 한 것으로 보고 가족과 회사 관계자 등을 상대로 정확한 사건 경위를 조사 중이다.	한편 최근 CJ대한통운과 한진택배에서 이달 들어 각각 택배기사 1명이 숨졌으며 A씨의 죽음으로 올해 목숨을 잃은 택배기사는 모두 11명이 됐다."
426,"전쟁으로 멈췄던 올림픽, 바이러스에도 멈출까--0","2003년 사스, 2009년 신종 인플루엔자, 2015년 메르스 사태 때 국내 스포츠는 별다른 피해를 보지 않았다.	 그러나 이번 '코로나19' 사태는 국내 스포츠뿐만 아니라 세계 스포츠계에도 엄청난 타격을 입히고 있다.	 세계 각국의 수많은 스포츠 행사가 연기되거나 취소되고 있는 것이다.	우선 국내 양대 스포츠인 프로야구와 프로축구의 올 시즌 리그 진행이 당장 차질을 빚을 전망이다.	 프로축구는 1983년 출범 이후 처음으로 개막 연기를 결정했다.	 프로야구는 시범경기가 무관중으로 열릴 예정이다.	 특히 대구에서 벌어질 예정이던 6경기는 장소를 변경해 상대팀 홈구장에서 열리게 된다.	겨울철 실내 스포츠인 프로농구와 프로배구는 이미 무관중 경기를 벌이고 있다.	 핸드볼코리아리그는 대회 일정을 축소하고, 챔피언결정전을 없애고 페넌트레이스 성적만으로 우승팀을 가렸다.	 부산에서 3월22일 개최 예정이던 세계탁구선수권대회도 3개월 뒤인 6월21일로 연기되었다.	아시아축구연맹은 3월4일 울산에서 열리는 울산현대 대 호주 퍼스글로리의 AFC 챔피언스리그 조별리그 2차전 경기를 무관중으로 치르도록 권유했고, 3월26일 천안에서 벌어질 2022 카타르월드컵 아시아지역 2차 예선 투르크메니스탄과의 경기도 무관중으로 치러질 가능성이 있다.	축구나 야구, 농구, 배구 같은 구기 종목들은 많은 관중들 앞에서 경기를 해야 하기 때문에 '코로나19' 같은 바이러스에 잘 감염되는 구조다.	 만약에 선수 가운데 확진자가 나올 경우, 그 팀은 물론 상대팀도 수십 명이 격리되어야 하기 때문에 리그 자체를 진행하기 어렵게 된다.	 그리고 수많은 관중 가운데 확진자가 나오면 그날 경기에 입장한 수천, 수만 명의 관중들이 검진을 받고, 자가격리되어야 한다.	 엄청난 파장이 일어날 가능성이 있는 것이다.	 지구촌 최대의 스포츠 행사인, 7월24일 개막하는 도쿄올림픽도 초비상이 걸리긴 마찬가지다.1988년 서울올림픽 이후 모든 올림픽은 '자원봉사자 올림픽'이라고 할 정도로 매 대회마다 자원봉사자들은 그 '올림픽의 꽃'이었다.	 자원봉사자들은 경기장 안팎에서 적극적인 서비스와 홍보 그리고 봉사로 세계 각국에서 몰려온 선수와 관광객들의 사랑을 받아왔다.	 자원봉사자들은 대회 전에 수개월간 교육을 받아야 하는데, 도쿄올림픽 지원봉사자 교육은 일단 3월에서 5월로 연기되었다.	또한 3월12일 올림픽의 발상지 그리스 헤라 신전에서 성화 채화식이 있을 예정인데, 행사를 주관할 그리스 올림픽조직위원회가 코로나19로 인해 초비상 상태다.	 채화된 성화는 7일간 그리스 내에서 봉송할 때 봉송자들이 마스크를 써야 할지도 모른다."
427,"전쟁으로 멈췄던 올림픽, 바이러스에도 멈출까--1"," 성화는 3월19일 일본으로 건너간다.	 3월26일 후쿠시마현에서 출발해 올림픽 개막식이 열리는 7월24일까지 일본 전역을 도는데, 1만여 명이 참여하기 때문에 철저한 '코로나19' 예방 조치가 필요한 상황이다.	 일본은 이미 자국 내 성화 봉송 릴레이 때 국민들에게 현장에 나오지 말고 TV 중계로 지켜봐 달라고 당부하고 있다.	최근 리처즈 딕 파운드 전 IOC 부위원장이자 현역 위원은 ""도쿄올림픽이 열리지 못하게 되면 영국 등 다른 곳에서 열지 말고 아예 취소하는 것이 맞다""는 주장을 하고 나섰다.	 '데일리스포츠' '타임스' 등 세계 유력 매체들도 조심스럽지만 도쿄올림픽 취소에 대해 언급하기 시작했다.	 그러나 도쿄올림픽 주관 방송사인 NBC와 역대 최대 금액인 10억 달러의 중계권료 계약이 체결됐고, 일본도 인프라 구축에 수십억 달러의 비용을 지불한 상태이기 때문에 올림픽의 연기나 취소는 재정적 재앙을 부른다.	올림픽을 주관하는 국제올림픽위원회는 '올림픽이 열린다'는 것을 전제로 존재하고 있기 때문에 취소된다는 것은 상상도 할 수 없는 일이다.	 그리고 세계 각국의 수많은 젊은 선수들은 출전권 획득과 메달을 목에 걸기 위해 자신의 인생을 다 바쳐 훈련하고 있다.	 그같이 수년간 피와 땀을 흘린 세계의 젊은 선수들을 감안하면 올림픽 연기나 취소는 세계 '스포츠 역사상 최악의 사태'라고 할 수 있다.1896년 그리스 아테네에서 첫 근대올림픽이 개최된 이후 지금까지 올림픽은 1916년과 1940년, 1944년 등 전쟁으로 인해 세 차례만 열리지 못했을 뿐이다.1916년 올림픽은 원래 헝가리 부다페스트가 유력했다.	 그러나 서서히 고개를 드는 독일의 전쟁 도발 조짐을 감지한 IOC 위원들이 헝가리를 설득해 독일 수도 베를린에 만장일치로 개최권을 넘겨주었다.	 당시 쿠베르탱은 베를린에 올림픽 개최권을 부여한다면 독일의 평화주의 세력을 자극해 전쟁을 피할 수도 있다고 생각했던 것이다.	 하지만 이런 노력에도 불구하고 1914년 전쟁이 발발하면서 베를린올림픽은 물거품이 되었다.	 2차 세계대전은 12회 도쿄올림픽과 13회 헬싱키올림픽을 사산시켰다.	 1939년 러시아가 핀란드를 침공하면서 전 세계가 전쟁의 화마 속에 휘말려 들어갔다.1972년 독일에서 열린 뮌헨올림픽도 중단될 위기에 처한 바 있다.	 당시 팔레스타인 게릴라 단체인 '검은 9월'이 대회기간 중인 9월5일 선수촌 담을 넘어가 이스라엘 선수단 2명을 사살하고 9명을 인질로 잡았다.	 그들은 이스라엘에 억류 중인 정치범 200명의 석방을 요구했다.	 결국 검은 9월단 사건은 이스라엘 선수와 임원 11명, 아랍 게릴라 5명, 독일 경찰 1명 등 총 17명의 사망자를 냈다.	 평화의 상징인 올림픽이 피로 물들자, 전 세계 곳곳에서 올림픽 중지 요구가 빗발쳤다.	 당시 브런디지 IOC 위원장은 ""올림픽이 정치 상업화의 도전을 받아오다가, 심지어 범죄단체의 횡포까지 일어났지만 그럴수록 올림픽은 계속되어야 한다""면서 24시간 중단되었던 뮌헨올림픽을 속계했다.	 만약 그때 중지시켰다면 올림픽 역사는 또 한 번 바뀌었을 것이다."
428,"""창녕 여아 일기장, 구체적 학대 내용 안 나와""--0","창녕 아동학대 당사자인 9세 여아 A양이 쓴 일기장이 당초 관심의 대상으로 부각됐다.	 계부와 친모의 학대를 입증할 만한 증거가 될 것으로 경찰이 보고 이를 들여다봤기 때문이다.	 하지만 이 일기장은 증거자료가 되지는 못할 전망이다.	 경찰은 6월5일 계부의 주거지 압수수색에서 학대 도구로 사용된 쇠사슬, 자물쇠, 쇠막대기 등과 함께 A양이 작성한 일기장도 확보했다.	 A양은 일주일에 두 번가량 일기를 적은 것으로 알려졌다.	 경찰은 일기장에서 학대 정황 기록이 나올 경우 중요한 증거로 채택할 예정이었다.	 이 때문에 일기 내용을 일절 외부에 공개하지 않았다.	기자가 이 일기장을 입수해 들여다본 경찰 관계자를 취재한 결과, 일기장에는 '엄마한테 혼나서 아프다' '거짓말해서 혼났다' 등 학대를 의심할 만한 문구가 일부 있었다.	 하지만 경찰은 학대 혐의를 입증할 만한 의미 있는 내용은 아니라는 입장이다.	 일기 내용과 범죄 사실이 일치하지 않을 수 있고, 시기도 다를 가능성이 있다는 것이다.	 경남지방경찰청 관계자는 ""일기장에는 최근 경찰이 구속영장을 청구했던 사건과 관련된 내용은 없다""며 ""오래전에 쓴 것 같고, 부모한테 혼났다는 정도로 구체적인  것이 없다""고 했다.	☞연관기사남보다도 못했던 '인면수심'의 부모www.	sisajournal.	com/news/articleView.	html?"
