269,경찰이 시민에게 총부리를 겨눌 수 없다 [최보기의 책보기]--0,"고 안병하는 1928년 강원도 양양에서 태어났다.	 중학교를 일본에서 마쳤고 해방되던 해에 서울 광신상고에 편입했다.	 김종필, 김형욱, 이희성 등과 육군사관학교 8기로 입학해 1949년 21세 때 전방부대 소위로 임관, 6·25 전쟁을 치렀다.	 1951년 춘천전투, 음성전투의 공으로 화랑무공훈장을 받았고 1계급 특진했다.	 2015년 전쟁기념사업회는 안병하를 ""8월의 호국인물""로 선정했다.1962년 34세 때 육군 중령으로 예편, 총경으로 경찰에 특채돼 부산 중부경찰서장으로 첫 근무를 시작했다.	 6년 후 서귀포 침투 무장간첩체포 육상작전을 지휘해 화랑무공훈장 등 5개의 훈장과 중앙정부보장 표창을 받았다.	 43세 때 경무관으로 승진했고 1979년 2월 제37대 전라남도 경찰국장으로 부임했다.	 박정희가 10·26에 김재규의 권총에 맞아 죽기 8개월 전이었다.1979년 12·12 사태로 전두환을 위시한 신군부가 등장했다.	 대학생들을 비롯한 시민들의 민주화를 요구하는 시위가 전국에서 일어났고, 신군부는 1980년 5월17일 비상계엄을 전국으로 확대했다.	 이날 제 7공수부대 33대대, 35대대가 광주 전남대와 조선대에 투입됐다.	 공수부대원들에게 민주화를 요구하는 광주시민들은 남녀노소 불문하고 무자비하게 죽여야 할 적이었다.	 그들의 박달나무 곤봉에 청년들의 머리가 깨졌고, 시퍼런 대검에 임산부의 젖가슴이 갈라졌고, 조준해 발사한 총알이 저수지에서 놀던 어린이들 심장을 관통했다.	 어떤 아이는 도망치다 벗겨진 검정 고무신을 주우려고 되돌아오다 총알을 맞았다.	안병하 전남경찰국장은 휘하 경찰들에게 시민의 생명과 안전을 최우선적으로 보호하라고 지시했고, 경찰의 무장이나 시민들의 무기탈취로 벌어질 내전상황을 막기 위해 경찰이 가지고 있던 모든 무기를 안전지대로 옮기게 했다.	 이희성 계엄사령관이 안병하 경찰청장에게 무력발포를 지시했지만 ""경찰이 시민에게 총부리를 겨눌 수 없다""며 발포를 거부했다.	 5·18 항쟁 동안 광주시민들은 경찰을 신뢰했고, 경찰을 시민들을 보호하려 노력했다.	 5월 17일 제 7공수부대가 광주시민들을 상대로 야만의 살육을 벌일 때 경찰들은 거리의 청년들을 향해 ""너희들 이러다 공수부대한테 걸리면 다 죽는다.	 얼른 집으로 가라""고 울먹이며 소리를 질러댔다.5월26일 계엄사 합수부로 압송된 안병하는 8일간 혹독한 고문을 당했고, 파면 당한 채 6월13일 집으로 돌아왔으나 극심한 고문후유증에 시달렸다.	 5월27일 새벽 장갑차와 헬기를 앞세우고 전남도청에 진입한 공수부대의 화공으로 최후의 시민군들은 푸른 5월의 종달새가 돼 순정한 대한민국의 하늘로 올라갔다.	 안병하는 고문후유증과 합병증으로 60세이던 1988년 10월 10일 숨을 거두었다."
270,경찰이 시민에게 총부리를 겨눌 수 없다 [최보기의 책보기]--1," 안병하의 지시로 경찰의 무기를 목포 앞 섬으로 옮겼다가 신군부에 체포됐던 고 이준규 목포경찰서장이 고문후유증으로 사망한 지 3년 지난 해였다.	신군부 세력의 위세에 눌려 오랫동안 묻혀있던 안병하의 역사가 주목을 받게 된 것은 2017년 촛불혁명이 성공하면서였다.	 2017년 11월 안병하는 1980년 6월1일 해직일 시점으로 치안감에 추서됐고, 경찰청으로부터 ""올해의 경찰 영웅"" 제1호로 선정됐다.	 경찰 인재개발원의 안병하홀 입구에 걸린 고인의 동판에는 이렇게 새겨져 있다.""	소신 있는 용기와 신념으로 국민의 생명과 자유, 권리를 보호하고 경찰의 명예를 지켜낸 참다운 시민의 공복이자 민주경찰의 표상 안병하""2020년 총선에서 주권자인 국민들은 더불어민주당에 180석이 넘는 압승을 안겨주었다.	 정치평론가와 역사학자들은 대한민국의 시대정신이 박정희 군부세력의 5·16정신에서 5·18 광주 정신으로 바뀌면서 시대의 주류가 완전히 교체됐다고 평가한다.	 '5·18 광주 민주화운동' 40주년인 2020년 5월18일, 광주의 옛 전남도청 앞 분수대에서 열린 기념식에 참석한 문재인 대통령을 비롯한 여야 정치 지도자들은 ""5·18의 역사적 평가와 진실규명에 협력할 것""이라 한 목소리를 냈다.	자랑스러운 선조, 부끄러운 선조 모두 후손들의 삶에 지대한 영향을 미친다.	 일제경찰 앞잡이로 독립군에게 가혹한 고문을 하고, 해방 후 독립군 의열단장 약산 김원봉을 빨갱이로 몰아 박해했던 노덕술과 그 후손들의 흔적은 어디에도 없다.	 박기서의 정의봉에 죽었던 백범 김구 암살범 안두희도 그렇다.	 묘마저 없는 매국노 이완용의 증손자 이윤형은 재산을 처분해 캐나다로 도망갔고, 나머지 후손들 역시 흔적이 드러나지 않는다.	시간이 때로는 사람의 마음보다 더디 흘러 눈에 보이지 않을지라도 길고 긴 업보의 그물은 죄악의 대가를 놓치는 법이 없다.	 역사의 눈으로 보면 훤히 보이는 섭리다.	 5·18 광주와 역사에 죄를 지었던 자들이 유념할 바 회개하고, 반성하고, 피해자에게 사과하고 떠나라.	 다름 아닌 당신들의 후손을 위해.	 《안병하 평전》을 대한민국 모든 경찰과 군인의 필독서로 추천한다."
271,[울산24시] 울산 아파트 전세가 폭등…상승폭 전국 2위--0,"울산지역 아파트 전세값이 폭등하며 전국 17개 시·도 중 세종시에 이어 2번째로 큰 상승폭을 기록했다.	한국감정원은 8월 4주 전국 주간 아파트 가격 동향 발표를 통해 매매가격은 0.10% 상승, 전세가격은 0.16% 상승했다고 28일 밝혔다.	울산지역은 전세값 폭등이 눈에 띈다.	 울산의 아파트 전세가격은 지난주보다 0.43% 올랐다.	 이는 세종시에 이어 2번째로 큰 상승폭이고, 전국 평균인 0.16%보다 3배 가까운 상승률을 기록했다.	 또 8월2주 0.30%, 3주 0.38% 상승에 이어 연속 3주째 가파른 상승세다.	 전세 품귀현상과 함께 재개발 지역 전세값 상승 등이 영향을 끼친 것으로 분석된다.	실제로 울산 남구는 재개발사업 영향 있는 신정·야음동 위주로 전세가가 0.63% 올랐다.	 이밖에 0.48% 오른 북구는 거주여건 양호한 단지 위주로 가격이 상승했고, 중구는 반구·복산동 중저가 단지 위주로 0.43% 상승했다.	매매가 역시 0.13% 상승했다.	 전국 17개 시·도 중 세종, 대전, 부산,대구에 이어 5번째로 높은 상승률을 나타낸 것이다.	 한국감정원은 외지인의 울산 아파트 원정투자가 아파트 가격 상승에 한 몫 한 것으로 분석했는데, 실제 울산지역 아파트 소유주 중 20%는 외지인인 것으로 나타났다.	한편 지난주 울산에서 가장 큰 매매가 상승률을 기록한 중구는 반구·우정동 등 신축 아파트 위주로 올랐으며, 남구는 신정·옥동 등 주거와 학군 우수 단지 위주로 상승세를 보였다.	 또 북구는 산하·매곡동 등 전세가 상승 영향이 있는 단지 위주로 올랐다.	울산시가 아파트 불법청약 당첨 및 부동산 불법거래 행위에 대한 일제 점검을 실시한다고 28일 밝혔다.	 최근 울산지역 부동산시장이 과열 양상을 보이고 있는데 따른 조치다.	울산시는 민생사법경찰과와 구·군 부동산 관련부서가 공동으로 아파트 불법청약 당첨 조사반을 구성해 점검한다.	 이들은 불법전매 행위, 입주자자격 관련 허위 자료 제출을 통한 청약 당첨 사항 등을 점검한다.	 울산시는 조사 결과 불법사항이 적발될 경우 행정처분 조치와 함께 민생사법경찰과에서 수사 후 검찰에 송치할 예정이다.	 위장전입, 청약통장 불법거래, 허위 청약서류 제출 등 부정한 방법으로 청약당첨이 확정되면 주택법 위반으로 3년 이하의 징역 또는 3000만원 이하의 벌금에 처해진다."
272,[울산24시] 울산 아파트 전세가 폭등…상승폭 전국 2위--1,"울산시 관계자는 ""앞으로도 건전하고 투명한 부동산 거래질서 확립이 될 수 있도록 아파트 청약 당첨사항에 대해 지속적으로 모니터링하고, 부동산거래 불법행위 사항에 대한 단속도 강화하겠다""고 말했다.	대법원이 공직선거법 위반 혐의로 기소된 김진규 울산 남구청장에 대해 27일 당선 무효형을 확정했다.	 이에 따라 김 구청장은 이날부터 직위를 상실했다.	 다음 남구청장은 내년 4월7일 치러질 보궐선거에서 선출된다.	대법원 2부는 김 구청장에 대한 상고심에서 상고를 기각하고 고법의 원심을 확정했다.	 김 구청장은 2018년 6·13 지방선거 당시 선거사무원 등 4명에게 선거운동 대가로 1400만원을 지급하고 명함 등에 허위학력을 공표한 혐의 등으로 기소됐다.	그는 지난해 9월 1심에서 공직선거법 위반 혐의로 징역 10개월, 변호사법 위반 혐의로 벌금 1000만원을 선고받고 법정 구속됐다.	 올해 5월 2심에서도 원심이 그대로 유지됐으며, 7월 말 만기 출소한 뒤 업무에 복귀했다.	 남구청은 부구청장인 박순철 구청장 권한대행 체제로 전환했다.	대법원 확정판결로 김 구청장이 직위를 상실하자 더불어민주당 울산시당은 입장문을 통해 ""사법부의 판단을 존중하며 그 결과를 엄숙히 받아들인다""며 ""행정의 수장인 청장 공백 상태가 야기된 데 대해 남구민과 울산시민께 송구스럽게 생각하고 무거운 책임을 느낀다""고 밝혔다.	반면 미래통합당은 ""임기가 반환점을 지난 상태에서 나온 판결로 만시지탄의 감이 있지만, 대법원이 사필귀정의 결론을 내린 것은 다행""이라며 ""남구청장의 구정농단을 수수방관한 민주당에도 책임이 있으므로 민주당이 후보를 공천하지 않는 것이 남구 주민에 대한 최소한의 도리""라고 주장했다.	낙동강유역환경청은 낙동강 하류 칠서 지점 및 울산 사연호에 조류경보 `관심` 단계를 발령했다.	 조류 경보제는 조류로 인한 피해 최소화와 상수원 안정성을 확보하기 위한 조치다.	 최근 칠서 지점과 사연호 모두 유해남조류 세포수 기준을 2회 연속 초과함에 따라 발령됐다.	사연호 지점은 지난 18일 2천393세포수/㎖, 지난 24일 5천879세포수/㎖로 조사됐다.	 칠서 지점은 남조류가 1330세포수/㎖, 지난 24일 1981세포수/㎖를 기록했다.	이번 조류경보는 사연호의 경우 2016년 한차례 `관심` 단계 발령 이후 4년 만에 발령되는 것이다.	 장마 기간에 유입된 영양물질이 댐 내에 축적된데다 폭염이 더해지면서 남조류의 성장에 유리한 환경이 조성된 것이 원인으로 알려졌다.	칠서 지점은 장마 이후 폭염이 계속되면서 수온이 상승해 남조류의 증식이 나타났다.	 장마의 영향으로 본류의 유량이 평소보다 2∼3배 많이 유지되면서 남조류의 증식은 제한적이었던 것으로 분석된다."
273,[울산24시] 울산 아파트 전세가 폭등…상승폭 전국 2위--2,"낙동강유역환경청은 태풍 `바비`의 영향으로 당분간 남조류의 농도가 큰 상승 없이 유지되고, 향후 기상 상황에 따라 증감을 반복하다 10월 이후 서서히 감소할 것으로 전망했다."
274,"재난지원금 노린 보이스피싱...""아차!"" 하는 순간 당한다--0","전 국민을 대상으로 긴급재난지원금이 지급되고 있다.	 신종 코로나바이러스 감염증 위기 극복을 위해 정부가 내놓은 특단의 지원제도다.	 가뜩이나 힘들었던 국민들에게 모처럼 웃음꽃이 피고 있다.	긴급재난지원금 신청 접수가 시작된 것은 지난 5월11일이다.	 이에 따라 정부, 지자체, 카드사 등에서 관련 안내 문자를 발송하고 있다.	 그런데 이때를 기다렸다는 듯 긴급재난지원금을 노린 보이스피싱 범죄자들이 등장했다.	 이들의 대표적인 수법은 일명 '스미싱'이다.	스미싱은 주로 휴대전화 문자를 보내 해당 문자나 첨부된 인터넷 주소 링크의 클릭을 유도한다.	 만약 의심 없이 클릭하면 악성코드가 설치돼 소액결제가 되거나 휴대전화에 저장된 연락처·사진·공인인증서 등 개인정보와 금융정보가 유출될 수 있다.	긴급재난지원금 안내를 빙자한 문자메시지도 절차 진행을 위한 앱 설치나 링크 클릭을 유도하고 있다.	 발송 문자의 내용도 다양하다.	 ' 위축된 경제위기 극복을 위해 지급하는 '재난지원금' 신청하기▼http:	//***' '긴급재난자금 상품권이 도착했습니다 https:	//***' 등이 최근 확인된 스미싱 수법의 사례다.	 문자에는 인터넷 주소가 있는 것이 특징이다.	무심코 링크를 클릭하면 자신의 개인정보나 금융정보 등이 보이스피싱 조직에게 넘어간다고 봐야 한다.	 유출된 개인정보는 향후 친인척을 가장해 돈이나 문화상품권 PIN 번호 등을 요구하는 보이스피싱에 활용된다.	 당장 피해가 발생하지는 않아도 언제든 이들의 먹잇감이 될 수 있는 것이다.	코로나19로 인해 소비심리가 위축되고 소상공인들은 경제적 어려움을 겪고 있다.	 정부는 이런 상황을 감안해 소상공인에 대한 정부 지원 대출을 대폭 늘리고 있다."
275,"재난지원금 노린 보이스피싱...""아차!"" 하는 순간 당한다--1","보이스피싱 범죄자들에게는 이것도 좋은 기회가 되고 있다.	 한 푼이라도 더 아끼려는 소상공인들을 저금리 대출로 전환해 주겠다며 유인하는 방식이다.	 이들은 정부 지원 대출을 빙자한 문자메시지를 보내고 상담번호를 남긴다.	 여기에 전화를 걸면 '신용등급 상향이 필요하다'는 명목으로 계좌이체를 요구하거나 원격제어 앱 설치를 유도한다.	 이후 공인인증서, OTP 등의 금융정보를 빼내 금원을 편취하는 수법이다.	피해자와 직접 만나 돈을 갈취하는 '대면 접촉형'도 있다.	 이런 경우 대부분은 금융기관 직원을 사칭한다.	 이들은 자신들이 빼낸 개인정보를 통해 돈이 필요한 사람들에게 전화를 건다.	 피해자의 절박한 현실을 악용해 ""정부지원금을 통해 저금리 대출을 해 주겠다""며 솔깃한 제안을 한다.	 그러면서 ""상환능력 확인을 위해 직접 만나자""고 한 후 돈을 갈취한다.	한 피해자의 경우 ""기존 대출을 상환하면 마이너스 통장을 개설해 주겠다""는 금융기관 직원을 사칭한 전화에 속아 악성 앱을 설치했다.	 이 앱을 통해 그의 개인정보를 확인한 보이스피싱 콜센터는 거짓 계좌를 보내 수백만원을 가로챘다.	이처럼 최근 코로나19와 관련, 정부 등에서 지원하는 긴급재난지원금이나 정부지원대출 안내 메시지를 가장한 보이스피싱 및 스미싱 범죄가 기승을 부리고 있다.	경찰은 정부지원대출 안내를 빙자해 계좌이체를 요구하는 사례, 원격제어 앱을 설치하도록 유도한 뒤 공인인증서, 일회용 비밀번호 등 금융정보를 알아내 돈을 편취하는 사례 등도 주의해야 한다고 당부했다.	정부도 이와 관련해 대응하고 있다.	 개인정보 불법 유포를 집중 모니터링하고 있으며 탐지된 개인정보는 '정보통신망'법에 따라 사업자와 협력해 삭제 조치를 하고 있으며, 개인정보 법령 위반사항이 발견되면 수사기관에 즉시 수사 의뢰하도록 하고 있다.	더욱 심각한 것은 최근 '보이스피싱 장비' 밀수입이 급증하고 있다는 점이다.	 인천본부세관에 따르면 올해 4월 이후 인천공항을 통해 들여오는 보이스피싱 기기의 적발 건수가 부쩍 늘어났다.	 지난해부터 올해 3월까지와 비교하면 약 10배 이상 증가했다고 한다.'	보이스피싱 기기'는 해외 범죄자가 인터넷 전화로 발신하면 국내 수신자에게는 불법으로 확보된 국내 전화번호로 바꿔 표시해 주는 일종의 중계기 역할을 하는 것이다."
276,"재난지원금 노린 보이스피싱...""아차!"" 하는 순간 당한다--2"," 세관 측은 이런 현상에 대해 보이스피싱 조직이 정부 긴급재난지원금을 노린 것으로 보고 있다.	 이들 장비 대부분은 해외직구를 통해 들여오고 있다.	 기존에는 보따리상이 직접 해외에서 가져왔으나 코로나19로 해외 출입국이 어려워지자 경로를 바꾼 것이다.	 이에 따라 세관 측은 경찰 등 유관기관과 정보를 공유하며 단속을 강화하고 있다.	보이스피싱 피해는 한 번 피해를 당하면 사실상 회복 불능이다.	 실제 피해 회복 비율이 0.5%인 것을 감안하면 갈취당한 돈을 찾는다는 건 현실적으로 어렵다고 봐야 한다.	 이 때문에 피해를 당하지 않는 가장 최선의 방법은 '철저한 예방'이다.	먼저 현행 긴급재난지원금 관련 공공기관이나 지자체가 보내는 문자메시지에는 인터넷 주소 링크가 포함돼 있지 않다.	 경찰은 ""받은 문자메시지에 인터넷 주소가 포함돼 있으면 일단 스미싱으로 의심하고 절대 클릭하면 안 된다.	 이럴 경우 문자에 첨부된 링크를 인터넷을 통해 검색해 본다거나 즉시 삭제해야 한다""고 당부하고 있다.	휴대전화 보안을 강화하는 방법도 있다.	 문자에 포함된 악성 링크를 클릭했을 경우를 대비해 '보안 설정'에서 '출처를 알 수 없는 앱'을 '허용하지 않음'으로 설정하는 것이 좋다.	 이렇게 하면 링크를 클릭한 후에 자신도 모르는 사이에 정체불명의 앱이 내 스마트폰에 설치되는 것을 막을 수 있다.	통신사 고객센터를 통해 소액결제 한도를 축소해 놓거나 차단해 놓는 것도 피해를 막거나 줄이는 방법 중 하나다.	 그래도 불안하다면 스미싱 여부를 판별할 수 있는 관련 앱을 설치하는 것을 권하고 있다.	이들 앱은 스미싱 탐지기능이 제공되기 때문에 의심되는 휴대전화 문자가 오면 '위험 정보'가 뜬다.	 이렇게 이중 삼중 보안을 강화하면 스미싱 사기 피해를 당할 확률이 훨씬 작아진다.	 만약 피해를 당했을 경우에는 경찰청 사이버테러 대응센터로 신고한다.""	나는 절대 안 당한다""는 절대적 자신감이 가장 위험하다.	 인터넷 사기나 스미싱 사기 피해자가 되지 않으려면 이와 관련한 예방이 최선이라는 것을 명심해야 한다."
277,"재난지원금 노린 보이스피싱...""아차!"" 하는 순간 당한다--3"," 새로 등장한 수법들은 '아차!'	 하는 순간에 당하는 게 특징이다.	 말 그대로 '눈 감으면 코 베어가는 방식'이다.	 보이스피싱 범죄는 국내 정치나 사회현상에 민감하다.	 이슈와 시의성을 이용해 신상품처럼 끊임없이 기발한 수법들을 개발하기 때문이다.	보이스피싱은 고도의 전문성이 필요한 지능범죄다.	 전화를 거는 조직원들은 '심리 전문가' 뺨칠 정도로 사람 속이는 데 능숙하다.	 인간 본성에서 가장 취약한 곳을 찾아 겁을 주고, 믿음을 갖게 하면서 소중한 재산을 빼앗아간다.	최근 보이스피싱은 이전과는 다른 풍속도를 보여주고 있다.	 신종 수법은 피해자들의 상상을 초월하며 '허'를 찌른다.	 국내 이슈와 현안을 이용한 기발한 수법도 등장했다.	 대학수학능력시험 때는 특정 학교의 수험생 명단을 입수한 후 ""대학 입시에 추가 합격됐다""고 속여 등록금을 자신들의 계좌로 보내도록 유도한다.	 대학수학능력시험 합격자가 발표되는 12월에 가장 극성을 부린다.	전화로 통화하고 얼굴을 직접 마주하는 '대면형 보이스피싱' 피해도 크게 늘어나고 있다.	 금융감독원 직원을 사칭한 19살 남성에게 결혼자금 1억원을 넘긴 피해 여성도 있었다.	 정장을 입고 서류가방을 들고 금감원 직원을 사칭한 보이스피싱 행동책에게 꼼짝없이 속은 것이다.	 위조한 가짜 신분증으로 피해자를 믿게 했다.	이뿐만이 아니다.	 피해자에게 전화를 걸어 금융기관 직원을 사칭한 후 ""개인정보가 유출돼 예금이 위험하다""며 돈을 인출하라고 했다.	 그런 다음 돈을 집에 보관하도록 한 뒤 그 집에 침입해 훔치는 '절도형 보이스피싱'까지 등장했다."
278,"재난지원금 노린 보이스피싱...""아차!"" 하는 순간 당한다--4","미분양된 아파트를 '프리미엄'이 붙어 전매된 아파트라고 속여 비싼 값에 분양하거나, 분양권을 보유하지 않았으면서 계약서를 위조해 싼값으로 분양해 주겠다고 접근하는 방법도 있다.2006년 중반 이후부터 시작된 중국발 보이스피싱의 전통적인 수법은 '국세청이나 건강보험공단 등' 기관을 사칭하고, 피해자에게 ""공공요금을 환급해 준다""며 현금인출기 앞으로 달려가게 하는 것이었다.	 금융기관이나 수사기관을 사칭해 피해자의 계좌가 범죄에 연루돼 안전 조치가 필요하다며 계좌에 있는 돈을 이체하도록 요구하는 일도 있었다.	전화로 공공기관이나 금융기관을 사칭할 때는 의심부터 해야 한다.	 이런 때는 전화를 건 사람이 어느 부서의 누구인지를 물어본 후 전화를 끊는다.	 해당 기관에 문의해 전화를 건 당사자가 실제 근무하는지를 확인한 후 직접 통화해야 한다.	 녹음된 멘트로 시작되는 전화도 마찬가지다.	 열에 아홉은 사기 전화 아니면 영업용 전화다.	 수사기관에서 녹음된 멘트로 전화하는 일은 없다.	 공공기관이나 신용카드사 등에서도 대개 서면을 이용한다.	전화로 개인정보나 금융정보를 상세히 물을 때도 사기 전화일 확률이 높다.	 공공기관이나 금융기관에서는 신분을 확인하기 위해 주민등록번호 뒷자리까지 물어보지는 않는다.	 '현금지급기 조작'을 지시하는 경우에는 100% 사기로 보면 된다.	 은행 직원이나 타인에게 이야기하지 말라고 하는 것도 의심받을 행동이다.	휴대전화에 뜨는 상대방의 전화번호를 그대로 믿어서는 안 된다.	 보이스피싱 조직들은 신뢰성을 높이기 위해 수사기관이나 공공기관인 것처럼 전화번호를 바꾼다.	 일명 '전화번호 변작' 수법이다.	 사기범들은 얼마든지 원하는 전화번호로 바꿀 수 있다.	 여기에는 국내 별정통신업체들이 관여돼 있다는 의혹도 제기된다.	자녀가 있는 부모에게 아들과 딸이 납치된 것처럼 꾸며 돈을 요구하는 수법은 고전 중의 고전이다.	 그런데도 여전히 먹히고 있다."
279,"재난지원금 노린 보이스피싱...""아차!"" 하는 순간 당한다--5"," 자녀의 안전이 걱정된 부모들은 사기범의 요구에 따를 수밖에 없기 때문이다.	 해외 유학생이나 군 복무 중인 자녀의 부모도 예외가 아니다.	자녀들과 바로 연락이 안 되는 특수 상황인 것을 알고는 납치나 사고를 빙자해 돈을 요구한다.	 주로 50대 이상 장년층과 노년층을 대상으로 한다.	 이런 전화를 받았을 경우에는 조직원의 요구에 즉각 대응하지 말고, 자녀의 소재를 파악하거나 수사기관에 신고해야 한다."
