125,"""급발진"" 의문 테슬라 사고…배터리·전자개폐가 독 됐다--1"," 윤씨는 윤 총장과 사법연수원 기수는 차이가 있지만 충암고, 서울대 법대 동기다.	 윤 총장은 법무부의 검사징계위원회가 열렸던 전날 윤씨의 빈소를 찾아 조문한 것으로 전해졌다.	 테슬라 차량의 '급발진' 의심 사례는 해외에서도 종종 발생해왔다.	 2017년 미국에 거주하던 배우 겸 가수 손지창씨가 급발진 사고를 주장하며 미 도로교통안전국에 소송을 제기한 일이 대표적이다.	 손씨는 ""차고로 진입하는 순간 웽 하는 굉음과 함께 차가 차고 벽을 뚫고 거실로 처박혔다""고 주장했다.	 테슬라 차량에 대한 논란이 끊이지 않자 지난 1월, NHTSA는 급발진 위험에 대한 예비조사에 착수하기도 했다.	 당시 NHTSA가 부분 공개한 조사·리콜 요구 청원에 따르면, 미국에서 접수된 테슬라 차량 급발진 민원은 127건으로, 이 중 110건이 충돌 사고로 이어졌다.	 급발진 의심 사고로 인한 부상자도 50명을 넘는 것으로 조사됐다.	 테슬라는 현재까지 급발진 의혹을 인정하지 않고 있다.	 앞서 테슬라는 ""급발진 의혹은 테슬라 주식을 전문적으로 공매도하는 쇼트 셀러 세력들에서 제기된 것""이라며 ""급발진을 주장한 모든 사고를 조사했지만, 차량에 문제가 없었다""고 음모론을 내세우며 반박했다.	전기차에 대한 소비자들의 관심이 높아지면서 국내 테슬라 차량 판매량도 급증세를 보이고 있다.	 테슬라가 국내 판매를 개시한 2017년 이후 올해 11월까지 누적 판매량은 1만4923대다.	 전체 판매량의 77.7%인 1만1601대가 올 들어 판매됐다."
126,"故김성재 전 연인, 약물분석가 상대 10억대 손배소 패소--0","그룹 '듀스'의 멤버 고 김성재씨를 살해한 혐의를 받았다가 무죄로 풀려난 전 여자친구가 사건 당시 약물 분석 전문가를 상대로 낸 10억원대 손해배상 청구 소송에서 패소했다.	 서울중앙지법 민사합의14부는 2일 김씨의 전 여자친구 A씨가 약물 분석 전문가 B씨를 상대로 낸 10억원 상당의 손해배상 청구 소송에서 원고 패소 판결했다.	A씨는 지난해 10월 ""김씨 사망과 관련해 대법원에서 무죄 판결을 확정받았는데도, B씨가 방송과 강연 등에서 내가 김씨를 살해한 것처럼 말해 명예를 훼손했다""며 소송을 제기했다.	 김씨 사망 원인으로 지목된 동물마취제는 마약으로 봐야 하는데, B씨가 이를 독극물인 것처럼 공개적으로 언급해 자신을 살해 용의자처럼 보이게 했다는 것이다.	재판부는 이날 ""원고가 허위라고 주장하는 사실들을 검토했으나 인정할 수 없다""며 ""원고의 청구를 기각하고 소송 비용은 원고가 부담하라""며 A씨의 주장을 받아들이지 않았다.	힙합 듀오 듀스로 활동하며 큰 인기를 끌었던 김씨는 1995년 11월20일 한 호텔 객실에서 숨진 채 발견됐다.	 당시 김씨의 시신에서는 28개의 주삿바늘 자국이 확인됐고, 이후 사인이 '졸레틸'이라는 동물마취제 때문이라는 사실이 확인됐다.	 이후 김씨의 사망 경위와 과정을 놓고 각종 추측과 논란이 일었다.	당시 김씨와 연인 사이였던 것으로 알려진 A씨는 유력한 용의자로 지목됐고, 경찰과 검찰 수사를 거쳐 살인 혐의로 재판에 넘겨졌지만 대법원에서 무죄가 확정됐다.	지난해 SBS '그것이 알고 싶다'는 김씨 사망 사건을 다룬 방송을 시도했으나 A씨가 방송금지 가처분 신청을 내면서 무산됐다.	 '그것이 알고 싶다' 측은 수 개월에 걸쳐 고인의 부검 보고서와 전문가 인터뷰 등을 종합해 방송을 준비했다고 주장했다.	 그러나 법원은 해당 방송이 나갈 경우 A씨의 인격권과 명예를 실추시킬 우려가 있는 점을 지적하며 방송금지 가처분 신청을 받아들였다."
127,"文대통령 ""방역방해 엄정 법집행…필요시 현행범 체포""--0","문재인 대통령이 8월21일 신종 코로나바이러스 감염증 방역 과정에서 일부 교회 등이 협조하지 않는 상황과 관련해 ""방역을 방해하는 일에 대해 현행범 체포나 구속영장 청구 등 엄정하게 법을 집행하라""고 지시했다.	문 대통령은 이날 방역 상황 점검을 위해 서울시청을 방문한 자리에서 ""역학조사 등을 방해하는 행위에는 감염병관리법뿐만 아니라 공무집행 방해나 형사 범죄를 적용해 단호하게 대응하라""며 이처럼 밝혔다.	 일부 교회가 방역에 필요한 교인 명단을 제출하지 않는 등 방역에 비협조적인 모습을 보이는 상황에서 방역당국에 강력한 대응을 주문함과 동시에 전폭적인 지원을 약속한 것이다.	문 대통령은 ""K방역의 핵심은 밀접 접촉자를 신속하게 확인하고, 진단·검사하고, 확진자를 신속하게 격리·치료하는 것인데 이를 방해하는 일들이 조직적으로 행해지고 있다""고 지적했다.	앞서 방역당국은 8월20일 집단감염이 발생한 서울 성북구 장위동 사랑제일교회에서 교인 명단 확보를 시도했다.	 그러나 교회 측의 저항으로 밤샘 대치를 하는 등 방역 활동에 어려움을 겪고 있다.	문 대통령은 서울시에 행정력을 총동원할 것을 주문했다.	 그는 ""무엇보다 중요한 건 아주 신속하고 선제적이고 단호한 대응""이라며 ""출입통제가 필요하면 출입을 통제하고, 집합이 금지돼야 하는 곳은 반드시 집합이 금지되게 하고, 행정조사가 필요한 곳은 신속한 행정조사로 자료를 확보하라""고 지시했다.	 문 대통령은 이어 ""서울시 힘으로 부족하면 경찰과 중앙정부 지원을 구하라""며 ""공권력이 살아있다는 것을 꼭 보여주기 바란다""고 강조했다.	또 문 대통령은 ""저는 국민 인권을 침해할 소지가 있어 공권력 행사는 최소화해야 한다고 생각한다""면서도 ""방역은 국민의 생명과 안전에 직결되므로 공권력이 충분히 국민을 보호해야 한다""고 말했다.	 그는 이어 ""코로나19가 우리나라에 들어온 이후 최대의 위기로, 서울의 방역이 무너지면 전국의 방역이 무너진다""며 ""서울 방역을 사수해 대한민국 전체의 안전을 지킨다는 결의로 임해 달라""고 덧붙였다."
128,"""아베노마스크""로 조롱받는 아베, 위기 몰리나--0","일본 사이타마현 가스카베시에 살고 있는 회사원 A씨는 '코로나19 긴급사태'가 선언된 지 일주일이 지났지만, 여전히 도쿄도 내 회사로 출퇴근하고 있다.	 고객전화 응대라는 업무의 특성상 그리고 재택근무용 PC가 부족하다는 이유에서다.	 회사에서는 특별휴가 제도를 마련하고 출근시간을 조정해 동시에 근무하는 직원 수를 줄였지만, 여전히 불안하다.	 집에서 회사까지는 한 시간 반이나 걸리고 전철도 두 번이나 갈아타야 한다.	 긴급사태 선언 전보다는 전철에 탄 사람이 줄었지만, 도쿄에 가까워질수록 승객도 늘어난다.	 같이 살고 있는 93세 어머니도 걱정이다.	 출퇴근 과정에서 자신도 모르는 새 감염돼 어머니에게 바이러스를 옮길까 염려돼서다.	 불편한 점도 있다.	 항상 퇴근 후에 식료품 등을 사서 집으로 돌아갔지만, 퇴근이 늦어지면서 이도 불가능하게 되었다.	 긴급사태 선언 후에 상점들이 영업시간을 조정해 일찍 문 닫는 가게가 늘어났기 때문이다.	코로나19 사태가 장기화하는 가운데, 일본 정부가 내놓은 처방전의 실효성을 두고 논란이 확산하고 있다.	 4월7일 아베 신조 총리는 긴급사태를 선언한 뒤 7개 지자체에 있는 기업들에 출근자를 최소 70% 감소시킬 것을 요청했다.	 문제는 근무 내용과 근무 환경 등에 대해 강제성이 있는 가이드라인이 없다 보니, 여전히 출근하는 사람의 비율이 높다는 것이다.	 일본 정부가 코로나19 사태의 심각성을 인지하지 못한 채 근시안적 대책만 내놓다는 비판이 일면서, 공고하던 아베 내각의 지지율에도 금이 가기 시작했다.	긴급사태 선언 이후 도쿄 도심의 번화가는 비교적 한산해졌다.	 백화점·쇼핑몰 등은 긴급사태 기간 동안 임시휴업에 들어갔다.	 스타벅스의 경우 긴급사태가 내려진 7개 지자체의 점포 모두가 휴업에 들어갔다.	 그 외 도시들의 지점들도 단축영업을 하기로 결정했다.	 해가 진 이후의 풍경도 바뀌었다.	 대표적인 유흥가인 신주쿠의 가부키초에서는 밤이 되면 경찰들이 순찰을 돌며 시민들에게 집으로 돌아갈 것을 권유한다."
129,"""아베노마스크""로 조롱받는 아베, 위기 몰리나--1","일본 정부가 발표한 데이터에 따르면 긴급사태 선언 이후 사람들의 왕래는 다소 줄어들었다.	 일례로 요코하마나 오사카의 우메다는 40% 이상 왕래가 줄기도 했다.	 애플이 지도 애플리케이션 '애플 맵' 이용 데이터를 통해 산출한 결과를 보면 도쿄의 경우 선언 다음 날인 4월8일, 지난 1월에 비해 공공 교통기관을 통한 이동이 39% 줄었다.	 일본 전체의 경우 29% 가까이 감소했다.	 분명 사람들 간 왕래는 다소 줄었다.	 그러나 뒤집어 말해 일본 국민 10명 중 7명은 여전히 코로나19 확산 이전과 같이 야외활동을 하고 있는 셈이다.	 앞서 뉴욕의 경우 4월8일 기준, 지난 1월 같은 기간에 비해 87% 왕래가 감소한 것과 큰 차이를 보인다.	실제 일본 주택가는 평소보다 번잡해지기 시작했다.	 재택근무가 늘어난 만큼 여유로운 아침 시간에 공원을 산책하거나 조깅하는 사람도 늘었다.	 '긴급사태 선언'이라는 거창한 이름을 달고 있지만 어디까지나 외출 자제를 요청하는 조치이기에 강제성이 없다.	 결국 긴급사태 효과에 대한 의문도 커지고 있다.	 특히 사태 선언이 너무 늦은 것 아니냐는 지적도 많다.	긴급사태 선언의 실효성을 두고 논란이 확산하는 가운데, 아베 총리의 '행실'까지 도마에 올랐다.	 아베 총리는 사람과 사람의 접촉을 최저 70%, 최대 80%까지 줄이기를 요청한 다음 날인 4월12일 '집에서의 시간'을 홍보하는 영상을 자신의 SNS에 올렸다.	 사회적 거리 두기를 권장하기 위해 만들어진 이 동영상에는 아베 총리의 여유로운 일상이 담겼다.	 동영상 속 아베 총리는 인기 가수 호시노 겐의 노래를 배경으로 자택에서 차를 마시며 책을 읽고, 개와 놀며 여유로운 시간을 보낸다.	 아베 총리는 ""친구와 만날 수 없다.	 회식을 할 수도 없다.	 하지만 여러분들의 이와 같은 행동이 많은 사람을 구한다""고 말한다.	 영상은 4월15일 기준 '좋아요'가 40만 건에 달한다."
130,"""아베노마스크""로 조롱받는 아베, 위기 몰리나--2"," 그러나 정작 대중의 평가는 냉담하다.	 긴급한 사태에도 정부 책임자는 국민의 세금으로 우아한 시간을 보내고 있다는 비판적 댓글이 다수 달렸다.	 정부가 자숙만을 요청할 뿐 적절한 보상안을 제시하지 못했다는 의견도 나왔다.	 입헌민주당 소속 참의원 렌호는 아베 총리의 영상을 두고 ""자신의 동영상이나 연예인 동영상을 올리지 말고 '자숙과 보상이 세트'인 정책을 마련하라""고 주장했다.	 아사히신문 보도에 따르면 여당 자민당의 한 중견 의원 또한 ""이 시점에 여유롭게 시간을 보내고 있는 총리의 모습을 보고 싶은 사람이 과연 있을까.	 '그건 잘못됐습니다'라고 왜 누구도 말해 주지 않았는가""라는 지적을 내놓기도 했다.	아베 총리를 향한 비판은 이뿐만이 아니다.	 아베 총리는 코로나19 대책 중 하나로 면마스크를 두 장씩 전 세대에 배부하겠다는 계획을 발표했다가 여론의 뭇매를 맞았다.	 효과가 의문시되는 면마스크를 세대당 두 장씩만 배부하는 것은 실효성이 떨어지는 대책이란 것이다.	 일본 대중은 이 마스크를 경기 부양책 '아베노믹스'에 빗대 '아베노마스크'라고 부르며 정부를 조롱했다.	 아베노마스크를 만드는 데 일본 정부는 466억 엔을 투입한 것으로 알려졌다.	 세금 낭비라는 목소리가 크지만 일본 정부는 아랑곳하지 않는 모양새다.	 4월14일 아베 총리는 일본 중의원 본회의에서 ""면마스크는 일회용이 아니라 재사용이 가능하고 부족한 마스크 수요에 대응하는 측면에서 아주 유용하다""며 합리적 대응책이라고 자평했다.	 하지만 여당 의원들로부터 막대한 국민 세금을 효과가 불분명한 마스크에 사용하기보다 휴업 보상이나 의료 현장에 투입해야 하는 것 아니냐는 지적을 받았다.	현재 아베 총리는 일본의 코로나19 대응이 외국에 비해 늦지 않았다며, 늑장대응이라는 지적은 합당하지 않다고 항변하고 있다.	 그러나 일본 정부와 일본 국민의 평가는 다른 듯하다.	 4월14일 발표된 NHK의 여론조사에 따르면 아베 내각을 지지한다는 대답은 38%에 그쳤다.	 긴급사태 선언 이후인 4월10일부터 3일 동안 이루어진 조사 결과다.	 3월에 비해 4%포인트 하락한 수치다.	 일본 정부의 코로나19 대응을 어떻게 평가하는지도 같이 조사했는데 '아주 좋게 평가한다'와 '그럭저럭 좋게 평가한다'가 46%, '별로 좋게 평가하지 않는다' '전혀 좋게 평가하지 않는다'가 50%의 응답을 얻었다."
131,"""아베노마스크""로 조롱받는 아베, 위기 몰리나--3", 긴급사태 선언 시기에 대한 설문에는 '너무 늦었다'는 대답이 75%로 '적절한 타이밍이었다'는 대답 17%를 압도했다.
132,"소연평도서 실종된 어업지도원, 북한 해역서 발견 정황--0","북한에서 약 10km 떨어진 데 위치한 서해의 소연평도에서 지난 21일 실종된 것으로 나타난 어업지도선 공무원이 23일 북한 해역에서 발견됐다는 정황을 파악했다고 군 당국이 밝혔다.	국방부는 이날 ""지난 21일 낮 12시51분쯤 소연평도 남방으로 2km 떨어진 해상에서 해양수산부 소속 어업지도선 선원 1명이 실종됐다는 신고가 해양경찰청에 접수됐었다""며 ""군 첩보에 의하면 22일 오후 실종자가 북한 해역에서 발견된 정황을 포착해 상황을 파악 중""이라고 말했다.	 이어 ""관계 당국은 실종 경위 및 경로 조사와 함께 북측에 관련 사실을 확인하는 등 필요한 조치를 취할 것""이라고 덧붙였다.	군 당국은 현재 실종자의 생존 가능성이 있다고 판단하고 있다.	 실종자는 목포 소재 서해어업지도관리단 소속 해양수산서기 A씨로 나타났다.	 A씨는 실종 당일 어업지도선을 타고 NLL 근처 해역에서 업무를 수행 중이었다.	 실종 당일 동승 선원들은 점심시간인 오전 11시30분부터 A씨가 보이지 않아 선내와 인근 해상을 수색했다.	 결국 선상에서 A씨의 신발만 발견해 해양경찰에 신고한 것으로 알려졌다.	 A씨가 실종된 곳은 NLL에서 남쪽으로 10여km 떨어진 곳으로 추정되며, 이는 소연평도에서 남쪽으로 2km 떨어진 지점이다.	신고 접수 후 군과 경찰은 해양경찰 및 해군함정, 해수부 선박, 항공기 등 약 20여 대를 투입해 실종자를 찾고 있지만, 아직 실종자를 찾지 못했다.	 군은 A씨가 실종된 장소와 확보한 첩보 등 관련 정황을 통해 A씨가 조류에 휩쓸려 북측으로 넘어갔을 가능성과 월북 가능성을 열어 두고 구체적인 경위를 파악하고 있다.	군 당국은 '북측에 사실이 필요하다'고 밝힌 만큼 남북 군 통신선, 유엔사 채널 또는 판문점 적십자 채널 등을 통해 북측에 연락을 취할 것으로 보인다.	 실종자가 북측에 있는 사실이 확인되면 북측에 소환을 요청할 것으로 예상된다."
133,"정부, ""방역 때리기"" 반박…""숨진 관장, 헬스장 운영 안 해""--0","대구에 거주하는 50대 관장 A씨의 사망 사건을 두고 '방역 형평성' 논란이 제기된 가운데, 정부가 A씨는 집합금지 업종인 헬스장을 운영하지 않았다고 반박했다.	 손영래 중앙사고수습본부 전략기획반장은 5일  간담회를 통해 "" 해당 시설은 일반적인 헬스장이 아닌 장애인 재활 목적의 특수 체육시설이었고, 집합금지 대상이 아니었다""고 밝혔다.	또 ""대구시는  2단계로 헬스장 전체를 금지하지 않고, 저녁 9시 이후 운영을 금지했다""며 ""극단적 선택 경위는 알 길이 없고 명료하지 않은 상황에서, 그 동기를 코로나19로 인한 생계 고민으로 확정한 건 부적절하다는 판단""이라고 설명했다.	대구소방본부와 경찰 등에 따르면, A씨는 새해 첫날인 지난 1일 오후 6시40분께 자신이 운영하던 시설에서 숨진 채 발견됐다.	 그는 ""가족에게 미안하다""는 내용의 메모를 남긴 것으로 알려졌다.	 이후 온라인 커뮤니티에는 A씨가 생전에 헬스장을 운영했고, 지난해 신천지 사태 이후 어려움을 겪다 최근 강화된 방역 조치 등으로 힘들어했을 것이란 추측성 글이 잇달이 올라왔다.	 이에 야당은 정부의 거리두기 및 방역 수칙에 일관성이 없는 점을 지적하며, 현실과 동떨어진 정책 때문에 안타까운 희생이 발생했다고 비판했다.	 이용 국민의힘 의원은 4일  회견을 통해 ""코로나로 인해 생계가 어렵다고 극단적 선택을 하시는 분들이 있다""며 ""이분들은 어찌 보면 원칙과 기준이 없는 방역 대책이 낳은 무고한 희생이라고 볼 수도 있다.	 이제는 일상 속 방역, 생활 가능한 방역으로 방역의 틀을 바꿔야 한다""고 주장했다.	논란은 수도권 사회적 거리두기 2.5단계를 4일 0시부터 17일까지 2주 연장하면서 더 커졌다.	 태권도, 요가, 발레학원 등도 학원이나 교습소 형태로 등록된 경우는 동 시간대 입장 인원을 9명 이내로 유지하면서 운영하도록 허용했지만, 헬스장 등 일부 실내체육시설은 집합금지 대상으로 분류해 형평성 논란이 제기됐다.	전국 헬스장 운영자들은 정부 정책에 반발해 영업을 강행하는 등 마찰을 빚기도 했다.	 헬스장 업주들은 ""9대1 교습은 허용하면서 통상 1대1 교습이 진행되는 헬스장 영업을 제한하는 것은 현실과 맞지 않고 형평성에도 어긋난다""고 주장했다.	  정은경 질병관리청장은 전날 정례 브리핑에서 이같은 목소리에 대해 ""어떤 실내체육시설이 집합금지 대상으로 된 것은 운동하면서 비말이 나오거나 마스크를 착용하기 어려운 측면을 반영한 것으로 생각된다""면서 ""형평성이나 사회적 거리두기의 시설별 업종별 위험도, 조치 내용에 대해 계속 평가해서 보완하도록 중수본, 중대본과 합의하겠다""고 설명했다."
134,"[울산24시] ""UNIST, 울릉도·독도 해수자원화 연구 개발 착수""--0","UNIST가 경상북도와 손을 잡고 울릉도·독도 해수자원화 연구 개발에 나선다.	 UNIST는 경상북도·한국해양과학기술원과 울릉도·독도 해수자원화 연구 개발 및 활용 활성화를 위한 업무협약을 체결했다고 밝혔다.	이들 기관은 업무협약을 계기로 울릉도ㆍ독도 해수자원화 연구 개발 및 활용 활성화를 통한 환동해권 해양신산업 창출을 위해 기관 간 상호협력, 연구 장비 및 시설 공동 활용, 인적·정보·학술교류 등 활발한 연구 협력을 진행할 예정이다.	UNIST 해수자원화기술연구센터는 정부와 울산시의 지원으로 바닷물 속 나트륨 이온을 이용해 전기를 저장하고 발생하는 해수전지 원천기술을 확보하고 있다.	 이를 토대로 개발한 해양특화전지, 에너지 독립형 어망용 GPS 부이, 해수담수화 장치 등은 해양환경에서의 활용도가 높아 울릉도·독도 해역의 해양과학 연구 및 정보통신기술기반 수산자원 육성 등 다양한 분야에 활용이 기대된다.	특히 울릉도ㆍ독도는 우리나라에서 맑은 날이 가장 적은 지역으로 겨울철 일조량이 크게 낮아 태양열 전지에 의존하는 해양기상관측 부이의 경우 겨울철 운영에 크게 어려움이 많았다.	이번 업무협약 체결을 통해 기존 태양열 전지 외에 해수전지 기술이 도입되면 울릉도·독도 해역의 해양기상관측 부이의 안정적 운영을 비롯해 표층 해류 관측을 위한 GPS 장착 부이 활용, 외해수중가두리 양식장의 실시간 해양환경 측정, 실시간 울릉도·독도 수중 경관 모니터링 등 다양한 분야에 폭넓게 활용될 것으로 예상된다.	울릉도·독도해양연구기지는 경상북도와 울릉군이 독도 해양영토주권 수호 및 울릉권역 해양자원 개발 연구 거점 확보를 위해 2013년 울릉도에 설립한 연구소다.	 지난 2014년부터 한국해양과학기술원이 위탁운영을 맡아 울릉도·독도 해역의 실시간 해양관측부이, 표층 가두리 양식시설 등을 운영하고 있으며, 2021년 취항 목표로 다목적 독도 소형 전용 조사선 건조를 추진하고 있다.	울산시는 여름철 태풍·홍수·호우 등 각종 풍수해 발생에 대비해 시민들의 사유재산을 지키기 위해 `풍수해 보험` 가입을 권장한다고 밝혔다.	 풍수해 보험은 행정안전부가 관장하고 민영보험사가 운영하는 정책보험으로서 보험가입자가 부담해야 하는 보험료의 일부를 국가나 지자체에서 보조함으로서 국민은 저렴한 보험료로 예기치 못한 풍수해에 대해 스스로 대처할 수 있도록 하는 선진국형 재난관리제도다.	풍수해 피해 발생시 피해 금액의 일부만 지원되는 정부 재난지원금과 달리 가입자 선택에 따라 피해 복구비용의 최대 92%까지 보상을 받을 수 있다.	 보험 가입 대상은 주택, 온실, 소상공인이 운영하는 상가·공장이며 소유자 및 세입자 누구나 가입이 가능하다.	 특히 올해부터 소상공인 풍수해보험 지원사업이 전국적으로 확대 시행되면서 지역 소상공인 사업자도 가입할 수 있다.	 소상공인은 `소상공인 보호 및 지원에 관한 법률` 제2조, `중소기업기본법`제2조 제2항에 따른 소기업 중 상시 근로자수가 광업, 제조업, 건설업 및 운수업은 10명 미만, 그 외 업종은 5명 미만인 기업 또는 중소벤처기업부의 소상공인 확인서를 받은 자이다.	울산시는 에스케이이노베이션 울산콤플렉스가 코로나19로 위축된 지역경제 활성화를 위해 '울산페이 소비촉진 캠페인'에 동참한다고 밝혔다.	 이 회사는 지난 4월부터 950여 명의 임직원이 10억여 원 상당의 울산페이 구매에 동참했다.	 이어 5월부터는 구매한 울산페이의 본격적인 소비촉진 운동에 나서기로 했다.	 25일 중구 태화동 장애인 고용 제빵 작업장인 '시민베이커리'에서 진행되는 캠페인에는 송철호 울산시장과 에스케이이노베이션 울산콤플렉스 박경환 총괄 부사장, 이성훈 노동조합위원장 등이 참석해 시민베이커리에서 빵과 과자를 맛본 후 울산페이로 결제하고 소비촉진에 앞장서기로 했다.	에스케이이노베이션 울산콤플렉스 박경환 총괄 부사장은 ""코로나19 장기화로 정유산업도 전례 없는 경영난을 겪고 있지만, 울산 대표기업으로서 지역사회와 어려움을 함께 극복하고자 임직원들이 마음을 한 데 모았다."""
