‘그것이 알고 싶다’ 자동차 영업사원 윤남희 실종사건 추적,"2일 방송되는 SBS ‘그것이 알고 싶다’에서는 자동차 영업사원 윤남희 씨 실종사건에 대해 추적해본다.	‘그것이 알고 싶다’ 제작진에 따르면 2002년 3월, 안산의 한 초등학교 앞에서 승용차 한 대가 발견되었다.	 세워둔 지 오래된 듯 뒷바퀴에는 바람마저 빠져있었고, 차 안에는 누군가의 소지품과 명절 선물세트가 놓여있었다.	 잠시 정차해두고 자리를 비운 듯 가지런하게 놓인 물건들의 주인은 한 달 전 흔적도 없이 실종된 자동차 영업사원 윤남희 씨였다.	설 연휴를 앞두고 있던 2002년 2월 8일 금요일.	 윤남희 씨는 오전부터 둘째 언니를 만나 함께 시장을 보고, 어린이집에 맡겨놓았던 아들을 잠시 데리고 나와 단골 미용실에서 이발도 시켰다.	 실종된 그녀의 차를 발견했을 때 명절 선물세트가 실려 있던 모습에서 그날의 분위기를 예상할 수 있다.	 왜 선물들은 주인을 잃은 채 안산에 버려진 것일까.	 “둘째 언니랑 남희가 같이 있었는데 차 상담을 하겠다고 전화가 왔었다고 하더라고요.	 그래서 동생이 메모했대요.	 그리고 차를 타고 갔었는데….	” -	 윤남희 씨 셋째 언니윤남희 씨의 언니 말에 의하면 그날 윤 씨의 휴대폰으로 두 통의 전화가 걸려왔다고 했다.	 두 통 모두 발신지는 구운동의 공중전화였다.	 전화를 받은 윤 씨는 오후 4시 50분, 고객을 만나기 위해 나선 뒤 18년 동안 집으로 돌아오지 않고 있다.	 과연 그날 윤 씨에게는 무슨 일이 있었던 것일까?	 5년 만에 힘들게 얻었던 아들.	 당시 겨우 22개월밖에 되지 않았던 어린 아들을 두고 그가 사라져야 했던 이유는 과연 무엇이었을까.	 “돈 빠지는 걸 제가 알았어요.	 30만 원씩 뺐잖아요.	 몇 차례에 걸쳐서.	” -	 윤남희 씨 둘째 언니가족은 윤남희 씨 계좌를 살펴보다 실종된 그 날 밤부터 다음날 오전까지, 누군가 윤 씨의 지갑 속 신용카드를 사용한 사실을 알아냈다.	 여러 차례에 걸쳐 신용카드에서 현금을 인출한 흔적을 발견한 경찰은 곧바로 CCTV를 확보했다.	 입수한 CCTV 화면 속 촬영된 영상에는 놀랍게도 윤 씨가 아닌 처음 보는 낯선 남성의 얼굴이 찍혀있었다.	 과연 그는 윤남희 씨의 실종과 어떤 관련이 있는 것일까.	‘그것이 알고 싶다‘ 제작진은 수소문을 통해 당시 은행 CCTV에 촬영되었던 남성을 만날 수 있었다.	 그는 당시 상황을 기억하는 대로 우리에게 전달했다.	 그가 윤 씨의 지갑 속 신용카드를 사용했던 이유는 무엇이었을까?	 혹시 그는 윤 씨의 행방을 알려줄 열쇠를 쥐고 있는 것일까.	명절 선물과 함께 윤남희 씨 소지품이 고스란히 발견된 그녀의 차.	 고객과 판매 차량에 대한 정보가 담긴 윤 씨의 업무수첩도 차량에서 발견되었다.	 수첩의 맨 마지막 페이지에는 실종 당일 윤 씨에게 걸려왔던 두 통의 전화 발신지인 공중전화의 위치와 ‘홍기찬’이란 이름이 함께 적혀 있었다.	 혹시 그가 윤남희 씨가 실종 당일 만났던 마지막 고객일까?	 그렇다면 그가 바로 윤 씨를 해친 범인은 아닐까.	제작진은 윤 씨의 행방을 찾는 한편, 엄마의 생사를 간절히 알고 싶어 하는 아들의 DNA를 채취하여 신원미상 변사자 DNA와 대조해보았다.	 그리고 이 과정에서 국내 실종자 데이터베이스를 관리하는 시스템이 없다는 것을 알게 되었다.	 과연 이를 해결할 방안은 어디에서 찾을 수 있을까.	 2일 토요일 밤 11시 20분에 방영되는 ‘그것이 알고 싶다’ ‘사라진 엄마와 마지막 고객 – 자동차 영업사원 윤남희 씨 실종사건’ 편에서는 2002년 2월 8일, 윤남희 씨에게 무슨 일이 있었던 것인지, 사건 당일 그녀의 행적을 추적해본다.	 이어 국내 실종자 데이터베이스가 체계적으로 관리될 수 있을 방법에 대해서도 고민해본다.	 동아닷컴     / -	 Copyrights ⓒ  무단 전재 및 재배포 금지 -"
[에듀윌] 9급공무원 합격자 수 증가한 비법 공개,"행정안전부가 “올해 전국 지자체 3만2042명의 공무원을 선발할 예정”이라고 밝혔다.	 이는 지난해 신규채용 3만3060명에서 3.1% 감소한 수치다.	  시·도별로는 경기도가 가장 많은 7136명이고, 서울이 3292명, 경북 2828명, 전남 2410명, 경남 2403명 순이다.	 직렬별로는 소방직이 4771명, 사회복지직 2632명, 보건·간호직이 1574명 등이다.	  행안부 관계자는 “소방·사회복지·생활안전 등 주민 삶의 질과 밀접한 현장의 신규 인력의 수요 및 육아휴직 증가 등에 따른 수요를 반영해 결정된 것”이라고 설명했다.	  이번 발표로 공무원 수험생들의 준비도 분주해진 가운데, 종합교육기업 에듀윌이 많은 수의 9급공무원 합격자를 배출해내고 있다.	  2018년과 2019년의 유료 수강생 중 최종 합격자를 비교했을 때 에듀윌의 합격자는 215%로 크게 증가했다.	  에듀윌 관계자는 “교수진이 직접 제작한 복습 요약자료와 5회독 이상 학습을 위한 커리큘럼, 에듀윌 대표 저자 및 16인의 연구진이 감수한 교재 등 다양한 요인이 복합적으로 작용한 결과”라고 설명했다.	  강의 외에도 100명가량의 학습매니저가 지원하는 ‘1:1 밀착관리’와 합격생이 직접 남기는 ‘에듀윌 지식인’, 100분 안에 100문제를 빠르게 풀 수 있도록 지원하는 ’1400문제 문풀훈련소’ 서비스 등을 이용할 수 있다.	  전 과정을 무제한 수강할 수 있고, 합격 시 수강료를 전액 환급하는 혜택을 담은 에듀윌의 9급공무원, 경찰공무원, 소방공무원 강의의 자세한 내용은 홈페이지를 통해 만나볼 수 있다.	     / -	 Copyrights ⓒ  무단 전재 및 재배포 금지 -"
"이랜드, 랜섬웨어 공격받아 긴급 휴점","이랜드그룹이 22일 랜섬웨어 공격을 받아 오프라인 점포의 긴급 휴점 또는 부분 영업에 들어갔다.	 이랜드그룹 측은 “22일 새벽 사내 네트워크 시스템이 랜섬웨어 공격을 받았으며 피해를 최소화하기 위해 네트워크 시스템 일부를 차단했다”고 밝혔다.	 이로 인해 이랜드그룹 계열인 NC백화점, 뉴코아아울렛의 점포 50여 곳 중 절반 가까운 23곳이 영업을 중단하거나 일부 매장만 운영하는 등 피해를 입었다.	 랜섬웨어는 ‘몸값’을 의미하는 ‘랜섬’과 ‘소프트웨어’의 합성어로 컴퓨터 시스템에 침투해 중요 파일에 대한 접근을 차단하고 대가를 요구하는 악성 프로그램이다.	 이랜드그룹은 랜섬웨어 유포 경로 등을 조사하고 복구 작업을 진행하는 한편 경찰에 수사를 의뢰했다.	    / -	 Copyrights ⓒ  무단 전재 및 재배포 금지 -"
‘실화탐사대’ 운전대 잡은 10대+인천여중생 집단 성폭행 사건 추적,"22일 방송되는 MBC ‘실화탐사대’에서는 운전대를 잡은 10대 소년들의 범행과 인천여중생 집단 성폭행 사건의 진실을 파헤친다.	제작진에 따르면 지난 3월 29일 새벽, 대전의 한 교차로에서 오토바이와 승용차가 충돌하는 사고가 일어났다.	 사고를 낸 차는 그대로 도주해버렸고, 오토바이를 타고 배달 아르바이트 중이던 19세 故 이건 씨는 도로 위 홀로 죽음을 맞아야 했다.	그날 가해 차량에 타고 있던 운전자는 놀랍게도 사고 차량의 차주가 아니었다.	 차주는 사고 전날, 주차해둔 차량을 도난당해 경찰에 신고했다.	 건이 씨를 죽음으로 내몬 차량 운전자는 바로 만 13세의 소년이었다.	 게다가 차 안에는 운전자를 제외하고도 7명의 또래들이 함께 타고 있었다.	 그들 중 6명은 현장 부근에서 검거되었으나, 두 명은 감쪽같이 사라졌다.	 그들은 대체 어디로 간 것일까.	유가족은 미안하다는 사과조차 제대로 받지 못했다.	 그런데 유가족을 더욱 고통스럽게 만들었던 것은 SNS에 범죄 사실을 과시하듯 올려놓은 이들의 대범함이었다.	 제작진은 당시 사고 차량에 타고 있었던 동승자 두 명을 어렵게 만나 대전 사망사고에 대해 물을 수 있었다.	 서울에서 차를 훔치기부터 대전에서 사고를 내기까지 만 하루 동안 차로 누빈 곳이 한두 군데가 아니라는 증언.	 이들은 어떻게 운전대를 잡고, 또 범행을 저지르게 된 것일까.	사라진 두 명을 추적하던 제작진은 사고 직후, 세종시에서 일어난 차량 도난사건에 주목했다.	 세종시 도난 차량 차주로부터 충격적인 이야기를 들은 제작진은 대전 사망사고 후 사라진 두 명의 이후 행적을 따라가 봤다.	그리고 취재 도중 더욱 충격적인 사실들이 드러났다.	 전국을 돌아다니던 그들의 화려한 전적이 낱낱이 밝혀진 것.	 차를 훔쳐 탄 것이 처음이 아니었을 뿐더러, 이전에도 수차례 경찰에 검거되었던 학생들이었다.	 과연 그들의 범행을 단순히 ‘비행’이라고 치부할 수 있을까.	 “중학생 다 타고 다니니까, 그 사람들은 사고만 안 나는 것뿐이지 다 타고 다니는데 저희는 사고가 나가지고” 한편, ‘실화탐사대’에서는 최근 구속수사가 시작된 인천 여중생 집단 성폭행 사건에 대해서도 전격 취재했다.	 현재 가해 학생 둘 중 한 명은 사건 당시 오히려 범행을 만류했다며 무죄를 주장하고 있다.	 그런데 사건 발생 16일 후, 피해자 오빠는 두 학생을 만나 1시간가량 범행에 대한 자백을 들었다고 한다.	 그들은 과연 오빠에게 어떤 이야기를 들려줬을까?	 22일 밤 10시 5분 ‘실화탐사대’에서 두 소년의 목소리가 담긴 녹취록을 단독 공개한다.	동아닷컴     / -	 Copyrights ⓒ  무단 전재 및 재배포 금지 -"
[TV북마크] ‘실화탐사대’ 성추행·강간·협박에도 소년범 솜방망이 처벌→공분,"8일 방송한 MBC ‘실화탐사대’가 어머니의 시신을 방치한 채 살아가는 남자와 고등학생에게 성 착취 등의 협박을 당해온 13세 소녀의 안타까운 사연으로 눈길을 끌었다.	제작진은 노모가 사망한 후 약 한 달이 지나도록 장례를 치르지 않고 있다는 한 남성을 찾았다.	 그는 어머니가 돌아가신 후 여자 원피스를 입고 돌아다니거나 인근 식당에서 무전취식을 하는 등 기이한 행동을 일삼았다.	 심지어 집안에 온갖 쓰레기를 모아둔 탓에 악취와 벌레가 들끓어 이웃들의 피해가 이만저만 아니었다.	 지적 장애를 가진 그의 이러한 행동에는 나름의 이유가 있었다.	 그는 집안을 가득 채운 쓰레기들이 대부분 ‘엄마의 물건’이라며 버리고 싶지 않다고 밝혔다.	 그가 입고 다니던 원피스 역시 엄마의 옷이었다.	 아들은 “엄마 생각나서.	 엄마 보고 싶어서”라며 돌아가신 엄마의 흔적을 차마 지우지 못하는 속내를 드러냈다.	 또한 장례를 치르지 못한 이유는 비용을 지불할 능력이 없어서라고 털어놨다.	 그가 지적 장애를 가졌음에도 도움을 받을 수 없는 이유는 장애 등급 때문이었다.	 주민 센터 관계자는 “장애인 연금 신청을 하려면 중증이어야 하는데, 이 분은 신청할 수 있는 등급이 아니”라고 설명했다.	 복지 사각지대에 놓인 그는 어머니에게 배운 대로 교회, 무료 급식소 등을 전전하며 가끔 식사를 제공해주는 이웃들의 도움에 기대고 있었다.	안타까운 사정에 처한 그를 위해 다행히 관계 기관이 나섰다.	 덕분에 어머니의 장례는 무사히 치러졌다.	 관할 구청과 주민 센터 역시 그의 자립을 돕겠다고 약속했다.	 주거 환경 개선을 위해 청소 업체도 나섰다.	 이성규 한국장애인재단 이사장은 “발달 장애 3급이면, 일상생활이 가능하도록 반복적으로 교육하고 적응 훈련을 시키면 될 것 같다”며 홀로서기가 불가능한 일이 아님을 밝혔다.	 ‘실화탐사대’는 지속적인 관리 감독이 가능한 제도 보완의 필요성을 강조하며 그의 앞날을 응원했다.	이날 ‘실화탐사대’ 두 번째 사연은 고등학생에게 온갖 협박을 당한 13살 소녀 은경의 이야기였다.	 평범했던 소녀 은경이는 어느 날 장난삼아 인터넷 사이트에 영상 하나를 올렸다 난처해졌다.	 생각했던 것과 다르게 영상에 수많은 구애의 댓글이 달리자 은경이는 영상이 장난이었음을 고백하며 급히 사태를 수습하고자 했다.	 하지만 은경이의 SNS를 통해 개인정보를 확보한 한 고등학생은 협박을 시작했다.	가해자는 영상통화를 통해 음란행위를 시켰고, 이를 빌미로 은경이를 자신의 집으로 유인해 유린하거나 돈을 요구하기도 했다.	 자신을 놔달라고 애원하는 아이에게 다른 여자를 데리고 오면 놓아주겠다는 황당한 요구까지 늘어놨다.	 결국 경찰에 체포된 가해자의 혐의는 성추행, 강간, 협박 등 모두 5가지에 달할 정도로 심각했다.	공분을 일으킨 것은 가해자에 대한 솜방망이 처벌이었다.	 은경의 가족들은 ‘형사 재판’이 진행되면서 가해자에게 7년 이상의 형이 구형될 것이라고 생각했다.	 그런데 무슨 이유에선지 사건은 갑자기 ’소년 보호 재판’으로 이관됐고, 가해자는 전과 기록조차 남지 않는 소년원 보호 처분을 받는 데 그쳤다.	 가해 학생이 모범생이고, 초범이며, 재범의 우려가 적고, 진심으로 반성하고 있다는 것이 그 이유였다.	 은경이는 아직도 두려움에 떨고 있었고, 은경이의 어머니는 눈물을 흘리며 억울함을 호소하고 있다.	관련 전문가들 역시 “성폭행 피해자가 죗값을 물어달라고 이야기하는데 누가 이 가해자의 장래를 생각할 수 있는가.	 그럼 피해자는 형사 사건에서 전혀 필요 없는 존재인가”, “이건 성범죄고 그 대상이 자기 또래도 아니고 초등학생을 대상으로 했다는 건데 한 아이의 인생을 완전히 나락으로 떨어뜨린 대가치고는  너무나 솜방망이”라며 부당한 처벌에 분노했다.	현재 검찰은 이 판결이 타당하지 않다며 서울고등법원에 항고했다.	 ‘실화탐사대’ 박지훈 변호사는 “소년범의 재범률이 무려 90% 이상에 달한다.	 솜방망이 처벌 때문에 재범률이 높다고 단정 지을 수 없지만, 관대한 처분이 소년범들의 경각심을 일으키지 못하는 하나의 사실”이라고 지적했다.	 동아닷컴     / -	 Copyrights ⓒ  무단 전재 및 재배포 금지 -"
[에듀윌] 코로나19 사태로 연기된 공무원 시험 어떻게 대비할까?,"인사혁신처 등에 따르면 지난 2월부터 4월 예정되어 있던 국가직, 지방직 공무원 시험이 코로나19 사태로 줄줄이 연기된 데 이어, 향후 일정조차 잡히지 않아, 공시생들은 답답할 수 밖에 없다.	  이렇게 정확한 일정조차 나오지 않으면서 공시생들 사이에서는 불만의 목소리가 커지고 있다.	 국가직 5급 공채, 외교관 후보자 선발, 지역인재 7급 수습직원 필기시험 등 4월 이후로 미뤄졌고, 9급공무원과 소방공무원, 경찰공무원 공채 필기시험은 5월 이후로 연기됐다.	 서울시 공무원 임용시험도 지난 3월에서 4월로 미뤄졌다가 또 한 번 연기되면서 6월 13일 지방직 정기 시험과 병합해 실시할 예정이다.	  문제는 아직 정확한 일정이 나오지 않아 공시생들의 불안은 가중되고 있다는 것.	 이에 종합교육기업 에듀윌이 코로나19로 연기된 공시에 학습 공백을 채워주고자 ‘공시연기 긴급대응 전략특강’을 무료로 제공하기로 했다.	  공무원 합격자 수 215%라는 폭발적 증가를 만들어 낸 에듀윌에서 공시생을 위한 전략특강을 무료로 제공해 수험생들에서 눈길을 끌고 있다.	 에듀윌의 제공하는 해당 특강은 9급, 경찰, 소방 파이널 문제풀이 4주 완성 과정으로 에듀윌 명품 교수의 명쾌한 강의를 5월31일까지 무제한 제공한다.	 특히 9급공무원 주요 6과목의 압축&요약 패키지를 무한 제공해 약점에 대응하고 학습 기억을 강화하여 코로나19로 인한 학습 공백을 채울 수 있도록 구성했다.	  코로나19로 공시연기 긴급대응을 위해 에듀윌이 마련한 전략특강 무료제공 이벤트에 대한 자세한 사항 및 신청은 에듀윌 공식 홈페이지에서 확인 가능하다.	     / -	 Copyrights ⓒ  무단 전재 및 재배포 금지 -"
‘탐사보도 세븐’ 조주빈의 이중생활…덫에 걸린 VIP들,"TV조선 <탐사보도 세븐>에서는 텔레그램 성 착취 사건 ‘박사방’의 운영자, 조주빈의 이중생활과 유명인들을 상대로 한 사기 행각에 대해 집중 취재한다.3월 텔레그램 성 착취 사건 ‘박사방’의 운영자 조주빈이 검거됐다.	 박사방을 운영하며 봉사활동을 다닌 이중적인 모습과 유명인들에게 사기를 친 사실까지 포착됐다.	 평범한 20대 청년이었던 그는 어떻게 언론사 사장과 전 광역시장에게 접근할 수 있었을까.	“교회 오빠 같은 순수한 청년이었어요.	” 조주빈이 검거 직전 다녀간 단골 미용실 주인은 그가 성범죄자 ‘박사’와 다른 모습이었다고 한다.	 대학을 우수한 성적으로 졸업했고, 경찰과 함께 보이스피싱 인출책을 검거하여 경찰 감사장을 수상했던 조주빈.	 군대 전역 이후에는 60여 차례의 봉사활동을 하며 한 봉사 단체의 팀장 직까지 맡았다.	 조주빈을 기억하는 이웃들은 그가 여느 20대 청년들보다 더 예의 바르고 순수한 모습이었다고 말한다.	 평범한 스물다섯 살 청년 조주빈, 무엇이 그를 괴물로 만들었을까.	제작진은 조주빈의 범행 이유를 찾기 위해 그의 온라인 행적을 취재했다.	 포털사이트에 올렸던 470여 건의 지식 답변, 유명인들의 관상을 분석하던 개인 사이트.	 범죄 심리 전문가들은 조주빈의 행동에 공통점이 있다고 말한다.	 조주빈이 잔혹한 성범죄자가 된 이유는 무엇일까.	 제작진은 어렵게 만난 조주빈의 변호인에게 지금껏 드러나지 않았던 그의 범행 이유를 들을 수 있었다.	조주빈이 검찰송치 전 포토라인에 서서 손석희 사장, 윤장현 전 광주시장,  를 언급했다.	 조사 결과 이들에게 사기를 쳐 총 수천만 원에 달하는 돈을 갈취한 것으로 확인됐다.	 2017년 일어난 손석희 사장의 접촉사고 취재 과정에서 협박, 폭행 논란 등으로 분쟁 중인 손 사장과  에게는 접촉사고 CCTV 영상을 빌미로, 공직선거법 위반으로 재판 중이던 윤장현 전 시장에게는 방송에서 해명할 기회를 주겠다며 접근했다.	 조주빈은 20년 차 기자와 전 광역시장을 어떻게 믿게 만들었을까.	 이 과정에 공통적으로 손석희 사장이 있었다는 뜻밖의 사실이 드러났다.	 윤장현 전 시장의 한 관계자는 윤 시장이 조주빈의 말에 따라 서울에 간 날 손석희 사장과 직접 만났다고 증언한다.	 피해자라던 손석희 사장과 조주빈은 어떤 관계일까.	지난 2017년 4월 과천시의 한 교회 주차장에서 손석희 사장의 차가 견인차를 들이받는 접촉사고가 일어났다.	 사고 현장에 있었던 견인차 기사는 “도망치는 손 사장의 차를 막아 세운 뒤에야 차에서 내려 150만 원에 합의했다”라며 당시를 생생하게 기억한다.	 손석희 사장이 사고처리 없이 달아난 사실이 알려지자 뺑소니 논란과 동승자 문제 등 의혹이 불거졌다.	 이후 조주빈까지 이 사건의 CCTV 영상을 자신이 가지고 있는 것처럼 속여 손석희 사장과  에게 접근했다.	 제작진은 사건의 전말을 알려줄 영상을 추적하던 중 충격적인 제보를 받는다.	 바로 사고 당시 영상이 실제 존재한다는 것.	 어렵게 피해자와 접촉한 제작진, 사고 당시 영상은 어떤 내용을 담고 있을까.	동아닷컴     / -	 Copyrights ⓒ  무단 전재 및 재배포 금지 -"
