"[전문] JTBC “조주빈, 치밀하게 조작한 텔레그램→손석희 신변 위협”"," JTBC “조주빈, 치밀하게 조작한 텔레그램→손석희 신변 위협”‘텔레그램 n번방’ 핵심 용의자 ‘박사’ 조주빈이 손석희를 언급한 가운데 JTBC가 입장을 밝혔다.	미성년자 등을 협박해 찍은 성착취 동영상을 텔레그램에 유포한 혐의를 받고 있는 ‘텔레그램 n번방’의 ‘박사’ 조주빈.	 성범죄 피의자 중 처음으로 신상이 공개된 그는 오늘 오전 서울 종로경찰서를 나서면서 “손석희 사장님, 윤장현 시장님,  님”을 언급하며 “ 비롯해 저에게 피해 입은 모든 분들께 진심으로 사죄의 말씀 드린다”고 말했다.	 이에 일각에서는 세 사람이 조주빈의 성착취물 영상 제작·유포 사건에 연루된 것 아니냐는 의혹이 제기됐다.	이에 JTBC는 공식입장을 배포하며 손석희는 조주빈으로부터 협박받은 ‘피해자’임을 명확히 했다.	 이들은 “박사방 조주빈은 당초 손석희 사장에게 자신이 흥신소 사장이라며 텔레그램을 통해 접근했다.	 그리고 ‘손석희 사장과 분쟁 중인 K씨가 손석희 사장 및 그의 가족들을 상대로 위해를 가하기 위해 행동책을 찾고 있고 이를 위해 본인에게 접근했다’고 속였다”면서 “자신이 직접 K씨와 대화를 나눈 것처럼 조작된 텔레그램 문자 내용을 제시했다”고 설명했다.	JTBC는 “조주빈이 제시한 텔레그램에는 ‘K씨가 손석희 사장이나 가족을 해치기 위해 자신에게 이미 돈을 지급했다’는 내용들이 있었다.	 텔레그램 내용은 매우 정교하고 치밀하게 조작돼 있어서 이를 수사하던 경찰마저도 진본인 줄 알 정도였다.	 이 때문에 한동안 손석희 사장과 가족들은 불안감에 떨었다.	 이미 손석희 사장의 가족들은 ‘태블릿 PC’ 보도 이후 지속적인 테러 위협을 받은 바 있어 늘 민감할 수밖에 없었다”고 밝혔다.	이들은 “그와 별개로 손석희 사장은 아무리 K씨와 분쟁중이라도 그가 그런 일을 할 사람이라고는 믿기 어려워 ‘사실이라면 계좌내역 등 증거를 제시하라’고 했다.	 이에 조주빈은 금품을 요구했고, 증거확보를 위해 어쩔 수 없이 손석희 사장이 이에 응한 사실이 있다.	 그러나 조주빈은 결국 요구한 증거들을 제시하지 않고 잠적한 후 검거됐다”고 말했다.	 이어 “위해를 가하려 마음먹은 사람이 K씨가 아니라도 실제로 있다면 설사 조주빈을 신고해도 또 다른 행동책을 찾을 가능성이 있다고 봤기에 매우 조심스러웠다.	 그래서 신고를 미루던 참이었다.	 정말 혹여라도 그 누군가가 가족을 해치려 하고 있다면, 그건 조주빈 하나만 신고해선 안 될 일이었다.	 그래서 더 근거를 가져오라고 했던 것이기도 하다”고 강조했다.	JTBC는 “흥신소 사장이라고 접근한 사람이 조주빈이라는 것은 검거 후 경찰을 통해 알게 됐다”면서 “당사는 손석희 사장과 그 가족의 입장을 이해하고 지지하며 향후 대응 역시 적극 지지할 것”이라고 전했다.	이날 경찰 관계자 또한 손석희 사장과 윤장현 전 광주시장, 그리고  는 성착취물 사건과 무관하다며 “그들의 피해사실을 조사 중인 게 있다”고 밝혔다.	한편, ‘텔레그램 n번방’ 사건은 2019년 2월부터 수십여 명의 여성을 협박하여 성 착취 영상물을 찍게 하고, 이를 텔레그램을 통해 판매한 디지털 성범죄 사건이다.	 핵심 용의자는 영상을 1번방부터 8번방까지 8개의 채팅방에서 판매한 n번방의 ‘갓갓’과 입장 금액에 따라 채팅방 등급을 나눈 박사방의 ‘박사’다.	조주빈의 박사방의 경우 공식적으로 확인된 피해 여성만 74명이며 이가운데 미성년자가 16명 포함됐다.	 조주빈은 아르바이트 등을 미끼로 피해자들을 유인, 얼굴이 나오는 나체 사진을 받아낸 후 이를 빌미로 성 착취물을 촬영하도록 협박하고 박사방에 유포한 혐의를 받고 있다.	 조주빈은 유료 대화방을 운영하며 후원금 명목으로 암호화폐를 받은 후 유료회원을 입장시켜 성 착취물을 제공한 것으로 파악됐다.	 경찰은 조주빈을 검거한데 이어 ‘갓갓’ 검거를 위해 수사망을 좁히고 있다.	박사방 조주빈 발언에 대한 JTBC 손석희 사장의 입장을 밝힙니다.	박사방 조주빈은 당초 손석희 사장에게 자신이 흥신소 사장이라며 텔레그램을 통해 접근했습니다.	 그리고 ‘손사장과 분쟁 중인 K씨가 손사장 및 그의 가족들을 상대로 위해를 가하기 위해 행동책을 찾고 있고 이를 위해 본인에게 접근했다’고 속였습니다.	 그러면서 자신이 직접 K씨와 대화를 나눈 것처럼 조작된 텔레그램 문자 내용을 제시했습니다.	 조주빈이 제시한 텔레그램에는 ‘K씨가 손석희 사장이나 가족을 해치기 위해 자신에게 이미 돈을 지급했다’는 내용들이 있었습니다.	 텔레그램 내용은 매우 정교하고 치밀하게 조작돼 있어서 이를 수사하던 경찰마저도 진본인 줄 알 정도였습니다.	 이 때문에 한동안 손석희 사장과 가족들은 불안감에 떨었습니다.	 이미 손석희 사장의 가족들은 ‘태블릿 PC’ 보도 이후 지속적인 테러 위협을 받은 바 있어 늘 민감할 수 밖에 없었습니다.	그와 별개로 손석희 사장은 아무리 K씨와 분쟁중이라도 그가 그런 일을 할 사람이라고는 믿기 어려워 ‘사실이라면 계좌내역 등 증거를 제시하라’고 했습니다.	 이에 조주빈은 금품을 요구했고, 증거확보를 위해 어쩔 수 없이 손석희 사장이 이에 응한 사실이 있습니다.	 그러나 조주빈은 결국 요구한 증거들을 제시하지 않고 잠적한 후 검거됐습니다.	위해를 가하려 마음먹은 사람이 K씨가 아니라도 실제로 있다면 설사 조주빈을 신고해도 또 다른 행동책을 찾을 가능성이 있다고 봤기에 매우 조심스러웠고, 그래서 신고를 미루던 참이었습니다.	 정말 혹여라도 그 누군가가 가족을 해치려 하고 있다면, 그건 조주빈 하나만 신고해선 안 될 일이었습니다.	 그래서 더 근거를 가져오라고 했던 것이기도 합니다.	 물론 흥신소 사장이라고 접근한 사람이 조주빈이라는 것은 검거 후 경찰을 통해 알게 됐습니다.	이상이 손석희 사장의 입장입니다.	 JTBC는 손석희 사장과 그 가족의 입장을 이해하고 지지하며 향후 대응 역시 적극 지지할 것입니다.	동아닷컴    사진|동아닷컴     / -	 Copyrights ⓒ  무단 전재 및 재배포 금지 -"
"조주빈, 손석희 사장 왜 언급했나 “흥신소 사장이라며 협박·금품 요구”","미성년자 등을 협박해 찍은 성 착취 영상을 텔레그램에 유포한 ‘박사방’ 운영자 조주빈이 25일 포토라인에서 손석희 JTBC 대표이사 사장,   등을 언급해 이목이 쏠린 가운데 JTBC가 손석희 사장을 대신해 공식 입장을 밝혔다.	JTBC는 25일 오후 공식 입장문을 통해 “‘박사방’ 조주빈은 애초 손석희 사장에게 자신이 ‘흥신소 사장’이라며 텔레그램을 통해 접근했다.	 ‘손 사장과 분쟁 중인 K 씨가 손 사장 및 그의 가족을 상대로 위해를 가하기 위해 행동책을 찾고 있고 이를 위해 본인에게 접근했다’고 속였다.	 그러면서 자신이 직접 K 씨와 대화를 나눈 것처럼 조작된 텔레그램 문자 내용을 제시했다”고 이야기했다.	이어 “조주빈이 제시한 텔레그램에는 ‘K 씨가 손석희 사장이나 가족을 해치기 위해 자신에게 이미 돈을 지급했다’는 내용이 있었다.	 텔레그램 내용은 매우 정교하고 치밀하게 조작돼 있어서 이를 수사하던 경찰마저도 ‘진본’인 줄 알 정도였다.	 때문에 한동안 손석희 사장과 가족은 불안감에 떨었다.	 이미 손석희 사장 가족은 ‘태블릿 PC’ 보도 이후 지속적인 테러 위협을 받은 바 있어 늘 민감할 수 밖에 없었다”고 설명했다.	JTBC는 “그와 별개로 손석희 사장은 아무리 K 씨와 분쟁 중이라도 그가 그런 일을 할 사람이라고는 믿기 어려워 ‘사실이라면 계좌내역 등 증거를 제시하라’고 했다.	 이에 조주빈은 금품을 요구했고, 증거 확보를 위해 어쩔 수 없이 손석희 사장이 이에 응한 사실이 있다.	 그러나 조주빈은 결국 요구한 증거들을 제시하지 않고 잠적한 후 검거됐다”고 말했다.	그러면서 “위해를 가하려 마음먹은 사람이 K 씨가 아니라도 실제로 있다면 설사 조주빈을 신고해도 또 다른 행동책을 찾을 가능성이 있다고 봤기에 매우 조심스러웠고, 그래서 신고를 미루던 참이었다.	 정말 혹여라도 그 누군가가 가족을 해치려 하고 있다면, 그건 조주빈 하나만 신고해선 안 될 일이었다.	 그래서 더 근거를 가져오라고 했던 것이기도 하다.	 물론 흥신소 사장이라고 접근한 사람이 조주빈이라는 것은 검거 후 경찰을 통해 알게 됐다”고 손석희 사장 입장을 대신 전했다.	JTBC는 “손석희 사장과 그 가족의 입장을 이해하고 지지하며 향후 대응 역시 적극 지지할 것”이라고 밝혔다.	앞서 조주빈은 이날 오전 검찰로 송치되는 과정에서 포토라인에 섰다.	 그리고는 돌연 손석희 사장 등을 언급했다.	 조주빈은 “손석희 사장 등을 비롯해 내게 피해를 입은 모든 분에게 진심으로 사죄한다”고 말했다.	 이에 JTBC는 “손석희 사장이 조주빈 정체를 모른 채 그에게 협박과 금품 요구를 당했다”고 대신 전했다.	조주빈은 2018년 12월부터 올해 3월까지 아동 성 착취 영상 등을 제작해 돈을 받고 텔레그램 ‘박사방’에 유포한 혐의 등으로 25일 검찰에 기소의견으로 송치됐다.	 조주빈은 스스로를 ‘박사’로 칭하며 피해 여성들에게 몸에 칼로 ‘노예’라고 새기게 하는 등 잔혹하고 엽기적인 행각을 벌인 것으로 알려졌다.	또한, 조주빈은 ‘박사방’ 운영에 앞서 텔레그램을 통해 총기·마약 등 사기 행각을 벌이기도 했다.	 가지고 있지도 않은 물품을 판매한다고 해 접촉해오는 사람들에게 돈만 받고 물건을 보내지 않는 수법이다.	조주빈에게는 아동청소년보호법 위반 및 강제추행·협박·강요·사기, 개인정보보호법 위반, 성폭력처벌법 위반 등 혐의가 적용됐다.	현재까지 경찰이 파악한 피해자는 74명, 미성년자는 이 중 16명이다.	박사방 조주빈 발언에 대한 JTBC 손석희 사장의 입장을 밝힙니다.	박사방 조주빈은 당초 손석희 사장에게 자신이 흥신소 사장이라며 텔레그램을 통해 접근했습니다.	 그리고 ‘손사장과 분쟁 중인 K씨가 손사장 및 그의 가족들을 상대로 위해를 가하기 위해 행동책을 찾고 있고 이를 위해 본인에게 접근했다’고 속였습니다.	 그러면서 자신이 직접 K씨와 대화를 나눈 것처럼 조작된 텔레그램 문자 내용을 제시했습니다.	조주빈이 제시한 텔레그램에는 ‘K씨가 손석희 사장이나 가족을 해치기 위해 자신에게 이미 돈을 지급했다’는 내용들이 있었습니다.	 텔레그램 내용은 매우 정교하고 치밀하게 조작돼 있어서 이를 수사하던 경찰마저도 진본인 줄 알 정도였습니다.	 이 때문에 한동안 손석희 사장과 가족들은 불안감에 떨었습니다.	 이미 손석희 사장의 가족들은 ‘태블릿 PC’ 보도 이후 지속적인 테러 위협을 받은 바 있어 늘 민감할 수 밖에 없었습니다.	그와 별개로 손석희 사장은 아무리 K씨와 분쟁중이라도 그가 그런 일을 할 사람이라고는 믿기 어려워 ‘사실이라면 계좌내역 등 증거를 제시하라’고 했습니다.	 이에 조주빈은 금품을 요구했고, 증거확보를 위해 어쩔 수 없이 손석희 사장이 이에 응한 사실이 있습니다.	 그러나 조주빈은 결국 요구한 증거들을 제시하지 않고 잠적한 후 검거됐습니다.	위해를 가하려 마음먹은 사람이 K씨가 아니라도 실제로 있다면 설사 조주빈을 신고해도 또 다른 행동책을 찾을 가능성이 있다고 봤기에 매우 조심스러웠고, 그래서 신고를 미루던 참이었습니다.	 정말 혹여라도 그 누군가가 가족을 해치려 하고 있다면, 그건 조주빈 하나만 신고해선 안 될 일이었습니다.	 그래서 더 근거를 가져오라고 했던 것이기도 합니다.	물론 흥신소 사장이라고 접근한 사람이 조주빈이라는 것은 검거 후 경찰을 통해 알게 됐습니다.	이상이 손석희 사장의 입장입니다.	JTBC는 손석희 사장과 그 가족의 입장을 이해하고 지지하며 향후 대응 역시 적극 지지할 것입니다.	동아닷컴     / -	 Copyrights ⓒ  무단 전재 및 재배포 금지 -"
[종합] ‘N번방’ 조주빈 “손석희-김웅에 사죄…악마의 삶 멈춰주셔서 감사”,"인터넷 메신저 텔레그림을 이용해 성 착취물 제작 및 유표한 조주빈이 검찰이 송치됐다.	 이에 따라 앞서 당국은 조주빈의 얼굴과 신상 등을 일반 대중에 공개했다.	 25일 오전 8시 서울 종로 경찰서에서는 일명 ‘박사방’을 운영한 조주빈이 모습을 드러냈다.	 그는 목 보호대를 찬 상태로 취재진의 질문과 별개로 자신의 말을 이어갔다.	 조주빈은 이날 취재진 앞에서 “손석희 사장님, 윤장현 시장님,  님을 비롯해 저에게 피해를 입은 모든 분들께 진심으로 사죄한다”며 “멈출 수 없었던 악마의 삶을 멈춰 주셔서 감사하다”고 말했다.	 앞서 조주빈은 아르바이트 등을 미끼로 피해자들을 유인, 얼굴이 드러난 나체 사진을 받아내고 성 착취물 촬영 등을 협박했다.	 또한, 피해 여성은 물론 박사방 유료 회원들의 개인 정보도 빼돌려 이를 협박, 강요에 이용했다.	 한편 경찰은 조주빈이 운영한 박사방에서 암호화폐를 지불, 미성년자 성 착취물 시청 및 공유한 유료 회원 등에 대해 신원을 특정 중이다.	 또한, 문재인 대통령은 앞서 청와대 대변인을 통해 피해자들에 대한 영상물 삭제 및 의료지원은 물론 박사방 운영자를 비롯한 회원 전원에 대한 강력한 수사를 촉구한 바 있다.	 동아닷컴    사진｜동아닷컴     / -	 Copyrights ⓒ  무단 전재 및 재배포 금지 -"
"“반려견, 끝까지 책임지지 못하면 키우지 마세요”","도널드 트럼프 미국 대통령은 각종 기행과 막말 발언으로 구설수에 오른 인물이다.	 최근 미국 대선에서 패했지만 순순히 대통령 직에서 물러나지 않을 것으로 보인다.	 하지만 비판을 많이 받은 트럼프 대통령도 평가받을만한 점이 있다.	  그는 역대 미국 대통령 중 유일하게 반려동물을 키우지 않은 대통령이었다.	 대통령 취임 이후 이미지 개선을 위해 반려견을 입양할 것을 권유했지만 트럼프 대통령은 거부했다.	 대통령 직무 수행만 해도 시간이 모자랄뿐더러, 반려동물을 좋아하지 않는다는 이유에서다.	 반려동물을 좋아하지도 않으면서 이미지메이킹을 위해 반려견을 키우는 것은 기만행위라고 트럼프 대통령은 판단했다.	 각종 쇼맨십과 기행으로 명성을 떨친 트럼프 대통령이지만 ‘좋아하지 않기 때문에 키우지 않겠다’고 한 것은 그의 솔직한 면모를 보여줬다.	 자신이 싫어하더라도 정치적 이익을 위해 좋아하는 척할 수 있는 게 대부분의 정치인이 아닐까.	  동물권에 대한 논의가 이제 막 싹트기 시작한 한국에서는 반려동물을 액세서리로 보는 인식이 아직도 강하다.	 이미지메이킹을 위해 쓰다가 필요 없다고 판단되면 즉각 내다 버린다.	 포천파출소의 명예경찰견 왕방이와 왕순이가 전형적인 사례다.	 진도믹스견으로 유기견인 왕방이와 왕순이는 각각 2018년과 2019년 강아지였을 때 파출소 경관들이 데리고 왔다.	 생후 2개월께 파출소에 온 두 마리의 개는 서로 의지하며 지냈다.	 명예경찰견으로 경찰과 시민들의 사랑을 담뿍 받았지만 지난 6월께 현실의 벽에 부딪쳤다.	 개들이 짖어서 불편하다는 동네 주민들의 민원이 접수되자 파출소 측은 개들을 다른 곳에 보내기로 했다.	 개를 데려온 경관들도 다른 근무지로 간 지 오래였다.	  왕방이와 왕순이는 갈 곳을 백방으로 알아봤지만 입양이 여의치 않았다.	 중형견 2마리를 단번에 입양하기는 쉽지 않기 때문이다.	 결국 왕방이와 왕순이를 돌보던 이가 국외입양을 추진한 끝에 미국 캘리포니아로 입양을 떠났다.	 케이지에 갇혀 한국 땅을 떠나는 왕방이와 왕순이의 눈이 슬퍼 보였다는 소식이 전해지기도 했다.	  관리소홀로 어이없이 세상을 떠난 반려동물도 많다.	 유기묘였던 다행이는 2014년 역곡역에 와서 역곡 명예역장이 되었다.	 하지만 다행이를 데려온 김행균 역곡역장이 휴직에 들어가자 다행이는 2017년 유기동물센터에 보내졌다.	 그 후 다행이는 실종되고 말았다.	  전문가들은 “반려동물이 좋다는 이유만으로 덜컥 키우기 시작하면 관리소홀로 이어질 가능성이 높다”면서 “반려동물에 관한 책 한 권이라도 읽는 정성을 들여야 반려동물을 제대로 키울 수 있다”고 강조했다.	 김호승     / -	 Copyrights ⓒ  무단 전재 및 재배포 금지 -"
텔레그램 박사방 운영자 ‘조주빈’ 얼굴 공개 “악마의 삶 멈춰줘 감사” [포토화보],"‘텔레그램 n번방 사건’에서 ‘박사장’이라는 이름으로 운영한 조주빈이 25일 처음 얼굴을 드러냈다.	 이날 오전 아동·청소년의 성보호에 관한 법률 위반 등 혐의로 구속된 조씨를 기소의견으로 검찰에 송치했다.	서울 종로경찰서 유치장에 입감됐던 조주빈은 이날 오전 8시쯤 목에 보호대를 차고 마스크를 쓰지 않은 채 경찰서를 나섰다.	조주빈은 “저에게 피해를 입은 모든 분들께 진심으로 사죄한다.	 멈출 수 없었던 악마의 삶을 멈춰줘서 감사하다”고 말했다.	조주빈은 미성년자를 SNS 등으로 돈을 벌게 해주겠다고 한 뒤 이들의 얼굴이 나온 나체 사진을 찍어 협박, 가학적인 성행위 콘텐츠를 요구했다.	  경찰은 조주빈을 포함해 총 124명을 검거, 18명을 구속했다.	 조주빈은 아르바이트를 미끼로 피해자들을 유인해, 얼굴이 나오는 나체사진을 받아내 이를 빌미로 성 착취물을 찍도록 협박한 혐의를 받고 있다.	 피해여성만 최소 74명이며 이 중 16명이 미성년자인 것으로 파악하고 있다.	서울지방경찰청은 24일 조주빈에 대한 신상정보 공개 결정을 내렸다.	서울청은 “피의자는 불특정 다수의 여성을 노예로 지칭하며 성 착취 영상물을 제작·유포하는 등 범행 수법이 악질적·반복적이다.	 아동·청소년을 포함해 피해자가 무려 70여명에 이르는 등 범죄가 중대할 뿐 아니라 구속영장이 발부되고 인적·물적 증거가 충분히 확보됐다”며 이같이 결정했다.	동아닷컴     / -	 Copyrights ⓒ  무단 전재 및 재배포 금지 -"
[종합] 텔레그램 n번방 ‘박사’ 조주빈 신상공개…동료 “조용한 아이였는데”,"‘텔레그램 n번방’ 사건의 핵심 용의자인 ‘박사’ 조모 씨의 신상이 공개됐다.	SBS는 23일 오후 ‘텔레그램 n번방’의 ‘박사’ 조 씨에 대해 인천의 한 전문대를 졸업한 조주빈이라고 단독 보도했다.	 정보통신을 전공한 조주빈은 재학 당시 학보사에서 편집국장으로 활동하기도 했다고.	 4학기 중 3학기에서 평균 학점 4.0을 받으며 우수한 편에 속했던 것으로 전해졌다.	SBS와의 인터뷰에서 조주빈의 학보사 동료는 “어디서나 볼 수 있을 법한 조용한 아이였다”면서 “내가 알고 지냈던 사람이 박사였다니 일차적으로 먼저 소름이 돋았다”고 말했다.	‘텔레그램 n번방’ 사건은 2019년 2월부터 수십여 명의 여성을 협박하여 성 착취 영상물을 찍게 하고, 이를 텔레그램을 통해 판매한 디지털 성범죄 사건.	 핵심 용의자는 영상을 1번방부터 8번방까지 8개의 채팅방에서 판매한 n번방의 ‘갓갓’과 입장 금액에 따라 채팅방 등급을 나눈 박사방의 ‘박사’다.	박사방의 경우 공식적으로 확인된 피해 여성만 74명이며 이가운데 미성년자가 16명 포함됐다.	 조주빈은 아르바이트 등을 미끼로 피해자들을 유인, 얼굴이 나오는 나체 사진을 받아낸 후 이를 빌미로 성 착취물을 촬영하도록 협박하고 박사방에 유포한 혐의를 받고 있다.	 조주빈은 유료 대화방을 운영하며 후원금 명목으로 암호화폐를 받은 후 유료회원을 입장시켜 성 착취물을 제공한 것으로 파악됐다.	경찰은 지난 19일 ‘박사’ 조주빈을 비롯해 총 4명을 검거하고 구속했다.	 SBS ‘그것이 알고싶다’ 측은 21일 방송과 SNS 계정을 통해 19일 영장실질심사에 출석한 당시의 조주빈의 얼굴을 공개했다.	 마스크로 얼굴을 가렸지만 눈과 헤어스타일 등이 드러난 사진이었다.	 ‘박사’의 신상을 공개하고 그를 포토라인에 세워달라는 국민청원이 230만을 넘어선 가운데 23일 SBS 뉴스를 통해 조주빈의 신상이 공개됐다.	SBS가 단독 보도로 선공개했지만 공식적으로 조주빈의 신상정보 공개 여부는 오늘 결정된다.	 범죄자 신상 공개 여부를 결정하는 신상정보공개심의위원회는 경찰 3명과 외부위원 4명으로 구성되며 위원 7명은 다수결로 범죄자의 신상 공개 여부를 결정한다.	한편, 경찰은 또 다른 텔레그램 채팅방 ‘n번방’의 운영자로 알려진 ‘갓갓’ 검거를 위해 수사망을 좁히고 있는 것으로 전해졌다.	동아닷컴     / -	 Copyrights ⓒ  무단 전재 및 재배포 금지 -"
