"[‘현대판 계(契)’ 등장, 서재준 티웨이브 대표] 핀테크 서비스 ‘아임인’으로 곗돈 리스크 해결","누적 거래액 1000억원에 연체율은 0.4% 불과.	.	.	 신용등급 세분화로 안전장치 구축'치안국에서 15일 현재로 조사한 바에 의하면 약 7000개의 계가 현재 전국 각지에서 서민은행 격인 역할을 하고 있다고 하며, 계에 불입된 금액은 약 15억환으로 추산된다는 데 이 같은 집계를 내게 된 이유는 광주를 비롯하여 각지에서 계주들이 사기횡령 혐의로 약 30명이나 경찰에 구속된 사실에 비추어 과연 얼마나한 수의계가 맺어지고 있는가를 알기 위한 것이었다고 한다.	’  1920년대부터 1990년대까지의 과거 기사를 검색할 수 있는 네이버 뉴스 라이브러리를 통해 검색한 1954년 12월 22일자 기사다.	 사용된 단어는 너무 예스럽고, 극단적인 문어체에 4줄을 넘어선 후에야 마침표가 찍혀 읽기가 힘들지만 재미있는 내용을 담고 있다.	 ‘계를 조심해야 한다’는 것이다.	  70여년이 지난 현재는 어떨까?	 ‘4억원 가량 곗돈을 떼어먹고 10여년을 도망을 다닌 낙찰계 계주가 1심에서 징역 4년을 선고받았다’는 내용의 기사가 2020년 9월 2일자로 실렸다.	 돈을 떼어먹고 도망간 계주 사건은 여전히 진행형이다.	 계의 취지는 좋지만, 돈을 보호할 수 있는 안전장치가 없다는 게 문제다.	  소셜 핀테크 스타트업 티웨이브가 ‘아임인’이라는 핀테크 서비스로 계의 문제점을 해결하겠다고 나서 주목받고 있다.	 아임인 서비스는 계와 유사하다.	 아임인은 시급하게 목돈이 필요하거나 재테크를 원하는 사람이 스테이지를 열면 계가 시작된다.	계주는 스테이지를 열기 전 참여 인원을 결정하고 이율과 약정금을 정하면 된다.	 13명이 참여하는 스테이지의 경우 1~6번 순번의 사람은 빠르게 목돈을 타고 대출이자를 내는 시스템이고, 후순번 사람은 원금에 적금이자를 더해서 받는 방식이다.	  실제로 아임인이 제공한 시스템을 이용해 13명이 매월 30만원을 입금하는 스테이지를 열어봤다.	 이율은 19%로 정했다.	 이 스테이지에서 1번을 택한 사람은 매월 32만6025원을 입금하는데 13개월 동안 모두 423만8325원을 내게 된다.	 1번이 첫 달에 지급받는 금액은 386만1000원.	 목돈을 빠르게 받지만, 스테이지가 끝날 때까지 37만7325원을 이자로 내는 셈이다.	 이에 반해 마지막 순번인 13번은 매월 27만3975원씩, 모두 356만1675원을 입금하게 된다.	 13번이 최종적으로 지급받는 금액은 377만8690원으로, 21만7015원의 이자소득을 얻게 된다.	  이 시스템을 보면 자연스럽게 궁금해지는 게 있다.	 앞 순번 사람과 뒤 순번 사람의 이율 차이는 어떻게 생기는 것이고, 입금액이 스테이지를 열 때와 왜 달라지는지 등이다.	 아임인을 서비스하는 티웨이브 창업가 서재준 대표는 “앞 순번 사람은 목돈을 대출받아 원리금균등상환방식으로 갚아 나가고, 뒤 순번 사람은 원금에 적금이자를 받는 것”이라며 “시중 은행과 비교해보면 서류 제출이 없고, 신용등급 변화 없이 목돈을 대출받을 수 있다.	 또한 후순번은 시중 은행보다 높은 이율의 적금상품으로 재테크를 할 수 있다”고 설명했다.	 약정 금액과 실제 납입 금액이 다른 이유는 거래 이용 수수료 1%, 이자에 붙는 세금 등이 적용되기 때문이다.	  아임인을 이용하는 이들이 가장 우려하는 게 앞 순번을 택한 이들이 목돈만 받고 약정금을 연체하는 것일 터.	 계에서 계주가 돈만 챙겨 도망가는 경우와 비슷하다.	 서 대표는 “사용자의 신용등급을 세분화했고, 안심서비스를 도입해 연체된 경우 우리가 원금의 90%까지 책임을 진다”고 말했다.	  좀 더 자세하게 살펴봤다.	 아임인 이용을 위해 회원가입을 하려면 NICE신용평가 기관의 데이터 제공에 동의해야 한다.	 NICE신용평가 결과 10등급 중에서 6등급까지만 회원가입이 가능하다.	 티웨이브는 NICE신용평가에서 받은 신용 1~6등급을 다시 I-1에서 I-9까지 세분화했다.	 1등급에서 9등급은 참여할 수 있는 스테이지가 다르다.	 아임인 스테이지에서 12월 11일 현재 최대 약정을 할 수 있는 금액은 160만원이다.	 I-1 등급만 이 스테이지를 열고 참여할 수 있다.	 신용등급이 낮은 I-9 등급은 10만원 약정금 스테이지만 열거나 참여할 수 있게 했다.	 서 대표는 “돌려막기나, 연속 앞 순번 참여 등을 막는 어뷰징 방지 시스템을 적용해 연체를 예방하고 있다”고 강조했다.	  또 다른 연체 방지 시스템은 약정금의 0.2%를 보험료로 내는 ‘안심프라임 서비스’다.	 이 서비스에 가입하면 앞 순번 이용자가 15일 이상 연체를 하는 경우 뒤 순번 사용자가 원하는 시기에 납입금액의 90%를 티웨이브가 보장해주는 서비스다.	 서 대표는 “연체율은 0.4%에 불과하다.	 사용자가 사망한 경우도 있고, 개인회생 신청을 해서 연체를 하는 경우도 몇 건 된다.	 이런 경우 회사가 책임진다”고 강조했다.	 연체는 보통 신용등급이 낮은 이들이 참여하는 소액 스테이지에서 발생한다.	 금액이 연체되는 경우 내용증명을 보내거나 소액청구심판을 신청하면 대부분 해결된다고 한다.	이런 안전장치를 마련해서인지 2017년 3월 서비스를 론칭한 이후 12월 현재 거래 건수가 3만여 건, 누적 거래액이 1070억원을 돌파했다.	 스테이지는 4500건을 넘어섰고, 총 참여 인원도 3만4000명을 돌파했다.	 눈에 띄는 것은 재이용률로, 무려 46%에 이른다.	 별다른 마케팅이나 광고 없이 사용자의 입소문으로만 이뤄낸 성과다.	  창업 이후 누적 투자 유치액이 53억원에 이른 것도 사용자의 충성도가 가장 큰 무기였다.	 보광창업투자, 스케일업벤처스 등이 투자사로 이름을 올렸다.	 우리은행과 KB카드, KEB하나은행 등 여러 금융기관과 MOU를 맺고 다양한 협업을 모색하고 있다.	 서 대표는 “창업 초기 투자자에게 IR을 하면 반응이 좋지 않았다.	 ‘그게 되겠어’ 하는 의심을 많이 받았다”며 웃었다.	  내년 티웨이브는 시리즈 B 투자 유치를 계획하고 있다.	 그 전에 50억원 규모의 브릿지 투자 유치를 진행 중이다.	 서 대표는 “이름을 밝힐 수는 없지만, 브랜드 네임이 있는 투자사에서 투자를 검토 중”이라고 자랑했다.	 투자금은 이후 시스템 안정화 및 인력 충원, 마케팅 등에 사용할 예정이다.	 또한 아임인 서비스를 소셜 핀테크 서비스로 확대하기 위한 전략도 짜고 있다.	 내년 초에는 앱 버전도 출시할 예정이다.	 커뮤니티를 중심으로 하는 아임인 서비스를 선보인다는 계획이다.	  원래 호텔리어를 꿈꿨던 서 대표는 미국 네바다주립대학에서 호텔 경영학을 전공했지만 금융에 관심이 생겨 한국에 돌아와 금융 컨설턴트로 일했다.	 첫 창업인 ‘아임인’에서 성공 스토리를 쓰고 있다.	-"
[한세희 테크&라이프] 슈퍼맨이 될 수 있다면! 당신은 뇌 속에 칩 심겠습니까?,"일런 머스크, 뇌와 컴퓨터 연결 기술 만드는 뉴럴링크 창업… 페이스북 웨어러블 장비 통해 뇌파 분석 컴퓨터 작동 실험 성공일본 애니메이션 ‘공각기동대’의 주인공 쿠사나기 소령은 탁월한 능력의 특수부대 요원이다.	 육체는 사이보그고 뇌는 컴퓨터와 결합하여 컴퓨터의 도움을 받는 ‘전뇌’이기 때문이다.	 육체와 정신이 모두 컴퓨터와 네트워크, 기계공학 등 과학기술에 힘입어 강화된 존재다.	  과학기술을 적극적으로 받아들여 인간의 한계를 넘어선 정신이나 육체의 능력을 갖춘 존재는 SF 소설이나 영화에 즐겨 등장하는 설정이다.	  엄청난 부자에 천재적 공학자라는 점을 제외하면 지극히 평범한 인간인 토니 스타크는 아이언맨 슈트를 입으면 천둥의 신 토르나 괴물 헐크와 대등하게 싸울 수 있게 된다.	 세상 모든 것에 연결된 인공지능 자비스의 도움으로 언제나 가장 정확한 판단을 내릴 수 있다.	 경찰관 머피는 로보캅이 된 후 강력한 힘과 정확한 사격 실력을 자랑하며, 언제든 네트워크에 접속할 수 있다.	  인간은 육체의 한계를 이기려는 노력을 끊임없이 이어 왔다.	 안경, 목발, 보청기 등은 고전적인 인체 ‘증강’ 도구이다.	 자동차나 비행기는 인간 다리의 한계를 극복게 하는 것이고, 기중기나 포크레인은 인간의 힘을 수십, 수백 배 강하게 해 주는 도구다.	  하지만 인간의 곁에 가까이 있으며 정신적 능력을 획기적으로 높여줄 도구는 좀처럼 등장하지 않았다.	 책은 곁에 둘 수 있지만 정보의 양이 제한적이다.	 도서관은 많은 지식을 담고 있지만 몸에서 멀다.	  그러다 데스크톱 컴퓨터에 인터넷이 연결되면서 우리는 책상에서 세상 모든 지식에 접근할 수 있게 되었다.	 스마트폰의 등장으로 드디어 언제 어디서나 세상 모든 정보를 손끝에서 확인하고 매 순간 판단을 위한 정보를 갖게 되었다.	 스마트폰은 세계와 나를 연결하는 접점이다.	인공지능 뛰어넘는 슈퍼 지능 가능할까?	그러나 이것만으로 충분하지 않았나 보다.	 인터넷과 접점을 우리의 손이 아니라 머릿속 뇌에 아예 심어 버리려는 시도가 이어지고 있다.	 뇌와 컴퓨터를 직접 연결, 뇌 기능의 비밀을 밝혀 질병은 고치고 능력은 강화하려는 뇌-	컴퓨터 인터페이스 기술이다.	  일런 머스크 테슬라 CEO나 마크 저커버그 페이스북 CEO도 BCI에 관심이 있는 사람들이다.	 머스크는 2016년 뇌와 컴퓨터를 연결하는 기술을 만드는 뉴럴링크라는 회사를 창업했다.	  뉴럴링크는 최근 동전 크기의 전자기기 ‘링크’를 뇌에 심은 돼지를 공개했다.	 링크는 뇌의 신호를 수집해 압축하고 외부로 전송하는 역할을 한다.	 뇌의 활동이 1000억 개의 뉴런들이 전기화학적 신호를 주고받은 결과라면, 이 신호를 수집해 패턴을 해석하면 뇌의 활동을 이해하고 뇌의 문제도 해결할 수 있다는 이야기가 된다.	  링크는 약 1000개의 채널을 통해 1000개의 뉴런에서 신호를 받아들인다.	 앞으로 처리할 수 있는 신호를 기하급수적으로 늘려 뇌의 비밀을 더욱더 철저하게 파헤친다는 게 목표다.	 뇌의 기능과 특성을 파악하면 뇌의 질병이나 문제를 극복하고 지적, 정신적 능력을 더 높일 수 있으리란 것이 머스크의 생각이다.	 그는 뇌의 작동을 이해해 향후 시각 장애와 청각 장애를 고치고 사지가 마비된 사람을 움직일 수 있게 할 수 있다고 믿는다.	 필요 이상으로 불안을 느끼는 사람에게 두려움을 줄여주고, 인지 처리 능력을 향상하며, 우울증을 고칠 수 있게 될지도 모른다.	  나아가 뇌가 네트워크에 연결되어 컴퓨터와 직접 신호를 주고받으면 방대한 지식과 정보를 순식간에 얻고 처리하게 될 수도 있다.	 사실 머스크가 BCI 기술에 관심을 가진 이유가 이것이다.	 급속히 발달하는 인공지능에 지배당하지 않으려면 인간이 선제적으로 뇌 능력을 증폭해야 한다는 것이다.	  한 가지 문제는 이 칩을 뇌에 심어야 한다는 점이다.	 두개골에 구멍을 뚫은 후 링크를 넣어 뇌 표면에 붙이는 방식이다.	 뚫린 구멍은 생체용 접착제로 다시 막는다.	 뉴럴링크는 뇌에 전극을 심는 과정을 효율화하는 임플란트 로봇도 개발했다.	 수술 로봇이 뼈를 깎아내고 재봉틀처럼 뇌에 전극을 심는다.	 뇌 임플란트를 1시간 이내에 끝나는 ‘시술’로 만들고, 새 제품이 나올 때마다 쉽게 업그레이드할 수 있게 한다는 목표다.	  이런 방식에 거부감을 느낀다면, 페이스북의 연구에 관심을 가질 법하다.	 페이스북은 웨어러블 장비를 통해 수집한 뇌파를 분석해 컴퓨터를 작동시키는 실험에 성공했다.	 생각만으로 컴퓨터에 글자를 입력한 것이다.	 정확도는 70% 수준이었다.	 앞으로 생각을 통해 다룰 수 있는 증강현실 안경 같은 기기가 나올 수 있다는 말이다.	  육체적 능력을 보완하는 로봇 개발도 활발하다.	 이른바 웨어러블 로봇이다.	 삼성전자는 고관절이나 무릎, 발목에 착용해 걸음을 보조하는 ‘GEMS’ 로봇 3종을 선보인 바 있다.	 걸을 때 작용하는 근육의 부담을 덜어주어 보행을 돕는 원리다.	 개인용 서비스 로봇에 대한 국제 표준 인증까지 받았다.	  웨어러블 로봇은 노인이나 장애인의 움직임을 보조하는 의료 목적과 산업이나 건설, 소방, 군사 등의 산업용도 분야 등에서 활발하게 연구되고 있다.	 국내에서도 현대자동차가 관련 제품을 개발 중이고, 여러 벤처 기업이 이 시장에 뛰어들었다.	  BCI나 웨어러블 로봇이나 모두 사람과 기계, 사람과 컴퓨터가 융합한 모습이라는 공통점이 있다.	 사람에게 힘을 보태 주는 기술들이 점점 디지털화되면서 왠지 사람과 로봇, 컴퓨터, 네트워크의 구분이 점점 어려워지는 세상으로 가는 듯한 느낌이다.	  가까운 미래에 웨어러블 로봇은 클라우드에서 데이터를 처리하는 인공지능의 신호를 5G망으로 수신하며 인간의 행동을 정교하게 보조하게 될지 모른다.	 테슬라가 차의 오류를 본사에 전송하듯, 웨어러블 로봇을 조종하는 인간 신체의 미세한 전기 신호가 로봇 제조사 본사에 전달될 수도 있다.	 머릿속 임플란트 칩은 인터넷에 연결되어 지금 필요한 지식을 순식간에 전해줄 수도 있으리라.	 비행기 조종사가 심장마비를 일으키면, 내 머리에 항공기 운항 매뉴얼이 다운로드된다는 이야기다.	 내가 네트워크이고 네트워크가 곧 나이며, 로봇과 내가 얽힌다.	  물론 BCI도 웨어러블 로봇도 아직 갈 길이 멀다.	 과연 갈 수 있을지도 불확실하다.	 이미 오랫동안 이어져 온 연구에 그저 또 한 번 붐이 일어난 것일 수도 있다.	 그러나 많은 움직임이 하나의 흐름을 가리키고 있다.	 머스크의 말이 예사롭지 않다.	 “인공지능과 공생은 인류 종의 수준에서 중요한 문제다.	 미래는 모든 인류의 결합한 의지에 의해 통제될 것이다.	”  쿠사나기 소령은 결국 광대한 네트워크에 스스로를 업로드한다.	※ 필자는  와 동아사이언스 데일리뉴스팀장을 지냈다.	 기술과 사람이 서로 영향을 미치며 변해가는 모습을 항상 흥미진진하게 지켜보고 있다.	 을 지었고, 을 옮겼다."
2021년 공무원 1만6140명 뽑는다,"국공립 교원 3600여명, 군경 1만1000여명 수준정부가 2021년 국가직 공무원을 1만6140명 충원키로 했다.	 지난 9월 1일 행정안전부는 정부 영상회의 시스템인 ‘온-	나라 PC영상회의’를  단 정책설명회에서 ‘2021년 국가공무원 충원 계획 정부’을 발표했다.	  기관별로는 국방부를 제외한 중앙부처에서 8345명, 국군 7682명, 헌법기관 113명을 각각 충원할 예정이다.	 국공립 교원 채용 인원이 가장 많다.	 경찰과 해양경찰은 3393명 선발한다.	 의무경찰 폐지 이후 필요한 대체 인력 1650명과 지구대·파출소 순찰 인력 488명, 사회적 약자 보호 인력 206명, 마약범죄 및 과학수사 인력 144명이 포함된다.	  국민의 생활·안전 강화를 위한 공무원도 1339명 선발한다.	 보호관찰 전자감독·관제 인력 188명, 악의적 체납자 대응 59명, 통관검사·감시 26명, 근로감독 21명, 부동산거래 탈세 분석 13명 등이다.	 지방직 공무원은 지방자치단체와 협의한 뒤 충원 규모를 확정할 예정이다.	 -"
[CEO UP & DOWN] 권세창 vs 허기호,"UP | 권세창 한미약품 대표치료신약 미 FDA 패스트트랙 지정에 ‘활짝’한미약품의 비알코올성 지방간염 치료 신약인 ‘랩스 트리플 아고니스트’가 미국 식품의약국의 패스트트랙으로 지정되면서, 한미약품 연구원 출신의 권세창 대표가 주목받고 있다.	  FDA는 심각하거나 생명의 위협을 가하는 질환에 우수한 효능을 보이는 신약에 대해 면밀한 심사를 거쳐 개발 필요성이 있다고 판단되면, 해당 의약품을 패스트트랙으로 지정한다.	 패스트트랙으로 지정되면 신약 개발과 관련해 FDA의 전폭적인 지원을 받을 수 있으며, FDA와의 긴밀한 협의를 통해 신속한 신약 개발이 가능하다.	  한미약품에 따르면 이번에 FDA 패스트 트랙으로 지정된 랩스 트리플 아고니스트는 단일 타깃 경구 치료제의 한계를 극복할 수 있는 삼중 작용제로, 한미약품의 독자 플랫폼 기술인 ‘랩스커버리’가 적용된 혁신 신약이다.	  한미약품 측은 랩스 트리플 아고니스트가 NASH 치료 효과의 평가 기준이 되는 다양한 지표를 동시에 개선할 수 있어, 현재 전 세계에서 개발되고 있는 NASH 치료제 가운데서도 혁신적인 약물이 될 수 있을 것으로 기대하고 있다.	  한미약품의 삼중 작용제인 랩스 트리플 아고니스트의 상용화가 이뤄질 경우, 수십조원의 NASH 치료제 시장을 선도할 수 있을 것이란 전망도 흘러나온다.	  한미약품이 이 같은 성과를 내고 있는 것은 연구개발에 대한 과감한 투자가 있기에 가능했다는 평가다.	 금융감독원 전자공시 시스템에 따르면 한미약품의 지난해 연결기준 연구개발비용은 2098억원에 달한다.	 올해 1분기 별도기준 연구개발비용은 476억원으로, 매출액의 21.3%를 차지했다.	DOWN | 허기호 한일홀딩스 회장 주가 조작 혐의로 압수수색 ‘곤혹’금융감독원 자본시장특별사법경찰이 지난 7월 15일 허기호 한일홀딩스 회장의 자택을 포함해 서울 서초구 한일시멘트 본사, 한일홀딩스 본사 등에서 압수수색을 벌였다.	 한일시멘트 주가 조작 혐의 등과 관련한 압수수색인 것으로 전해졌다.	 이에 따라 한일시멘트그룹을 둘러싼 위기감도 고조되는 분위기다.	  특사경은 지난 6월에 패스트트랙으로 한일시멘트의 주가 조작 혐의 등을 포착해 검찰에 통보했으며, 서울남부지검의 지휘를 받아 관련 수사에 돌입한 것으로 전해지고 있다.	  금융업계 안팎에선 이번 압수수색과 관련해 지난 5월 공시된 한일시멘트와 에이치엘케이홀딩스의 흡수합병 과정을 주목할 필요가 있다는 의견이 나온다.	 당시 한일홀딩스는 수직 계열화를 통한 주주가치 제고 등을 위해 한일시멘트와 한일현대시멘트의 모회사인 에이치엘케이 홀딩스의 흡수합병을 결정했다고 공시했다.	 양사의 합병 비율은 한일시멘트 1 대 에이치엘케이홀딩스 0.5024632로 책정됐다.	  한일홀딩스는 에이치엘케이홀딩스 지분 100%를 보유해 이 회사를 자회사로 거느리고 있고, 한일시멘트 지분 34.67%를 가진 최대주주다.	 한일시멘트 주가가 낮은 상태에서 에이치엘케이홀딩스와의 흡수합병이 이뤄지면, 합병된 한일시멘트에 대한 한일홀딩스의 지분율이 높아지는 구조다.	 금융권에서는 “허 회장 등이 한일시멘트 주가를 낮춰 한일홀딩스에 유리한 합병 비율을 산출한 것 아니냐”는 의구심이 나온다.	  한일시멘트 주가는 2018년 7월 한일홀딩스에서 인적 분할돼 같은 해 8월 재상장한 이후 지속 상승했다.	 2018년 8월에는 18만원까지 올랐지만 올해 들어 지속 하락했다.	 5월에는 8만원 수준이었다.	-"
