"서울디지털대 탐정전공, 대한탐정협회 제휴 협약 체결","국내 최초 사이버대학 서울디지털대학교는 대한탐정협회가 최근 서울디지털대에서 제휴 협약을 체결했다고 30일 밝혔다.	대한탐정협회는 공권력이 미치지 못하는 사각지대를 보완, 대처하기 위해 전현직 수사형사 경찰관, 법률전문가, 민간조사업관계자, 시민들이 결성한 단체다.	 탐정업무에 대한 실무, 교육, 학술연구 개발과 함께 국내최초 경찰청으로부터 탐정명칭을 승인 받아 ‘탐정사’ 자격시험 등을 주관하고 있다.	주요 업무 협약 내용은 △대한탐정협회 임직원 및 회원 중 서울디지털대학교 신·편입생에게 입학금 전액과 매 학기 수업료 감면 장학 혜택 제공 △대한탐정협회 임직원 직무능력 향상과 자기계발기회 제공 △대학과 협회 상호간 우호 증진을 위한 업무 교류 진행 등이다.	탐정전공 이병도 주임교수는 ""서울디지털대 탐정전공은 사이버대학 뿐 아니라 4년제 대학 중 유일하게 학부 과정에 신설됐다”며 “신용정보법 개정으로 ‘탐정’ 명칭이 허용돼 전문적인 탐정으로 양성시키고자 하며, 특히 20년 역사로 다져진 우리 대학 경찰학과 등 타전공들과 융합한 탐정 교육을 펼치고자 한다""고 말했다.	서울디지털대 탐정전공은 신용정보법 개정 및 탐정업 관련 법안이 발의되며 국민의 주목을 받고 있는 시점에 개설돼 더욱 눈길을 끌고 있다.	 졸업 시 4년제 탐정학사 학위를 수여받을 수 있으며, 민간조사원 자격증 취득과정을 운영해 민간조사전문인재로 거듭날 수 있다.	 또 서울디지털대 경찰학과, 법무행정학과, 상담심리학과, 세무회계학과 등 인접 학과와 복수전공해 졸업 후 복수학사학위 취득과 국내외 대학원 진학이 가능하다.	한편, 서울디지털대학교는 내달 12일까지 30개 학과에서 신편입생을 모집한다."
"이통3사 “""패스 운전면허"" 가입자 100만명 돌파”","본인인증 앱 '패스' 기반 모바일운전면허 서비스 가입자가 100만명을 넘었다.	이동통신 3사는 '패스 모바일 운전면허 확인 서비스 가입자가 9일 기준 100만명을 돌파했다고 12일 밝혔다.	 6월 경찰청·도로교통공단과 출시한 이후 불과 두 달여 만에 가입자가 급증한 것이다.'	패스 모바일운전면허'는 이통3사 본인 인증 '패스'에 본인 명의 운전면허증을 등록해 온·오프라인에서 운전 자격 및 신분을 증명하는 서비스다.	 '패스 모바일운전면허'는 지난해 9월 과학기술정보통신부 ICT 규제샌드박스를 통해 국내 최초로 상용화된 디지털 공인 신분증이다.	전국 27개 운전면허시험장은 7월부터 운전면허증 갱신이나 재발급, 영문 운전면허증 발급 업무에 '패스 모바일운전면허'를 활용하고 있다.	이통 3사는 경찰청과 하반기 내 '패스 모바일운전면허'를 교통경찰 검문 등 일선 경찰행정에 적용하는 방안을 논의 중이며, 금융거래 및 이동통신 서비스에도 신원확인 용도로 활용할 수 있도록 논의하고 있다.	비대면 이용 신청이 잦은 렌터카 및 공유 모빌리티 업계 역시 '패스 모바일운전면허'를 통해 사용자 운전자격을 실시간으로 확인, 무면허 및 부적격 운전을 사전에 예방하는 방안을 검토하고 있다는 게 이통 3사 설명이다.	이통3사는 “빠르게 증가하는 '패스 모바일운전면허' 가입자가 편의성을 체감할 수 있도록 제휴처도 지속 확대할 방침”이라고 밝혔다."
패스 모바일운전면허 확인서비스 가입자 100만 돌파,"지난 6월 말 이동통신 3사와 경찰청, 도로교통공단이 함께 출시한 모바일 운전면허 확인서비스 '패스'의 총 가입자 수가 100만명을 돌파했다.	 '패스 모바일운전면허'는 이통 3사의 본인 인증 애플리케이션 '패스'에 본인 명의의 운전면허증을 등록, 자신의 운전 자격과 신분을 증명할 수 있는 디지털 공인 신분증이다.	 12일 서울 중구 SKT타워에서 직원이 모바일 운전면허증으로 방문객의 신분을 확인하고 있다."
"전남정보문화산업진흥원, 드론해안안전관리 기술시연회 개최","전남정보문화산업진흥원은 순천 와온해변 일원서 '산업용 드론 해안안전관리 기술시연회'를 개최했다고 12일 밝혔다.	이번 시연회는 유오케이 오치훈·강성학 대표가 해안 및 갯골에 대한 3차원 정밀지도 작성을 위한 라이다 활용 데이터 취득기술을 직접 선보였다.	향후, 해안선·해안절벽·갯벌지형 데이터 취득과 해안재해 피해규모 산정 및 사고 발생시 긴급구조 등 다양한 분야에 이용될 것으로 보인다.	서해지방경찰청 등 기관 관계자 15명이 드론 기술시연회를 참관하면서 공공안전 분야 상용화 방안도 논의했다.	이준근 원장은 “드론을 활용해 해안 갯벌 3차원 정보 DB구축과 안전관리 및 재해현황을 신속 정확하게 파악할 수 있게 됐다”며 “민관 연계를 통해 드론 기술이 다양한 분야에 적용될 수 있도록 최선을 다하겠다.	”고 말했다."
"내비는 ""도로침수""를 어떻게 실시간으로 파악할까?","직장인 A씨는 출근길에 신기한 광경을 목격했다.	 폭우로 통제된 구간이 실시간으로 내비게이션에 반영되고 있던 것이다.	 경찰이 출동하는 것과 거의 동시에 내비게이션이 통제 구간을 반영해 대안 경로를 제시했다.	이번 폭우로 도로 침수구간이 늘어나며 많은 운전자들은 불편을 겪었다.	 그나마 도로 통제 구간을 실시간으로 반영하는 내비게이션 때문에 혼란을 줄일 수 있었다.	 내비게이션은 어떻게 '침수로 인한 통제' 같은 돌발변수를 즉각 경로에 반영할 수 있을까?	카카오내비 등 국내 대다수 내비게이션 서비스는 국토교통부, 경찰청, 도로공사 등 기관 등으로부터 정보를 받아 공사, 사고 등으로 인한 통행제한 구역을 실시간 반영한다.	 도로 통제 같은 기관 결정 사항을 빠르게 서비스에 적용할 수 있다.	폭우로 침수피해를 입는 자연재해 관련 정보는 도로공사 핫라인을 통해 실시간 정보를 받는다.	 도로공사 오픈 API를 통해 정보를 병행 확인해 정확도를 높인다.	공개된 도로공사 정보 외에도 실시간 교통상황 분석시스템을 통해 교통량이 급격하게 변하는 지역에 대해 실시간 감지한다.	카카오내비를 제공하는 카카오모빌리티 관계자는 “교통량 변화 원인을 즉각 분석해 원인별로 통행 제한, 최적 우회경로 적용 등 상황에 맞춰 반영한다”고 설명했다.	 공개된 정보와 함께 실제 자동차 운행 흐름을 분석해 통행제한 등 상황을 파악한다는 것이다.	내비게이션은 사용자가 많은 서비스 일수록 정확도가 높다.	 데이터가 많이 쌓여 정확한 길안내가 가능하기 때문이다.	 카카오내비의 경우 1600만명 일반 이용자, 24만명 택시기사, 15만명 대리기사들이 전국 곳곳에서 데이터를 생성한다.	최근에는 터널 같이 신호를 잡기 어려운 곳도 신기술을 도입해 교통흐름을 파악한다.	 카카오내비가 최근 도입한 LTE 기반 측위기술 'FIN'이 그것이다.	 GPS 신호가 정확하지 않는 터널 등에서도 정확한 위치 측정이 이뤄진다.	카카오내비 관계자는 “이용자가 지정한 목적지와 출발지 사이 여러 경로를 분석해 가장 최적화된 경로를 추출하는 것이 내비기술 기본”이라면서 “방대한 양의 빅데이터 분석 기술, 교통 예측 알고리즘, FIN 기술을 복합적으로 운영하는 것이 돌발 상황을 빠르게 반영하는 기술 근간”이라고 말했다.	카카오내비는 앞으로 예측 기술을 도입해 내비게이션 서비스를 고도화할 계획이다.	 카카오 모빌리티 관계자는 “사고 또는 재난 발생 시 해당 지점을 지나가는 이용자 외에 '지나갈 것으로 경로가 예측'되는 이용자까지 특정해 미리 우회 경로를 안내할 수 있는 일종의 관제 기술을 개발 중”이라면서 “빠르게 서비스에 적용할 계획”이라고 말했다."
"권력기관 개혁 2차전...여당, 법 개정 카드 꺼내나","부동산법 통과로 갈등을 겪었던 여야가 고위공직자범죄수사처 출범 등 권력기관 개혁을 놓고 2차 충돌을 예고했다.	 더불어민주당의 공수처장 후보추천위원 선임 요청에도 미래통합당이 움직이지 않았다.	 이에 민주당이 법 개정 카드까지 꺼내들지 관심이 모아졌다.10일 국회에 따르면 민주당 의원을 중심으로 패스트트랙 기간을 단축하는 법안이 잇따라 발의되고 있다.	 현행 국회법에 따르면 패스트트랙 기간은 최장 330일이다.	 노웅래 민주당 의원은 이를 120일로, 진성준 민주당 의원은 75일로 단축하는 개정안을 각각 발의했다.	이를 두고 정치권 일각에서는 공수처 출범을 위한 사전 작업이라는 관측이 나온다.	 통합당이 계속 후보추천위원을 선임하지 않을 경우 법을 개정해 그 권한을 삭제하거나 다른 당이 행사할 수 있도록 하기 위한 것이라는 분석이다.	민주당은 패스트트랙 기간 단축과 공수처법 개정의 관계에 선을 그으면서도 통합당 압박 입장은 유지했다.	 진성준 민주당 의원은 이날 당 최고위원회의 이후 “긴급하다고 해서 패스트트랙 절차를 밟았는데 330일이 걸리면 '슬로우트랙'”이라면 “신속하게 안건을 처리하자는 취지에 부합하도록 개정안을 발의한 것”이라고 법안 발의 취지를 밝혔다.	통합당도 내부적으로는 공수처장 후보추천위원 물색 작업을 시작했다.	 하지만 헌법재판소의 공수처법 위헌법률심판 결론이 우선 나와야 한다는 것이 당의 입장이어서 실제 후보추천위 선정은 늦어질 것으로 보인다.	 더욱이 지난 7월 임시국회에서 민주당이 국회법, 인사청문회법 개정안, 공수처장후보추천위원회 운영규칙 제정안 등 공수처법 후속 3법을 단독 강행 처리하면서 갈등의 골이 깊어진 상태다.	관심은 민주당이 법 개정으로 야당 교섭단체의 공수처장 후보추천위원 2인 선임권을 바꾸느냐 여부다.	 공수처장 선임은 후보추천위원 7인 중 6인의 동의가 요구돼 야당 교섭단체 2인 중 1인 이상의 동의가 반드시 필요하다.	민주당은 8월 결산국회와 9월 정기국회를 통해 반드시 공수처를 출범시킨다는 목표다.	 진 의원은 “공수처법는 7월 15일에 정식 출범했어야 하는데, 통합당이 추천위원을 선임하지 않아 계속 미뤄진다면 특단의 대책을 강구하겠다”며 강공 의지를 내비쳤다.	 176석을 활용한 법 개정 강행을 시사한 것이다.	변수는 계속 하락하는 민주당 지지율이다.	 민주당은 최근 박원순 전 시장 성추행 의혹과 부동산법 처리 강행 이후 20~30대와 여성 지지율이 하락 중이다.	 당 내부에서도 속도조절론이 나오고 있다.	 공수처 출범을 비롯해 국가정보원, 검찰, 경찰 등 권력기관 개혁을 마무리해야 하지만 부동산법 처리와는 달리 대화하는 모습을 보여야 한다는 의견도 있다.	통합당도 민주당이 법 개정 카드를 쓰기 부담스러울 것으로 보고 있다.	 통합당 관계자는 “통합당도 내부적으로 후보추천위원회 선임 절차를 진행 중”이라며 “민주당이 공수처 조기 출범 목표만 의식해 법 개정에 나서기 보다는 여야 협의로 문제를 풀어갈 것으로 예상한다”고 말했다."
화재반복에 운영제한 자동차회사는 소유자 보호대책 마련해야,"앞으로 BMW 화재사고 같은 일이 발생하면 자동차회사는 정부 운영제한 명령에 대해 소유자 보호 대책까지 내놓아야 한다.	 시간끌기 논란을 방지하기 위해 제작결함 조사 절차 규정도 마련된다.	국토교통부는 지난 2월 개정된 자동차관리법 시행을 위해 관련 시행령과 시행규칙을 개정하고 10일부터 40일간 입법예고한다고 9일 밝혔다.	개정안은 △자동차 제작결함조사 위한 관계기관 간 협업체계 구축 △제작결함 조사 위한 절차 규정 △결함차량 운행제한 시 소유자 보호 대책 △리콜 재통지 기준 등을 담았다.	결함 의심으로 발생한 자동차 사고를 조사하기 위해 자동차안전연구원은 환경부, 경찰청, 소방청 등 관계기관 자료를 활용할 수 있다.	 조사 자료는 환경부의 배출가스관련 결함자료, 지자체의 영상정보처리기기 영상, 경찰청의 교통사고조사 보고서, 소방청의 화재발생종합보고서, 보험사의 자체사고조사 및 보험처리 이력 등이다.	자동차안전연구원은 국토부 장관으로부터 제작결함조사 지시를 받은 경우 7일 이내에 자동차 제작자에게 조사대상·내용 및 기간 등을 통보해야 한다.	 자동차제작자는 결함조사로 자료 제출을 요구받으면 15일 이내에 관련 자료를 제출해야 한다.	정부는 결함차량 운행제한 시 소유자 보호 대책도 마련하도록 했다.	 자동차제작자는 국토부 장관이 화재사고가 반복적으로 발생해 운행제한을 명한 경우 15일 이내에 소유자 보호대책을 마련해 자동차 소유자에게 통지해야 한다.	 자동차·교통안전에 미치는 영향과 주의사항, 운행제한에 따른 소유자 불편 해소 방안도 포함해야 한다.	시정조치율이 6개월 이내 70% 미만이거나 운행제한 사유에 해당하는 결함 등으로 시정조치 이행이 필요한 경우 국토부는 자동차제작자에게 리콜 재통지를 명할 수 있다.	 정부가 제작결함조사를 착수하기 전에 제작자가 스스로 자동차안전기준 부적합을 확인해 시정조치하는 경우 과징금을 감경할 수 있도록 했다.	윤진환 국토교통부 자동차정책과장은 “이번 개정을 통해 결함조사 및 자동차 사고 조사가 강화되고, 신속한 시정조치 이행으로 안전을 확보하는 등 국민편의가 증진될 것으로 기대”된다면서 “앞으로도 자동차 소유자 보호 및 자동차 안전도 향상을 위하여 리콜제도를 개선해 나갈 것”이라고 강조했다."
[이슈분석]인베슘·티맥스·한컴 개방형OS 3파전…시장 공략 본격화,"국내 개방형 운용체계 시장은 인베슘과 티맥스에이앤씨, 한글과컴퓨터 3파전 구도다.	 각사 강점을 바탕으로 하반기 시장 공략을 본격화한다.	 개방형 OS 사용성 개선과 친숙도 향상이 관건이다.	경쟁사지만 생태계 조성을 위해선 힘을 모은다.	 3사는 최근 KT, 틸론과 함께 공공 분야 서비스형 데스크톱 사업 모델 공동 개발과 생태계 활성화를 목표로 업무협약을 체결했다.	◇인베슘 '하모니카OS', 비대면 원격지 PC 통합 관리 지원인베슘은 2014년 정부 '공개 소프트웨어 활성화 계획' 일환으로 '하모니카OS'를 개발했다.	 현재 데스크톱 개인용컴퓨터 OS로 하모니카 커뮤니티를 통해 배포하며 지난 5월부터 스마일서브 '아이윈브이 클라우드 PC'를 통해 데스크톱 가상화 서비스를 제공한다.'	하모니카OS'는 사용자 편의가 강점인 리눅스 업스트림 '우분투' 기반이다.	 2028년까지 주요 보안과 업데이트를 지원하는 장기지원 버전이다.	 '우분투'는 공통평가기준 EAL2 인증을 받았으며 '하모니카'는 검증된 보안 수준을 그대로 채택해 적용한다.	리눅스에 익숙하지 않은 사용자를 위해 오피스와 백신 SW, 멀티미디어 SW, 시스템 관리 도구 등을 기본 탑재했다.	 이외 약 3만개 SW를 검색해 설치할 수 있는 'SW 매니저'를 제공한다.	 기술지원 애플리케이션을 지원하며 하모니카 커뮤니티를 통해 기술 자료 3000여건을 공개한다.	비대면 원격지 PC 통합 관리 솔루션 '하모나이즈'를 통해 시스템 관리를 돕는다.	 PC 전원이 꺼진 상태에서도 원격 접속 관리와 시스템 복구가 가능하다.	 '하모나이즈'는 '하모니카OS'와 함께 국방부 사이버지식정보방 사업 PC 1만2500대에 적용됐다.	 이외 대교CNS 영상 플랫폼 '바이브이엑스', 대만 인공지능 기업 '터치 클라우드', 전자칠판 등에 도입됐다.	인베슘은 하반기 공공기관, 학생, 기업, 일반에서 '하모니카OS'를 체험하도록 프로모션을 진행할 예정이다.	 인베슘 관계자는 “사용성과 안정성을 바탕으로 데스크톱, 클라우드, 서버, 미니 PC, 사물인터넷 기기 등 다양한 분야로 확산해 개방형 OS와 공개 SW 보급 확산을 주도하겠다”고 말했다.	◇티맥스에이앤씨 '티맥스OS', 회의실·시험장 PC 등에 적용티맥스에이앤씨는 10여년에 달하는 연구개발을 거쳐 '티맥스OS'를 완성했다.	전문 인력이 '티맥스OS' 전 영역에서 밀착 대응하며 'X-	윈도'를 지원한다.	 자체 그래픽 커널을 개발해 고성능 그래픽 환경을 제공한다.	 마이크로소프트 앱 호환 역시 호환 레이어를 자체 개발했다.	 일반 사용자와 보안 사용자 컨테이너를 분리해 보안을 강화했다.	 자체 오피스 프로그램 '투오피스'를 제공한다.	멀티 클라우드 기반인 행정안전부 개방형 OS 도입 사업에 대비해 KT와 네이버 비즈니스 플랫폼에 '티맥스OS'를 연동했다.'	티맥스OS'는 대기업 A사 회의실 PC에 도입됐다.	 직원이 회의실 PC에서 본인 VDI 환경에 접속할 수 있도록 구현했다.	 현재 대형 교육기업 B사 시험장 PC 환경과 통신사 C사 콜센터 환경에 도입 예정이다.	 시험장 PC에 도입되면 수험생 부정행위를 감시할 수 있다.	 콜센터는 원격근무가 가능하도록 DaaS 기반으로 구축된다.	티맥스에이앤씨는 행안부, 과학기술정보통신부, 정보통신산업진흥원 등 공공기관을 비롯한 개방형 OS 공급업체와 협의체를 구성, 개방형 OS 확산을 위한 여러 정책을 제안하고 있다.	 생태계 조성을 위해 NIPA '오픈업 센터'와 함께 개방형 OS 앱 개발에 필요한 정보와 기술을 지원한다.	 최근 한국공개SW협회에 가입했다.	티맥스에이앤씨 관계자는 “비대면 시대 온라인 교육과 재택근무용 PC 수요가 많을 것으로 예상 한다”면서 “비용 부담을 낮춘 실속형 PC를 연내 출시할 예정”이라고 말했다.	 이어 “차기 버전으로 클라우드 PC OS를 개발하고 있다”면서 “PC 유휴 시간에 서버 비용을 줄이고 PC 활용성을 높일 수 있을 것”이라고 했다.	◇한컴 '한컴구름', 국보연 보안 프레임워크로 '보안성' 강점한글과컴퓨터는 2015년부터 국가보안기술연구소와 '구름 플랫폼'을 개발했다.	 '구름 플랫폼'은 국가, 공공기관에 클라우드 기반 업무 환경을 지원하기 위해 개발됐다.	 '한컴구름'은 '구름 플랫폼'을 바탕으로 한컴이 자체 개발한 개방형 OS다.'	한컴구름'은 지난달 7월 15일 출시됐다.	 리눅스 커널 4.19 기반 데비안 리눅스 바탕이다.	 개인 사용자에게 무료로 배포되며 '한컴구름 깃허브'를 통해 모든 소스코드가 공개됐다.'	한컴구름'은 구름 브라우저, 한글 뷰어, 이미지 뷰어, 동영상 플레이어, 원격 관리 도구, SW 교육 도구, 압축 프로그램 등을 기본 제공한다.	 기업과 기관에는 중앙에서 사용자 프로그램 설치와 사용 권한, 데이터 접근 권한을 관리하는 '구름 플랫폼 관리 시스템'을 함께 제공한다.'	한컴구름' 사용자는 로그인과 동시에 클라우드 서비스에 접속된다.	 웹 브라우저로 업무를 수행하며 모든 자료는 클라우드에 동기화돼 저장된다.	 로그아웃 즉시 단말에 데이터가 남지 않아 보안성이 높다.	 악성코드, 해킹 위협으로부터 단말을 보호하는 국보연 보안 프레임워크가 탑재됐다.	한컴은 2015년부터 다양한 개방형 OS 사업을 수행해 왔다.	 '구름OS'는 지난해 정보통신기획평가원 '지상전술C4I체계 단말 개방형 OS 적용 문제 해결' R&D 과제, 우정사업본부 '클라우드 기반 인터넷 망분리 서비스 도입 사업'을 비롯해 경찰 재난망 고정용 단말기 800여대에 적용돼 활용된다.	한컴은 '한컴구름' 출시를 계기로 국내 개방형 OS 시장을 조성하고 개발자 센터, 민·관 협의체 등을 통해 생태계 활성화에 나설 계획이다.	한컴 관계자는 “국보연과 함께 개방형 OS를 개발해 온 만큼 국가, 공공기관 대상 맞춤형 서비스와 유지보수, 개발 연속성에 우위가 있다”면서 “고객사, 개인 요구사항 등 다양한 목소리를 수렴하고 개선해 '한컴구름'을 엔터프라이즈 버전으로 고도화하고 사업 영역을 확대할 것”이라고 말했다."
"김영주 JT친애저축銀 대전지점 계장, 최소 1억원 전화 금융사기 방지",JT친애저축은행은 대전지점 김영주 계장이 최소 1억원의 보이스피싱을 예방한 공로로 대전 둔산경찰서장으로부터 감사장을 받았다고 7일 밝혔다.	김영주 계장은 지난달 30일 정기예금 5000만원을 중도 해지해 현금 인출 요청하는 70대 고객의 보이스피싱 사고를 사전에 인지하고 경찰에 신고했다.	 경찰이 확인한 결과 해당 고객은 다른 금융기관에서도 5000만원을 이미 현금 인출한 상태여서 확인된 피해 방지 규모만 최소 1억원에 달하는 것으로 드러났다.	JT친애저축은행은 이번 사례가 창구직원이 금융사기 대응 매뉴얼에 따라 체크하는 수준을 넘어서 끝까지 고객 보호를 위해 주의를 기울인 사례로서 의미가 크다고 설명했다.	박윤호 JT친애저축은행 대표는 “불법 금융사기로부터 고객의 소중한 재산을 보호하는 것은 서민금융사의 기본 역할이라고 생각한다”면서 “보이스피싱 수법이 갈수록 교묘해지고 있으므로 앞으로도 고객 보호를 위해 최선을 다하겠다”고 말했다.
