"금융위, 고도화 ""차세대 자금세탁방지시스템"" 가동","금융위원회는 금융정보분석원의 '차세대 자금세탁방지시스템' 구축을 완료하고 가동한다고 17일 밝혔다.	FIU정보시스템은 금융회사들이 보고하는 자금세탁범죄와 관련된 금융거래정보를 분석해 법 집행기관에 제공하는 자금세탁방지시스템이다.	금융회사 등 6000여개 보고기관, 검찰청·경찰청·국세청·관세청 등 8개 법집행기관, 20여개 관계행정기관을 상호연결하는 자금세탁방지시스템의 중심 인프라다.	그러나 지난 2002년 가동 이후 노후화되면서 증가하는 보고정보를 적시에 효율적으로 처리하는데 어려움이 있었다.	FIU는 지난해 5월부터 차세대 FIU정보시스템 구축사업에 착수했다.	 약 2년간 총 200억원 사업비를 투입해 시스템 분석 및 설계, 개발·테스트 및 시험운영 등을 거쳐 이날부터 본격 가동을 시작했다.	차세대 시스템은 이용자에 따라 △금융회사 등 보고기관이 이용하는 보고시스템 △FIU 내부 심사분석관이 이용하는 심사분석시스템 △검찰청 등 법집행기관이 이용하는 정보제공시스템 등 3개의 단위시스템으로 구성됐다.	이번 개편으로 의심거래보고 비율이 기존 30%에서 85%로 약 3배 확대된다.	 보고기관이 전송한 STR의 접수처리용량도 하루 평균 1000건에서 5000건 이상으로 5배가량 향상된다.	심사분석 역량이 강화된다.	최신 통계기법인 머신러닝 기술을 자금세탁범죄 심사분석에 접목해 갈수록 지능화·고도화되는 자금세탁수법에 대응토록 했다.	 또 심사분석에 필요한 행정자료 종류에 신용정보, 기업정보 등을 추가하고, FIU와 행정기관 시스템의 직접 연계로 열흘 넘게 걸리던 자료 입수일을 1일 이내로 단축했다.	단순·반복적인 보고서 작업의 자동화, 계좌나 혐의자를 분석할 수 있는 최신 프로그램 도입 기능도 개선했다.	금융위는 “특정금융정보법령 개정 등 관련 내용을 시스템에 적기 반영하고, 가상자산 등 새로운 거래수단을 이용한 자금세탁범죄에도 더욱 효과적으로 대응하겠다”고 말했다.	현재 FIU로부터 정보를 받는 법집행기관은 검찰청, 경찰청, 해양경찰청, 국세청, 관세청, 중앙선거관리위원회, 국가정보원, 금융위 등 8개 기관이다.	 새해 5월에는 행정안전부, 새해 중 고위공직자범죄수사처가 추가된다."
"청와대, ""민식이법 개정 청원""에 “무조건 형사처벌 주장은 과한 우려”...사회적 합의 ""존중해달라""","청와대는 20일 일명 '민식이법' 개정 청원에 대해 “현행법과 기존 판례를 감안하면 무조건 형사처벌이라는 주장은 다소 과한 우려”라고 밝혔다.	어린이 안전을 위한 입법 취지와 사회적 합의를 이해해달라고 당부했다.	 국과수 등의 과학적 분석을 통해 사건마다 구체적으로 판단, 억울한 운전자가 생기지 않도록 노력하겠다고 약속했다.'	민식이법 개정을 청원합니다'라는 국민청원은 35만4857명이 동의했다.	 청원인은 개정된 '특정범죄 가중처벌 등에 관한 법률'이 형벌 비례성의 원칙에 어긋나며, 어린이보호구역내에서 어린이 교통사고가 발생할 경우 모든 책임을 운전자에게 부담시키는 것은 부당하다며 법률 개정이 필요하다고 요청했다.	김계조 행정안전부 재난안전관리본부장은 청원 답변을 통해 “지난 3월 25일 특정범죄 가중처벌 등에 관한 법률이 개정 시행된 이후 과잉 처벌이라는 논란이 계속되고 있다”며 “어린이보호구역에서 기준 이하의 속도를 준수하더라도 사고가 나면 무조건 형사처벌 대상이라는 불안도 있다”고 밝혔다.	그러나 “현행법에 어린이안전의무 위반을 규정하고 있고, 기존 판례에서도 운전자가 교통사고를 예견할 수 없었거나 사고 발생을 피할 수 없었던 상황인 경우에는 과실이 없다고 인정하고 있다”며 일각에서 주장하는 무조건적 형사처벌은 과한 우려라고 했다.	김 본부장은 “해당 법률 취지는 어린이 교통사고가 발생할 경우 처벌 기준을 강화해 운전자가 더 주의하면서 운전할 수 있도록 경각심을 갖게 해 궁극적으로 어린이 교통사고를 예방하고자 하는 것”이라며 “어린이 안전을 지키고자 하는 입법 취지와 사회적 합의를 이해해 주시길 부탁드린다”고 말했다.	정부도 입법 취지를 반영해 합리적 법 적용이 이뤄질 수 있도록 하겠다고 약속했다.	 국립과학수사연구원과 도로교통공단 등의 과학적 분석을 통해 사건마다 구체적으로 판단해 억울한 운전자가 발생하지 않도록 최선의 노력을 다하겠다고 부연했다.	김 본부장은 “코로나 19로 미뤄졌던 유치원생과 초등학생 등교 개학이 오는 27일부터 순차적으로 이뤄진다.	 오랜만에 등교하는 어린이들이 친구들과 만날 생각에 들뜬 나머지 주위를 잘 살피지 않고 도로를 횡단하거나 갑자기 도로로 튀어나올 수 있어 운전자의 각별한 주의가 필요하다”고 당부했다.	한편 스쿨존은 어린이 교통사고 예방을 위해 1995년에 최초 도입됐다.	 교통사고 예방을 위한 각종 시설이 설치되고 운전자에게 경각심을 주기 위해 어린이 교통사고가 발생할 경우 형사처벌 기준 또한 높게 설정됐다.	김 본부장은 “스쿨존은 운전자에게 특별한 안전운전 의무가 부여된 지역”이라며 “그럼에도 불구하고, 운전자들이 별다른 경각심 없이 운전하는 경우가 많다”고 판단했다.2009년부터 2018년까지 10년간 어린이보호구역 내 사고의 주요 원인 중 안전운전 의무 불이행과 보행자 보호의무 위반이 전체 사고의 68.7%라고 설명했다.	김 본부장은 “이러한 현실에서 지난해 발생한 故 김민식 군 교통사고가 계기가 돼 국회에서 도로교통법과 특정범죄 가중처벌 등에 관한 법률을 개정했고, 올해 3월 25일부터 시행하게 됐다”며 “어린이 교통사고를 근본적으로 차단하기 위해서는 법률 개정뿐만 아니라, 교통시설 개선과 확충, 안전인식 개선 등 여러 가지 노력들이 복합적으로 이뤄져야 효과를 거둘 수 있다”고 말했다.	정부는 지난 1월, 행정안전부를 중심으로 교육부와 문화체육관광부, 보건복지부, 국토교통부, 경찰청 합동으로 '어린이보호구역 교통안전 강화대책'을 발표했다.	 2022년에는 어린이보호구역 내 어린이 교통사고 사망자가 단 한 명도 발생하지 않는 것을 목표로 했다.	 5개 분야 24개 과제를 마련해 추진 중이다.2022년까지 전국 어린이보호구역 중 교통사고 예방을 위해 필요한 곳에 무인교통단속장비와 신호등을 모두 설치한다.	 올해는 교통사고 우려가 큰 지역에 무인교통단속장비 2087대, 신호등 2146개를 우선 설치한다.	 어린이보호구역 900여개소에 안전펜스를 올해 안에 설치하고 2022년까지 필요한 곳에 모두 설치한다.	운전자들이 어린이보호구역을 쉽게 인식하고 예방운전을 할 수 있도록 옐로카펫, 노란발자국과 같은 시설들을 확대한다.	 올해는 교통사고 발생 우려가 높은 초등학교 100개교를 대상으로 시범사업을 실시한다.	 내년까지 모두 설치한다는 계획이다.	어린이보호구역에서 운전자와 어린이 시야를 방해하는 불법 주정차를 근절하기 위해 제도와 시설도 지속적으로 보완한다.	 불법 주정차 위반 차량에 대해서는 범칙금과 과태료를 현행 일반도로의 2배에서 3배로 상향하도록 하반기 중 도로교통법 시행령을 개정할 계획이다.	연말까지 지방자치단체와 함께 어린이보호구역 내 불법 노상주차장 281개소를 모두 폐지한다.	 안전신문고 불법 주정차 주민신고 대상에 어린이 보호구역을 추가해 6월 말부터 시행한다.	 초등학교 주변에 주정차 단속장비도 올해 1160여 대를 설치한다.	김 본부장은 “교통사고로 인해 어린이가 소중한 목숨을 잃거나 다치는 것을 방지하기 위해서는 어린이 안전을 최우선으로 하는 사회적 인식의 변화도 필요하다”고 했다.	어린이들이 통학로 교통안전 문제에 주도적으로 참여할 수 있도록 학교 주변 위험요인들을 직접 찾아 지도에 표시하고 공유하는 체험 프로그램을 학교 교육과정과 연계하여 추진할 계획이라고 밝혔다.	 어린이들이 위험 상황을 실제 체험할 수 있도록 다양한 실감형 교육자료를 확대 보급하고 안전체험관 체험학습 기회도 늘려나갈 예정이라고 덧붙였다.	운전자들이 경각심을 가지고 안전운전을 할 수 있도록 내비게이션 안내 음성과 표출화면을 개선하는 동시에 제한속도 지키기 범국민 캠페인도 지속적으로 추진한다고 밝혔다."
"리노스, 전국 ""112시스템"" 본사업에 이어 9년 만에 고도화 사업 수주",리노스가 티에스라인시스템과 컨소시엄을 구성해 경찰 '112시스템 기능 개선 및 고도화 사업' 계약을 체결했다고 20일 밝혔다.	 리노스 계약금액은 약 13억원이며 사업기간은 12월까지다.	이번 계약으로 리노스는 지난 2011년 구축한 전국 112시스템 기능을 개선하고 고도화할 예정이다.	 노후 하드웨어·소프트웨어를 재구축해 112신고처리 효율성·정확성이 향상돼 안정적인 서비스 제공이 가능할 전망이다.	리노스 관계자는 “경찰 시스템통합 분야 기술력을 인정받아 당사가 직접 구축한 시스템을 9년 만에 다시 정비하게 됐다”면서 “이번 사업도 노하우를 바탕으로 성공적으로 완료하고 앞으로도 경찰 관련 사업을 꾸준히 수주할 수 있도록 노력하겠다”고 밝혔다.	리노스는 지난 2011년과 2012년 '112시스템 전국표준화 및 통합구축 사업'을 수주해 경찰서별로 운영 중이던 112신고 시스템을 전국 17개 지방경찰청 단위의 통합시스템으로 구축한 바 있다.
"청와대, 아동·청소년 성범죄 국민청원 4건 답변...“엄정대응, 피해자 보호 지속”","청와대는 19일 “정부는 아동·청소년에 대한 성범죄의 심각성 인식하고 엄정 대응을 하고 있다”고 밝혔다.	다만 개별 판결의 양형에 대한 답변은 '삼권분립의 원칙을 훼손할 소지가 있다'며 어렵다고 밝혔다.	강정수 청와대 디지털소통센터장은 이날 오후 “아동·청소년 대상 성범죄 관련 청원 4건에 대해 답변드리겠다”며 이 같이 밝혔다.40만474명이 동의한 인천 또래 집단 성폭행 중학생 고발 청원에 대해선 “가해자들은 현재 1심 판결을 기다리고 있는 상황으로 '성폭력 범죄의 처벌 등에 관한 특례법'에 따라 무기징역 또는 10년 이상의 무거운 처벌을 받을 수 있다”고 답했다.	청원인은 딸이 남학생 2명에게 성폭행당한 사실을 고발하며, 가해자들을 엄벌해달라고 요구했다.	 가해자가 미성년이라는 이유로 보호받는 현행제도의 재정비를 촉구했다.	강 대변인은 “교육부는 학교장이 직접 법원에 소년보호처분을 청구할 수 있는 '학교장 통고제'를 활성화하고, 법무부는 소년법상 임시조치를 다양화하는 등 피해자 보호조치를 강화하겠다”고 말했다.	특히 해당 사건 전 가해자 1명이 특수폭행으로 법원 결정을 기다리는 중이었다며 “정부는 피해자 보호 강화 등을 위해 소년법상 임시조치를 다양화 및 활성화하는 대책을 마련하고 있다”고 전했다.	법무부는 현행 법원 단계의 임시조치 이외에 수사단계에서부터 '재판 전 보호관찰' '야간 외출 제한' '피해자 접근금지' 등을 임시조치로 추가한다.	 교육부는 중대한 학교폭력을 저지르거나 반복해서 학교폭력 가해행위를 했을 시 학교장이 직접 법원에 소년보호처분을 청구할 수 있는 '학교장 통고제'를 활성화한다.	경찰 역시 사건 수사 과정에서 미흡한 점이 있다고 판단했다며 “수사미진과 신변 보호 미준수 등에 대해 감찰 조사를 진행 중”이라고 밝혔다.	 피해자 가족이 진정서를 제출한 경찰과 피의자들의 유착 의혹도 내사 중이라고 덧붙였다.	다만 개별 판결의 양형에 대해서는 정부가 답변하기 어려운 점을 양해해달라고 했다.'	초등생 성폭행한 고등학생 엄중 처벌' 청원은 35만4260명이 동의했다.	청원인은 초등학생을 SNS로 협박해 성 착취 영상물을 찍게 한 후, 이를 빌미로 성폭행하고 금품을 갈취한 고등학생 사건을 언급했다.	국회에 '특정강력범죄의 처벌에 관한 특례법'을 개정해 형을 높이고 소년법 적용을 배제하는 등의 개정안이 다수 발의돼 있다고 소개했다.	강 센터장은 “정부는 청소년 강력범죄 예방과 방지를 위해 처벌을 강화하는 방안뿐 아니라 소년교화와 사회 복귀를 위한 의견들도 종합적으로 검토해 논의를 이어가겠다”고 했다.'	어린이집 원장 성폭행 고발' 청원에서 고발한 내용은 경찰 수사 과정에서 사실 확인이 되지 않았다고 전했다.	 청원인은 아들이 어린이집 남성원장으로부터 성폭행을 당했다고 고발했다.	 27만1123명이 동의했다.	강 센터장은 “추후 검찰 수사와 재판 결과를 지켜봐야 한다.	 정부는 피해 아동 보호와 심리상담 등의 피해자 지원은 이어갈 예정”이라고 답했다.53만3883명이 동의한 '25개월 딸 성폭행한 초등생 처벌' 청원은 허위사실로 확인됐다고 밝혔다.	 경찰은 수사 과정에서 가해 아동이 실존하지 않고, 피해 아동의 병원 진료내역이 사실과 다른 점을 확인했다.	강 센터장은 “국민청원은 국민이 직접 참여해 의제를 만들어가는 국민소통의 장”이라며 “국민청원의 신뢰를 함께 지켜내 주시길 당부드립니다”고 강조했다."
"LG화학, 사상자 낸 대산공장 사고 수습에 총력 ""모든 책임""",LG화학이 사상자가 발생한 대산공장 사고 수습에 총력을 다한다.19일 LG화학은 사과문을 내고 “발생 사고로 피해를 입으신 분들께 진심어린 위로와 사과의 말씀을 드린다”면서 이 같이 밝혔다.	앞서 이날 오후 2시20분께 LG화학 대산공장 내 촉매센터에서 폭발음과 함께 불이나 직원 1명이 숨지고 2명이 2도 화상을 입는 사고가 발생했다.	LG화학은 “사고 수습에 만전을 기할 것”이라며 “모든 조치를 강구하고 책임을 다할 것”이라고 고개를 숙였다.	 이어 “철저한 진상 규명과 원인 분석으로 이런 사고가 재발하지 않도록 모든 노력을 기울일 것”이라며 “다시 한 번 피해를 입으신 분들께 진심 어린 사과 말씀을 드린다”고 덧붙였다.	화재는 신고를 받고 소방당국이 출동한 지 10여분 만에 진압됐다.	 소방당국은 촉매 생산 공정에 쓰일 촉매제를 이송하다 지나친 압력으로 사고가 발생한 것으로 보고 있다.	 유해 화학 물질 누출은 없는 것으로 파악됐다.	 추가 사고 및 피해 우려는 없는 상태다.	경찰과 소방당국은 현장 정리를 마치는 대로 정확한 경위와 피해 규모를 조사할 계획이다.
"당신 ""덕분에""…숨은 영웅 121명을 찾았습니다","“국가와 사회 정의를 위해 자신을 희생한 의인에게 기업이 사회적 책임으로 보답한다.	”20일 구본무 전 회장 타계 2주기를 맞아 구 전 회장이 생전에 만든 LG의인상이 재조명 받고 있다.	 고인은 떠났지만 LG의인상을 받은 의인 121명이 남아 구 전 회장의 정신을 되새기고 있다.	특히 코로나19로 사회 구성원 간 봉사와 희생, 기업의 사회적 책임이 강조되고 있는 시점에서 빛을 더 발하고 있다.	LG의인상은 구 전 회장의 뜻을 반영해 2015년 9월 첫 의인상을 수여하며 시작됐다.	 2015년 3명, 2016년 25명, 2017년 30명 2018년 32명, 2019명 27명, 올해 현재까지 4명 등 총 121명이 이 상을 받았다.	LG는 수여자의 생업 현장이나 관할 경찰서에서 조용하게 표창과 상금을 전달하고 있다.	 구 전 회장의 생전 성품처럼 떠들썩한 행사나 허례허식은 지양한다.	 감사와 존경, 진심을 담은 전달식으로 의인을 대우한다.	 치료 등 급박한 상황에 처한 의인은 빠르고 실질적 도움이 될 수 있도록 지원 과정을 일주일 안으로 신속하게 진행한다.	그동안의 의인들 면모를 보면 국가와 사회를 위해 헌신하고 있는 소방관·해양경찰·경찰·군인 등 제복 의인부터 얼굴도 모르는 이웃을 위해 위험을 무릅쓴 크레인·굴착기 기사, 서비스센터 엔지니어, 외국인까지 다양하다.	구 전 회장은 의인상 제정 이전부터 사회 정의를 구현한 의인에게 관심이 많았다.	LG는 2013년 4월 바다에 뛰어든 시민을 구하려다 희생된 인천 강화경찰서 소속 정옥성 경감의 유가족에게 5억원의 위로금과 자녀 3명의 학자금 전액을 지원했다.	 당시 구 회장이 LG 최고경영진과 버스를 타고 충남 천안에 있는 LG전자 협력사를 방문하던 길에 영결식이 진행된 정 경감의 안타까운 소식을 듣고 함께 있던 최고경영자들과 논의해 위로금을 전달한 것으로 알려졌다.	구 전 회장은 2017년 9월 강원도 철원에서 발생한 총기 사고로 숨진 이 모 상병의 유가족에게도 사재로 위로금 1억원을 전달했다.	숨진 이 상병의 아버지가 빗나간 탄환을 어느 병사가 쐈는지 밝히거나 처벌하는 것을 절대 원하지 않는다는 말을 듣고 “아버지의 깊은 배려심과 의로운 마음을 우리 사회가 함께 생각하는 계기가 되길 바란다”며 전달 취지를 밝혔다.	최근 LG의인상은 “진심이 담긴 우리만의 방식으로 사회에 더 다가가자”는 구광모 LG 대표의 뜻을 반영해 수상 범위를 더욱 확대했다.	 국가와 사회 정의를 위해 희생한 의인뿐만 아니라 우리 사회에 귀감이 될 수 있는 시민으로 범위를 넓혔다.	 이 같은 LG그룹과 LG의인상 행보는 기업의 사회적 책임을 실천하는 좋은 선례를 만들어 가고 있다.	한편 LG는 구 전 회장의 2주기인 20일 회사 차원에서 추모 행사를 진행하지 않을 방침이다.	 평소 소탈한 삶을 살아 온 구 전 회장의 뜻에 따라 가족끼리 별도의 추모 자리를 가질 것으로 알려졌다.	재계 관계자는 19일 “구 전 회장이 추구한 사회적 가치와 기업의 사회적 책임이 LG의인상으로 남아 오래도록 기억되고 있다”면서 “앞으로도 LG의인상은 이 사회의 중요한 가치와 문화를 계속 만들어 갈 것”이라고 말했다."
"에듀윌 경찰공무원 1차 시험 ""합격예측 풀서비스"" 사전 예약 시 푸짐한 혜택 증정","종합교육기업 에듀윌이 오는 5월 30일 치러지는 경찰공무원 1차 시험 대비 '합격예측 풀서비스'를 선보인다고 전했다.	 에듀윌은 1차 경찰공무원 시험 당일 빠르고 정확한 합격 예측 서비스를 제공할 계획이다.	 수험생이 가답안을 입력하기만 하면 자동으로 채점해주는 서비스를 제공하며, 풀서비스 참여자 데이터를 기반으로 합격 가능성을 예측해준다.	 여기에 경쟁자 점수대별 분포도, 과목별 성적분석 현황 등을 제공하고, 지난 시험 커트라인 등의 통계자료를 실시간으로 업데이트 하는 등의 실시간 성적분석 시스템도 함께 이용할 수 있다.	 시험 전까지 에듀윌 풀서비스를 예약 하면 시험 당일 실시간 알림 서비스를 받을 수 있다.	 또한, 시험 전 △최신 판례&개정법령 요약집 △파이널 모의고사 등의 자료도 무료로 제공한다.	 사전 예약자 중 추첨을 통해 50명에게 바나나우유를 증정한다."
