"[이슈분석]공공 통합유지보수 사업, 이대로 괜찮나","연 매출 1000억원대 중견 정보기술서비스 기업 진두아이에스가 자금 압박으로 법원에 회생 신청서를 제출하면서 업계 전반에 미치는 여파가 크다.	 특히 진두아이에스가 맡아온 통합유지보수사업에 참여한 중소·영세 소프트웨어 기업이 대금을 받지 못할 위기에 처해 연쇄 경영난을 겪을 가능성이 커졌다.	 SW 업계는 진두아이에스 사태를 계기로 공공 통합유지보수 사업 구조를 재점검해야 한다고 목소리를 높인다.	◇공공 편의 높인 통합유지보수…업계 불안정성↑공공 통합유지보수사업은 시스템 내 다양한 SW 유지관리 사업을 한꺼번에 턴키로 발주하는 방식이다.	 IT 담당 공무원이 평균 수십개에 달하는 SW를 일일이 발주하는 번거로움을 덜어주고 통합관리사업자 한 곳만 관리하면 돼 사업 관리 편의성을 높였다.	그러나 진두아이에스 사태를 계기로 통합유지보수사업 문제점이 수면 위로 떠오른다.	진두아이에스 회생 신청은 단일 회사 어려움으로 끝나지 않는다.	 진두아이에스는 국방부, 법무부, 경찰청 등 주요 공공 20여곳에 통합유지보수서비스를 제공한다.	 이 사업과 연관된 국내외 SW기업이 640여개 달한다.	 통합유지보수 사업 특성상 다수 SW 공급 업체가 이 사업을 수주한 한 개 IT서비스 기업과 계약을 체결한다.	 만약 진두아이에스가 법원 판결 여부에 따라 대금을 지급하지 못하는 상황이 발생하더라도 SW기업은 유지보수 서비스를 제공하는 공공에 대금을 청구할 수 없다.	 원 계약자가 공공이 아니라 통합사업자인 IT서비스 기업이기 때문이다.	이 때문에 업계는 제2, 제3의 진두아이에스 상황이 재현될 경우 업계 전반에 미치는 영향이 크다고 우려한다.	 한 SW업체 대표는 “받아야할 금액이 적은 경우 수백만원에 불과한 기업도 있겠지만 이 같은 상황이 반복되면 영세 SW기업은 줄도산에 처할 가능성도 있다”면서 “통합유지보수사업 불합리성을 다시 한 번 살펴봐야 할 때”라고 지적했다.	공공 통합유지보수사업은 기업 간 수익 배분 문제도 야기한다.	그동안 SW 업계는 통합유지보수사업 진행 시 통합사업자가 별도 역할 없이 통행세만 받고, 하도급에게 낮은 사업 대금을 지급한다고 호소했다.	반면 통합사업자는 전체 프로젝트를 운영·관리하고 발주자 요구사항을 통합·분석하는 역할을 담당하기 때문에 역할 없이 통행세를 받는다는 지적에 반발했다.	 업계 관계자는 “통합사업자가 하도급에게 운영·관리비를 떼어내고 유지보수 비용을 배분하는 계약관행이 지금도 존재한다”면서 “중소·영세 SW기업 등 수익성이 저하되고, 언제 주사업자가 파산할지 모르는 불안함 속에 지내야 한다”고 말했다.	◇SW '제값받기'도 요원…책임성 강화해야유지보수 사업은 공공 SW 시장 가운데 큰 비중을 차지한다.	 2014년 전체 공공 SW사업 가운데 유지보수 사업 비중은 32.4%였지만 2018년 41.3%로 점차 증가한다.	 유지보수 사업 가운데 상당수가 통합유지보수 사업으로 발주돼 공공 SW 시장에 미치는 영향력이 커진다.	업계는 통합유지보수사업이 SW 제값받기 정책과도 어긋난다고 지적한다.	통합유지보수 사업은 대체적으로 기술력보다 가격으로 결정된다.	 대부분 저가로 사업을 수주한다.	 통합사업자는 이 금액에서 오라클 등 가장 유지보수 요율이 높은 외산 SW 금액을 우선 지급한다.	 이를 제외한 나머지 금액에서 국산 SW 유지보수 금액을 책정해 지급한다.	 결국 통합유지보수 사업에 하도급 계약을 맺은 국산 SW기업은 낮은 유지보수 요율을 적용한 대금을 받고, 수익성은 악화된다.	업계 우려를 해소하기 위해 개별 수의계약, 기재부 예산 세부 지침 개선 등 발주자와 통합사업자 책임성을 강화해야 한다는 주장이 제기된다.	한 중소 SW업체 대표는 “민간도 여러 종류 SW 제품 유지보수 계약을 체결하지만 대부분 통합 발주 계약이 아니라 개별 기업과 수의계약을 체결해 문제 발생 시 기업이 직접 책임을 진다”면서 “공공도 단일 통합사업자에게 수십개 중소 SW기업이 휘둘리지 않도록 책임 있는 계약 가이드라인이나 보완책을 마련해야 한다”고 말했다.	SW정책연구소는 “기재부 예산편성 세부지침 공공분야 시스템 유지보수 사업과 관련된 세부 비목과 산출 기준을 개선해야 한다”면서 “통합 과제관리비와 유지보수 개발 인력 인건비를 예산계획 수립 시 고려할 수 있어야 한다”고 제안했다."
"[오늘의 CEO]이희상 티맥스데이터 대표 ""클라우드 DBMS 주도할 것""","티맥스데이터가 개발하는 클라우드 기반의 데이터베이스관리시스템 '티베로8'가 연내 시장에 나온다.	 회사 측은 인공지능 통합 데이터 플랫폼 '하이퍼데이터'와 함께 올 하반기에 성과가 가시화될 것으로 기대했다.	 양대 주력 제품으로 클라우드와 AI 시장을 공략한다.	이희상 티맥스데이터 대표는 26일 “티베로8는 기존 개념에서 진화한 클라우드 DBMS”라면서 “새 시대에 맞는 새로운 DBMS로 시장을 선도하겠다”고 밝혔다.	 티맥스데이터는 지난해 현대·기아차, 경찰청, 코스콤 등 국내외 980여개사에 DBMS '티베로6'를 공급했다.	 국내에서는 데이터 보안을 중요하게 고려하는 대기업이 도입, 괄목할 만한 성과를 냈다.	 해외 성과도 컸다.	 중국 성 정부는 IBM DBMS를 티맥스 '티베로'로 전환했다.	티베로8는 '티베로6'에서 진화한 버전이라기보다 클라우드용으로 새롭게 개발됐다.	 그동안 국내 DBMS 시장이 글로벌 대기업을 따라가기 바빴다면 티맥스데이터는 이제 시장을 이끌 만한 수준으로 성장했다.	 도입 사례가 늘면서 국산 DMBS에 대한 고객 인식이 바뀌었음을 입증했다.	티베로8는 각종 데이터를 통합해 구조화질의어 단일 방식으로 처리한다.	 핵심 기술인 '티베로 액티브 클러스터'를 발전, 클라우드 환경에서 확장을 지원한다.	 DBMS 가상화를 넘어 테이블 가상화를 적용, 이용자 필요에 따라 데이터베이스를 자유롭게 구성할 수 있다.	 기술은 현재 특허 출원 중이다.	티맥스데이터는 2003년 '티베로'로 DBMS 사업을 시작했다.	 클라우드와 AI 시대가 오면서 DBMS를 클라우드 환경에 최적화하고 통합 데이터 플랫폼에 AI 기술을 접목했다.	 서비스형인프라 등 하드웨어뿐만 아니라 소프트웨어 측면에서도 DBMS '스케일 아웃'이 가능하도록 했다.	 데이터가 중심이 되는 아키텍처다.	 올 하반기 출시를 앞두고 있다.	이 대표는 “한 DBMS에 종속되면 새로운 변화 적응에 제한적”이라면서 “티베로8는 클라우드와 AI 시대 DBMS 선택지를 늘리는 데 기여할 것”이라고 설명했다.	 티베로8는 정보기술 고정비를 효율화해야 하는 기업에 새로운 경쟁력을 불어넣는 계기가 된다.	총소유비용을 최소 47%가량 줄인다.	 비용 절감을 넘어 경쟁력 확보라는 기업 생존 이슈를 지원한다.	시장 관심에 비해 활용도가 낮은 AI는 고객이 기술을 잘 알지 못하더라도 쉽게 활용할 수 있도록 플랫폼화했다.	 '하이퍼데이터'는 상반기 출시돼 현재 시장을 공략하고 있다.	 AI 엔진 '하이퍼브레인'을 적용했다.	 데이터를 다루는 전 영역을 한 플랫폼으로 통합했다.	 데이터 수집, 처리, 가공뿐만 아니라 패턴을 분석해 필요한 데이터를 예측하고 시나리오를 추천한다.	티맥스데이터는 올해를 금융권 주요 업무 진출 원년으로 삼았다.	 은행 차세대 시스템 고도화 사업 등을 수주하고 핵심 업무 진입을 확대하기로 했다.	 고객 밀착형 기술 지원이라는 국산 DBMS 강점을 내세운다.	이 대표는 “티맥스데이터는 지난해 매출 300억원 이상의 성과를 냈다”면서 “단순한 숫자를 넘어 국산 DBMS가 외산 DBMS를 대체하는 측면에서 갑절이 넘는 국가 효용이 있다”고 강조했다."
[이슈분석]상생조정위원회 제도화 나선 중기부,"정부에서는 이미 상생법 개정에 따른 실질 효과를 높이기 위해 상생조정위원회를 설치하고 관련 규정을 제정하는 단계에 착수했다.	정부는 기술침해, 불공정거래 사건의 신속한 해결을 위해 중소벤처기업부 장관을 위원장으로 하는 민관 공동의 상생조정위원회를 지난해 6월 출범시켰다.	 상생조정위원회에는 중기부 장관뿐만 아니라 중기부 차관, 공정거래위원회 부위원장, 대검찰청·경찰청·특허청 차장이 당연직 위원으로 참여한다.	 민간에서는 대한상의와 중소기업중앙회 등이 위원으로 참여한다.	위원회는 이미 지난해 총 세 차례의 회의를 열고 △기술침해사건 공동조사 추진방안 △검찰 수사사건의 조정·중재 협력 방안 △기술침해 사건에 대한 조사 협력방안 등을 논의했다.	정부에서는 대통령령으로 법적근거를 마련해 상생조정위원회가 제도적으로 안착할 수 있도록 제도 개선을 추진하는 것을 주 방향으로 삼았다.	 관련 규정이 제정될 경우 위원회는 상생법에서 규정하는 수·위탁거래 뿐만 아니라 중소기업 기술 보호와 관련한 각종 시책을 수립하고, 여러 부처가 관련되는 사건의 처리와 조정·중재 등을 맡는 상설 기관으로 기능할 전망이다.	재계에서 상생법 개정에 강하게 반발하는 이유도 상생조정위원회와 같은 정부 주도 기관의 목소리가 과도하게 커질 수 있다는 점 때문이다.	 업계 관계자는 “당장의 상생법 개정보다도 별도 전담 조직이 생기는 등 중소기업 기술보호와 관련해 큰 변화가 예고된 만큼 재계에서는 우려가 크다”고 말했다.	중기부에서는 상생조정위원회 관련 규정 제정과 상생법 개정이 직접 연계된 사안은 아니라고 밝혔다.	 다만 대기업과 중소기업 간 거래 관행 개선은 지속 추진해 나가야 할 과제라고 설명했다.	중기부 관계자는 “조정과 중재를 통해 자율적으로 분쟁을 해결하는 문화를 기업 생태계 전반으로 확산시키는 것이 중요하다”면서 “조정위원회가 자율적 합의를 위한 역할을 충실히 수행하게 될 것”이라고 밝혔다."
"다시 돌아온 셜록 홈즈! 뮤지컬 ""셜록 홈즈 : 사라진 아이들""","■ 소설에서 시작해 드라마와 영화, 만화로 사랑받는 '셜록 홈즈'명탐정 '셜록 홈즈'는 소설가 '아서 코난 도일'의 추리 소설 속 인물이다.	셜록 홈즈는 오귀스트 뒤팽, 아케치 고고로와 함께 세계의 3대 명탐정으로 불리는 탐정 캐릭터로 아서 코난 도일 역시 에드거 앨런 포와 에도가와 란포와 함께 세계 3대 추리 소설가로 불린다.	소설 속의 인물이 아닌 실제 존재하는 인물처럼 지금까지 전 세계적으로 사랑받고 있는 셜록 홈즈는 한때 자신의 커리어에 홈즈가 도움이 되지 않는다고 판단했던 코난 도일로 인해 소설 속에서 죽음을 맞이했다.	하지만 셜록 홈즈의 팬들은 그 사실을 인정하지 않았고 코난 도일에게 셜록 홈즈를 살려내라고 원성을 높였다.	 그리하여 셜록 홈즈는 소설 속에서 다시 부활하게 되었다.	영국 에든버러 출신의 작가 아서 코난 도일은 셜록 홈즈의 탐정 사무실로 런던 베이커가 221번지 B호라는 위치를 설정했다.	 영국을 상징하는 탐정 셜록 홈즈의 이야기는 영국 내에서 수많은 형태의 콘텐츠로 제작되었다.	그중에도 '셜록 홈즈 = 베네딕트 컴버배치'라는 인상을 심어준 영국 드라마 '셜록'은 국내에서도 방영되어 큰 인기를 끌었다.	셜록 홈즈를 현대적으로 재해석한 BBC의 대표 드라마 셜록 시즌 1은 셜록 홈즈 역에 베네딕트 컴버배치와 존 왓슨 역에 마틴 프리먼을 캐스팅하여 2010년 방영되었다.	 영국 내는 물론 전 세계적으로 인기를 얻어 셜록 시즌 4까지 제작된 것으로 유명하다.	여담이지만 배우 베네딕트 컴버배치와 아서 코난 도일 작가는 먼 친척 관계로 잉글랜드 왕 에드워드 3세의 넷째 아들 랭커스터 공작의 후손이라고 한다.	 코난 도일은 15대손 베네딕트 컴버배치는 17대손으로 32촌 사이라고 하니 두 친척이 '셜록 홈즈'라는 캐릭터로 인연이 이어진 셈이다.	매력적인 캐릭터 셜록 홈즈는 할리우드에서 영화화되어 로버트 다우니 주니어가 셜록 홈즈를 주드 로가 왓슨 박사 역을 맡아 큰 인기를 끌기도 했다.	 2009년 '셜록 홈즈'를 시작으로 2011년 '셜록 홈즈 :	 그림자 게임' 그리고 올해 '셜록 홈즈 3편'이 개봉될 예정에 있다.1994년부터 연재 중인 일본 만화 명탐정 코난에서도 셜록 홈즈를 만날 수 있다.	어느 날 갑자기 초등학생이 되어 버린 고등학생 신이치에게 란이 이름을 물어보자 신이치는 책장에 꽂힌 코난 도일과 에도가와 란포의 책을 보고 에도가와 코난이라고 자신을 소개하며 그 유명한 '명탐정 코난'이 탄생한다.	 만화 속에서 코난은 끊임없이 홈즈를 좋아한다고 밝히며 각별한 애정을 드러낸다.	■ 국내 창작 뮤지컬 '셜록 홈즈' 다시 무대에 올려지다.	소설 셜록 홈즈에서 시작하여 드라마 영화 만화로 영역을 확장한 셜록 홈즈가 뮤지컬 셜록 홈즈로 만들어져 무대에 올랐다.	 브로드웨이의 미국 뮤지컬도 웨스트엔드의 영국 뮤지컬도 아니고 체코 뮤지컬도 아닌 우리나라에서 만든 창작 뮤지컬이라는 점에서 시사하는 바가 크다.	뮤지컬 셜록 홈즈는 우리나라 최초의 시즌제 뮤지컬을 표방한 추리 뮤지컬로 대한민국 뮤지컬 역사를 쓰고 있는 작품이다.	 국내 최초로 시리즈로 만들어지고 있는 뮤지컬 셜록 홈즈는 2011년 셜록홈즈 첫 시즌 '앤더슨가의 비밀'을 시작으로 3가지의 시즌 형태로 제작될 계획을 밝혔었다.	소설 셜록 홈즈를 원작으로 셜록 홈즈와 왓슨 등 주요 캐릭터를 제외하고 매 시즌마다 새로운 캐릭터와 에피소드를 보여줄 것으로 예상되어 많은 뮤지컬 팬들의 기대를 한 몸에 받고 있는 중이다.	뮤지컬 '셜록 홈즈 1 :	 앤더슨가의 비밀'은 대성공을 거두었고 이후 2014년 두 번째 시즌인 '셜록 홈즈 2 :	 블러디 게임'이 무대에 올려졌다.	 뮤지컬 '셜록 홈즈 2 :	 블러디 게임'은 셜록 홈즈와 동시대를 살았던 악명 높은 연쇄 살인마 '잭 더 리퍼'를 쫓는 탐정 셜록 홈즈의 추적을 그려 팽팽한 긴장감을 주었다.	살인마 잭의 행적을 그리다 보니 잔인하다는 평가를 받았던 뮤지컬 '셜록홈즈 2 :	 블러디 게임'은 단점은 덜어내고 스토리를 보강하여 뮤지컬 '셜록 홈즈 :	 사라진 아이들'이라는 이름으로 6년 만에 다시 돌아왔다.	초연부터 함께 작업했던 노우성 연출과 최종윤 작곡가가 이번 시즌에도 참여하여 한층 업그레이드되어 완성도를 높인 뮤지컬 셜록 홈즈는 시즌 1부터 출연하여 셜록 홈즈 장인이라고 불리는 송용진 배우가 홈즈 역으로 출연하였고 뮤지컬 '삼총사', 뮤지컬 '바람과 함께 사라지다'에 출연했던 남성미 넘치는 김준현 배우.	 그리고 뮤지컬 '영웅', 뮤지컬 '광화문 연가'에 출연했던 배우 안재욱이 새롭게 합류하여 3인 3색의 개성 있는 셜록 홈즈로 변신을 꾀한다.	뮤지컬 '셜록 홈즈' 시리즈의 또 다른 매력 포인트는 원작에서는 남성 캐릭터였던 존 왓슨 박사가 여성 캐릭터인 제인 왓슨으로 출연한다는 점이다.	전 시즌에서 단일 캐스팅으로 제인 왓슨 역을 맡았던 이영미 배우가 이번 시즌에 다시 왓슨 역을 맡아 주었고 뮤지컬 '여명의 눈동자', 뮤지컬 '오!	 캐롤', 뮤지컬 '드라큘라' 등에서 다양한 매력을 선보인 배우 최우리.	 아이돌 가수에서 뮤지컬 '그림자를 판 사나이'로 뮤지컬 배우 전향에 성공한 여은 배우가 트리플 캐스팅되었다.	런던 경찰의 브레인 클라이브 역에 이지훈, 산들, 켄, 순수한 영혼 마리아 역에 정명은, 권민제, 순애보 에드거 역에 이승헌, 이주광, 김찬호, 런던 경찰 레스트레이드 역에 김법래, 지혜근, 니콜라스 역에 김민, 에밀리 역에 진도희 등 수 많은 배우들이 무대를 가득 메운다.	뮤지컬 셜록 홈즈:	사라진 아이들은 4월 19일까지 광림아트센터 BBCH홀에서 공연된다.	 인터넷 K-"
"[이슈분석]한국저작권보호원, 해외 저작권 보호 강화","저작권 보호 실무를 담당하는 한국저작권보호원은 '저작권 침해 대응 전문화·국제화' '한류콘텐츠 저작권 해외보호 강화' '미래 기술 기반 저작권 보호체계 구축' 등 3대 과제를 추진하며 비전 2030을 지원한다.	저작권 침해 대응 전문화·국제화 과제에서는 콘텐츠 장르별 침해 대응 전문화에 나선다.	 장르별 침해대응협의체를 구성하고 산업별 침해 보고서를 발간한다.	국제 수사 효율을 높이기 위해 문화체육관광부 저작권 특별사법경찰과 국가별 유관기관과 공조체계 구축을 지원한다.	 해외 저작권 침해사이트 분석 정보를 수집·제공하고 구글 등 신뢰기관 등록을 통한 침해 정보도 수집할 계획이다.	한류콘텐츠 수출 증가에 발맞춰 저작권 해외보호 강화도 추진한다.	 보호원 내 해외저작권협력사업단을 신설하며 해외 저작권 보호 실행력 제고를 위한 채비를 갖췄다.	 조직 구성을 마치고 상반기부터 가동할 예정이다.	보호원은 2021년~2023년까지 저작권 해외사무소를 연간 2개소씩 단계적 증설한다.	 해외사무소에는 자동 모니터링시스템 현지어판을 구축·운영한다.	국내 업계 세계지식재산기구 협업사업 참여 지원, 해외사무소-	현지 수사시관 간 협력체계 구축 확대, 해외 검색포털 협력 확대도 추진한다.	미래기술 기반 저작권 보호체계 구축을 위해서는 저작권 침해 모니터링 대상과 국가를 확대하고 지능형 모니터링 체계를 구축한다.	 인공지능 자기학습을 통해 모니터링 역량을 높인다는 방침이다.	지능형 과학수사 체계도 마련한다.	 디지털 포렌식 증거분석 전문화 전략을 수립하고 디지털 증거처리 체계를 도입한다.	 디지털포렌식센터의 국제표준 인정도 획득할 계획이다.	포렌식 마크, 디지털 핑거프린팅 등 저작권 기술 연구개발 성과물 활용을 확대하고 수요자 맞춤형 요소 기술을 개발한다.	 신규 과제 발굴과 개발을 위한 산·학·연 보호기술 연구 그룹도 운영할 계획이다."
"택시 ""타다 무죄"" 반발...다시 거리로","모빌리티 플랫폼 '타다'와 택시업계 갈등 2라운드가 구체화된다.	 타다가 법원 1심에서 합법 판결을 얻어내면서 택시는 남은 카드인 '타다금지법 통과에 총공세를 퍼부을 전망이다.	 코로나19 여파가 있지만 전국 단위 파업과 대규모 집회까지 열 가능성이 있다.24일 전국택시노동조합연맹 포함 택시 주요 4개 단체는 25일 택시 전 차량 운행을 중단하고 다양한 방식의 의견 표출에 나서기로 했다.	 국회 앞 집회는 아직 유동적이지만 경찰에 집회 인원을 3만명으로 신고했다.	 법원이 지난 19일 모빌리티 플랫폼 '타다'에 무죄 선고를 내리면서 합법으로 인정한데 따른 반발이다.	택시4단체는 성명서를 통해 “법원의 무죄 선고는 렌터카의 유사 택시영업을 사실상 허용한 것”이라며 “아무런 법적 규제 없이 업체 자의적 판단으로 공급을 조절하고, 요금 또한 자율적으로 결정하는 타다 영업형태는 여객 운송질서 붕괴를 가져올 것”이라고 주장했다.	집회 강행 여부는 불확실하다.	 코로나19 사태 심각성이 커지면서 대규모 집회가 감염 우려를 높인다고 보기 때문이다.	 또 서울시의 집회 제한이 국회 앞으로까지 확대될 가능성도 있다.	일단 택시4단체는 집회 참석자들에게 마스크 착용과 감염 예방수칙 준수를 당부하고 있다.	 서울개인택시조합 관계자는 “우리는 코로나보다 타다가 더 무섭다”고 말했다.2월 임시국회에서 타다금지법이 논의될 지 여부는 여전히 미지수다.	 타다 법원 판결을 포함 이해관계가 복잡하게 얽혀 있어 아직 법사위 안건 상정 여부가 결정되지 못했다.	 아울러 법사위 위원 중 채이배 바른미래당 의원과 이철희 더불어민주당 의원이 법안 통과 반대 의사를 보이고 있다.	 법사위는 이달 27일과 내달 5일 두 차례 국회 본회의에서 열릴 전망이다.	벤처, 기업계는 대체로 타다금지법에 반대를 표하고 있다.	 타다와 유사한 방식 사업으로 전개 중인 차차도 지원 사격에 나섰다.	 김성준 차차크리에이션 대표는 “신 쇄국법안과 마찬가지인 여객법 개정안을 즉각 철회해야 한다”며 “사회적 합의안과 초단기 렌터카 임대차를 인정한 법률적 판단을 인정하라”고 말했다.	스타트업 연합체 코리아스타트업포럼은 고심이 깊다.	 다른 모빌리티 업체와 타다 입장이 다르기 때문이다.	 지금까지 국토교통부 상생안과 타다 검찰 기소 건에 대해서는 목소리를 냈지만 타다금지법 관련해서는 뚜렷한 찬반 입장을 낸 적이 없다.	 원칙적으로는 빠른 법제화가 필요하다는 입장이지만, 타다를 직접 겨냥한 '11인승 승합차 렌터카 규제'는 독소조항으로 본다.	타다금지법 입법은 임시국회를 통과하지 못하면 아예 소멸한다.	 일부에선 차선책으로 타다 금지 조항이 빠진 법안을 통과시킨 후 시행령 단에서 세부 사항을 추가 논의하는 방안도 거론된다."
