[인사]경찰청,◆경찰청 ◇총경 승진 예정 △서울 광역수사 광역1 박종환 △광주 형사 강력 송기주 △전남 여성청소년 여성청소년수사 박송희 △본청 혁신기획조정 기획 이창열 △본청 중대범죄수사 정명진 △본청 범죄예방정책 범죄예방기획 이용욱 △서울 지능범죄수사 지능1 남규희 △본청 여성대상범죄수사 여성대상범죄수사기획 정덕진 △서울 서울용산 여성청소년 권미예 △서울 서울영등포 형사 안용식 △본청 수사구조개혁 협력발전1 이준영 △서울 교통안전 교통안전 이용관 △본청 형사 강력 김산호 △본청 홍보 홍보협력 김완기 △서울 경무 이상훈 △서울 서울강서 여성청소년 백혜경 △경찰인재개발원 운영지원 총무 황순평 △부산 생활안전 생활안전 박진효 △광주 경비교통 교통안전 장승명 △강원 청문감사 감사 노윤환 △대전 경무 경무 윤동환 △대구 생활안전 생활안전 박종하 △전남 청문감사 감사 임진영 △경기남부 생활안전 생활안전 노동열 △충남 경비교통 경비경호 이영도 △경북 정보 정보3 황정현 △전북 경무 경무 주현오 △부산 정보 정보3 김종규 △경기남부 경비 경비 김진성 △대구 수사 수사2 이종섭 △충북 여성청소년 여성보호 김경태 △경기남부 형사 강력 임지환 △서울 서울강서 형사 안찬수 △경남 홍보 홍보 우문영 △경기북부 청문감사 감찰 백순근 △부산 교통 교통안전 엄정운 △충북 홍보 홍보 송해영 △경북 경비 경비경호 김유식 △경기북부 과학수사 과학수사 김규행 △서울 서울종로 정보 임태현 △서울 생활안전 생활안전 윤상식 △전남 112종합상황 관리 박상훈 △서울 경무 경무 김동수 △서울 보안관리 보안기획 김평일 △울산 경무 경무 원용덕 △강원 정보 정보4 박재삼 △경기남부 분당 보안 유충열 △서울 서울송파 생활안전 박종우 △전남 생활안전 생활안전 공정원 △부산 청문감사 감찰 강오생 △충남 청문감사 감사 최철균 △부산 부산남부 여성청소년 정병원 △대구 형사 강력 이재욱 △경기남부 경무 경무 위동섭 △서울 112종합상황 윤광현 △전북 수사 지능범죄수사대 김효진 △서울 서울남대문 정보 고영완 △본청 정보화장비기획 정보화장비기획 윤창기 △서울 경비1 경비안전 지지환 △서울 서울종로 경비 강경한 △본청 외사기획 외사기획 김병주 △서울 서울송파 형사 길우근 △인천 형사 강력 이재환 △본청 정보1 정보1 최종윤 △서울 과학수사 과학수사 이상배 △본청 디지털포렌식센터 포렌식기획 양동혁 △서울 22경찰경호 서재찬 △서울 정보2 정보2 우상진 △경기남부 시흥 경무 구자면 △서울 서울서초 생활안전 김성식 △인천 정보 정보1 김난영 △본청 감사 감사기획 김경규 △서울 경무 박삼현 △서울 202경비 경비 이재성 △대전 청문감사 감사 유동하 △본청 보안수사 보안수사2 이규하 △본청 복지정책 복지정책 조규형 △서울 경무 박성갑 △서울 경무 김용환 △서울 서울관악 여성청소년 안형주 △인천 정보 정보3 배석환 △서울 청문감사 감찰조사 최영기 △본청 정보4 박재영 △본청 경비 경비안전 김진형 △서울 경무 구은영 △본청 정보2 정보2 이철희 △본청 수사구조개혁 제도개편1 조미연 △본청 규제개혁법무 법무 주승은 △본청 교통안전 교통안전 김주곤 △부산 경비과 경비 김경수 △경남 생활안전 생활안전 김민준 △인천 경무 경무 최희운 △전북 경비교통 경비경호 황동석 △본청 경무 경리 이길우 △제주 형사 강력 양수진 △본청 사이버수사 사이버수사지도 이명원 △경남 정보 정보3 김현진 △서울 서울영등포 정보 공경현 △광주 생활안전 생활안전 권석진 △대전 홍보 홍보 김홍태 △부산 경무 인사 탁차돌 △경남 경비교통 경비 한상철 △본청 인사 인사기획 하지원 △울산 청문감사 감사 양순봉 △경기남부 외사 국제범죄수사2 정성엽 △전북 정보 정보2 유봉현 △서울 101경비 작전 강은미
[인사]해양경찰청,◆해양경찰청 ◇경무관 전보 △본청 국제협력관 강성기 △본청 구조안전국장 맹주한 △본청 수사정보국장 김성종 △본청 장비기술국장 최정환 △동해지방해양경찰청장 이명준 △제주지방해양경찰청장 오상권 △해양수산부 파견 김인창 △교육 파견 장인식 ◇총경 승진 △본청 혁신행정법무담당관실 배병학 △본청 경비과 최원식 △본청 항공과 장진수 △본청 감사담당관실 고유미 △본청 장비기획과 장윤석 △본청 수사과 장대운 △본청 인사담당관실 우채명 △본청 운영지원과 방영구 △본청 해양안전과 지국현 △본청 기획재정담당관 김태환 △부산해양경찰서 수사과 신주철 △인천해양경찰서 수사과 옥현진 △해양경찰정비창 기획운영과 류용환
"[혁신기업을 가다]워터월시스템즈, 통합 DLP솔루션 ""워터월"" 국내 1위 넘어 세계시장 도전","국내 1위 내부정보유출방지 솔루션 기업 워터월시스템즈가 인공지능 빅데이터 분석 역량을 강화해 글로벌 DLP 솔루션사로 도약한다.	 포스트 코로나 시대를 맞아 고객 요구와 시장 변화를 지속 반영해 세계 어디서나 통하는 '워터월'로 업그레이드한다는 전략이다.	워터월시스템즈는 사내 중요 데이터들이 내부자에 의해 무단으로 외부 유출되는 것을 방지하는 보안솔루션 '워터월'을 공급한다.	 '워터월'은 엔드포인트 기반 DLP 솔루션으로 서버에서 설정된 보안정책이 사용자 PC에 설치된 에이전트에 반영돼 관리자 의도대로 내부데이터의 외부 반출을 통제한다.	 워터월시스템즈는 고객 요구 사항과 급변하는 시장 환경을 반영해 제품 성능을 지속적으로 고도화하며 '워터월'을 온·오프라인 보안, 개인정보보호, PC 보안 등 다양한 기능을 제공하는 '통합 내부정보유출방지 시스템'으로 진화시켰다.2001년 설립한 회사는 창업 초 국방사업을 수주하며 조달 분야에서 레퍼런스를 쌓았다.	 국방부와 합동참모본부가 발주한 '전자자료유출방지체계' 시범사업을 수주해 DLP 솔루션 '지키미'를 공급하고 육해공군으로 확대했다.2003년 '내부정보유출방지 기술'로 국내 특허를 획득한 워터월시스템즈는 자사 솔루션이 LG전자 PC보안 표준제품으로 선정돼 국내는 물론 LG전자 해외법인까지 전사 구축, 비약적으로 성장했으며, 이후 제조업을 중심으로 시장을 본격 확대했다.	 2010년 IBK기업은행에 제품을 공급하며 금융권 문턱을 넘었고 현재 저축은행, 자산운용사 등으로 확대해 다수 고객사에 제품을 서비스하고 있다.	워터월시스템즈는 2012년 지식경제부가 발주한 '기업의 안전한 스마트워킹 보안을 위한 데이터유출통합방지 시스템 개발' 과제를 수행했고 이후 원격근무환경 보안을 요청하는 기관에 DLP 솔루션을 공급했다.	 경찰청 사업을 수주해 전국 각급 지방경찰청 및 지구대·파출소 PC 전체에까지 '워터월'을 설치했다.	 지난 4월 치러진 '제21대 국회의원선거'에는 사전투표 PC에 제품을 설치했다.	 내부정보유출 보안이 가장 중요한 국내 공공사업을 잇따라 수주하며 국내 대표 DLP 솔루션 기업으로 입지를 공고히 하고 있다.	워터월시스템즈는 지난 19년 동안 DLP 단일 제품 '워터월'을 개발, 기업 내부의 정보흐름을 관리하는 최적화된 보안시스템을 제공하며 고객 신뢰와 호평을 받고 있다.	 고객 요구사항을 반영해 꾸준히 제품 성능을 고도화하며 최근 4년간 연평균 15% 고속 성장하고 있다.	 현재 전 세계 1000여개 고객사를 대상으로 90만대 이상 PC에 제품을 설치했다.	 한국어를 비롯해 영어, 일본어, 중국어 등 다국어 서비스를 제공하며 52개 국가에서 우수한 호환성과 안정성을 입증했다.	회사는 지난해 '워터월 v6.0'을 출시해 국제공통평가기준 인증을 획득하고, 지난달에는 제품을 조달청 나라장터에 등록했다.	 '워터월 v6.0'은 통제 가능한 웹 브라우저 범위를 확장하고 메신저 제어 기능을 강화했다.	 또 이동저장장치 반출 시 반출된 장치 정보를 확인할 수 있고, 관리 콘솔 무결성 검증을 할 수 있어 보안성과 편의성 모두 업그레이드했다는 평가다.	 인터페이스를 더 직관적으로 개선하고 로그분석 시스템인 '워터월 로그 애널라이저'을 통해 데이터 분석기능을 강화했다.	 DLP를 통해 사전에 특이 동향을 찾아내 미연에 방지할 수 있다.	 만약 내부자가 특정 패턴 문서를 외부에 유출하려 시도하면, 이를 탐지해 유출시도를 사전 예측할 수 있다.	워터월시스템즈는 작년 코로나19 사태에도 불구하고 윈백 사업과 해외 사업을 중심으로 큰 성과를 거뒀다.	 대홍기획, 한국방위산업진흥회, 세아상역, 타임폴리오자산운용 등 다양한 기관·기업에서 '워터월 DLP'로 전환했다.	 회사는 2001년 창립 직후 일본 히타치-	HBM과 전속계약을 체결해 도요타바디 등에 워터월 제품을 수출한 이래 해외 판로 확대를 지속 타진했다.	 LG전자 등 세계 각지에 법인, 공장을 둔 글로벌 기업을 고객사로 확보해 해외현지에서 제품 안정성과 호환성을 고도화했다.	 해외사업장을 둔 상당수 국내외 기업이 '워터월 DLP'를 지속 도입하고 있으며 해외 군·경찰에서도 적극적으로 제품 도입 문의가 이어지고 있다.	<인터뷰> 이종성 워터월시스템즈 대표“포스트 코로나 시대 인공지능 빅데이터 분석기술로 국내 1위를 넘어 글로벌 내부정보유출방지 솔루션사로 도약하겠습니다.	”이종성 워터월시스템즈 대표는 침입탐지시스템을 주제로 논문을 쓴 컴퓨터공학 박사다.	 2000년 한국인터넷진흥원에서 퇴사한 이 대표는 내부정보유출방지 이슈가 부각되기 전 2001년 4월 내부정보유출방지 솔루션을 자체 개발하며 국내 DLP시장을 개척했다.	이종성 대표는 “'방화벽' 상대 개념으로 외부에서 내부가 아닌, 내부에서 외부로 발생하는 위협을 물샐 틈 없이 막자는 뜻을 담아 DLP 솔루션 '워터월'을 출시했다”고 전했다.	워터월시스템즈는 올해 창립 20주년을 맞아 포스트 코로나 시대 세계 어디서나 국내외 모든 기업이 사용할 수 있는 '워터월'을 새롭게 선보일 계획이다.	이 대표는 “코로나19가 국내외 모든 업무환경을 바꿨다.	 워터월시스템즈는 지난 20년 동안 끊임없이 솔루션을 업그레이드하며 대외환경 변화에 대응해온 경험이 있다”면서 “창립 20주년을 맞아 플랫폼을 더 확장하고 기능을 고도화해 새로운 '워터월'을 선보이겠다”고 말했다.	그는 또 “포스트 코로나 시대에는 재택·원격근무가 보편화돼 실시간 관리가 어려워져 내부보안이 더 중요해질 것”이라면서 “과거 DLP 솔루션이 내부 정보유출을 차단하는 수준이었다면 AI 알고리즘으로 빅데이터를 분석해 사고를 사전 예방할 수 있는 '워터월 DLP'를 통해 세계 보안시장을 혁신하겠다”고 덧붙였다."
"[신간안내]포스트 코로나, 대한민국은 어디로?… ""포스트 코로나 대한민국"" 출간","한울엠플러스가 '포스트 코로나 대한민국:	 집단지성 27인의 성찰과 전망'을 출간했다.	 각계 대표 학자 27명이 '총론'부터 '세계 각국의 방역성과 평가' '방역과 치료' '문화와 교육' '사회와 환경' '경제와 IT' '외교와 남북' '가족과 집'에 이르는 총 8부·27개 전문 분야별로 코로나 사태를 총체적이면서 다학제적으로 집필했다.	책을 기획한 이영한 서울과학기술대학교 건축학부 교수는 사회, 경제, 환경 등 전 범위에 걸쳐 코로나 사태를 총체적으로 접근했다.	 코로나 팬데믹 상황을 분석하고, 코로나 이전을 성찰하면서 코로나 이후를 전망했다.	 특히 포스트 코로나 시대 대한민국의 지속가능발전을 위한 각 분야별 처방과 제안도 포함했다.	 국내 석학과 중견 학자로 구성된 집필진은 약 6개월 동안 각 분야 전문성을 기반으로 코로나 사태 추이를 주시하면서 원고를 발전시켰다.	 집필위원회를 중심으로 집필 내용을 리뷰하며 질적으로 과학적이면서도 진정성과 학문적 깊이가 있는 원고를 완성했다.	책은 코로나 사태와 그 이후를 총체적으로 이해하는 데 도움이 되고자 일반 독자를 대상으로 쓰였다.	 '코로나 세대'라고 절망하고 있는 미래 세대인 청년에게 도움이 되고자 했다.	 대학입시 면접이나 논술을 준비 중인 수험생에게도 유익한 자료가 될 수 있을 것으로 기대된다.	 이영한 교수는 “코로나 팬데믹의 키워드는 거리, 디지털 , 거주지, 격차의 4D라고 할 수 있다”면서 “포스트 코로나 시대가 지속가능하기 위해서는 사람, 공원, 평화, 번영의 4P가 중요하다”고 전했다.	 양명수 이화여자대학교 기독교학과 명예교수는 “독립된 내면의 존엄성을 확보한 개인 간의 참된 교통과 의사소통을 통해 형성되는 민주적 공동체를 바라보아야 한다”고 덧붙였다."
"무학 좋은데이 나눔재단, 지역 문화예술 저변확대 앞장","무학이 지역 문화예술인 발굴과 문화예술을 쉽게 접근할 수 있도록 다양한 전시회를 개최하며 지역의 문화예술 환경의 저변확대 노력하고 있다.	무학은 '딱!	 좋은데이와 함께하는 2020 경남미술의 향기展 창원 오픈식'을 경남 창원시 무학 본사 내 무학 굿데이갤러리와 마산회원구 봉암수원지 일대 숲속미술관에서 개최했다.2020 경남미술의 향기전 창원전의 숲속미술관은 오는 30일까지 야외 전시를 통해 시민들과 만날 예정이다.	 특히 숲속미술관은 봉암수원지 산책로 일대에 '딱 좋은데이와 함께하는 숲속 미술관 예술산책'이라는 테마로 미술품이 전시되어 있어 수원지를 찾은 시민들에게 소소한 일상생활에서 활력소가 될 것으로 기대된다.'	딱!	 좋은데이와 함께하는 2020 경남미술의 향기전'은 9월 23일 서울 인사동 경남갤러리에서 개최된 미술 전시회다.	 코로나19 확산으로 문화행사가 중단돼 어려움을 겪고 있는 예술인의 창작 의욕 계기 마련을 위해 개최됐다.	 무학은 지역 예술인 어려움을 돕고 지역의 문화예술 환경 저변확대를 위해 전시 작품을 5000만원에 매입해 이번 전시회를 개최하게 됐다.	 무학은 예술 작품이 많은 지역민들과 함께 향유하고 경남 예술인의 우수한 작품을 지역민이 쉽게 감상할 수 있도록 개방된 장소에 전시하게 됐다.	무학은 소수만 향유하는 문화예술이 아닌 일상에서 누구나 쉽게 문화예술에 접근할 수 있도록 저변확대를 위해 다양한 문화예술 지원활동을 하고 있다.	 2010년 무학 창원1공장에 외벽에 조성된 문화의 거리는 특별한 전시관이 아닌 일상의 다양한 공간에서 문화예술을 관람할 수 있는 대표적인 활동이다.	 공단이라는 시끄럽고 딱딱한 공간이라는 고정 관념을 탈피하고 공단 근로자들이 잠시나마 휴식할 수 있도록 지역 출신 작가 박두리 화백의 '사계' 작품을 전시하고 있다.	순수미술에 대한 지원과 국내 청년작가들의 창작의욕 고취, 재능발휘 기회를 마련하고자 2011년부터 좋은데이 미술대전을 개최해오고 있다.	 신진작가 발굴과 예술활동을 지원과 문화예술 발전을 위해 개최되고 있는 좋은데이 미술대전은 5회까지 진행됐으며 입선 이상 수상 작품에 대해서는 3.15아트센터, 마산역, 창원시청, 경남지방경찰청, 부산역, 울산지방경찰청 등 다양한 전시공간에서 순회 전시를 개최해 젊은 미술작가들의 작품을 소개했다.	 지금까지 383명의 젊은 작가가 입선 이상을 수상했으며 좋은데이 미술대전 수상 경험을 바탕으로 전업 작가로 활동하며 계속해서 예술인의 길을 걸으며 신진작가를 성장하고 있다.	지역 내 전시공간의 부족으로 어려움을 겪고 있는 예술인을 돕기 위해 무학 다목적홀 내 '굿데이 갤러리'를 조성해 작품을 감상할 수 있도록 돕고 있다.	 2015년 개관한 굿데이 뮤지엄은 개관기념 초대전에서 원로작가부터 청년작가에 이르기까지 지역을 대표하는 다양한 그룹의 작가들을 초대해 폭넓은 작품 전시회를 가지고 31명의 우수한 작가를 선정해 7000만원 상당 작품을 구입하기도 했다.	 2016년 개관 1주년 기념 경남미술동행전을 개최해 목원 김구 작가의 '맑은 향' 작품을 비롯해 총 87점의 작품을 전시한 바 있다.	무학이 조성한 문화공간 중 굿데이뮤지엄은 이제 창원을 대표하는 산업관광지로 발돋움했다.	 굿데이뮤지엄은 지역에서 접하기 어려운 전세계 문화를 술을 통해 간접적으로 경험할 수 있도록 무학이 2013년부터 착수해 2015년 개관한 지역 명소 박물관이다.	 전 세계 3500여종 주류 전시품 한자리에서 볼 수 있고 술을 통한 다양한 문화를 접할 수 있어 창원과 한국문화를 소개하는 장소로 이용되고 있다.	한반도의 문자문명이 시작된 곳으로 꼽히는 경남 창원시에서 개최되는 '문자문명전'의 성공적인 개최를 위해 무학은 매년 후원금을 지원하고 있다.	 문자문명전은 매회 다른 주제로 수준 높은 작품을들 선보이면서 창원시를 대표하는 전시회로 자리매김하고 있다.	 문자문명전 외에도 315미술대전, 경남국제아트페어, 경상남도미술대전 등 다양한 문화예술행사 개최를 돕고 있다.	최재호 무학 회장 또한 예술인을 돕고 저변확대를 위한 단체 대표를 맡아 예술단체 역량확대를 위해 노력한 바 있다.	 지역 예술인들의 창작활동을 지원하고 기업의 문화예술 지원을 통해 사회적 책임을 다하는 경남메세나협회 6대 회장으로 최 회장이 취임해 도내 전역을 찾아가는 메세나 활동을 전개해 경남 도내 전역에 걸쳐 문화예술을 접근할 수 있는 기회를 확대한 바 있다.	 최 회장 임기 동안 경남메세나협회 회원기업과 문화예술인을 직접 만나 소통하는 자리를 확대하고 기업과 예술의 새로운 교류의 장을 열었다는 평가를 받고 있다.	최재호 무학 회장은 “지역적이면서 가장 세계적인 기업을 추구하는 기업이념을 토대로 지역의 예술인의 우수함을 알리기 위해 다양한 문화예술 지원활동을 하고 있다”며 “오랫동안 축적한 문화예술 지원 경험을 바탕으로 지역문화가 더 성장할 수 있도록 노력하겠다”고 말했다.	무학은 소주 딱 좋은데이, 화이트, 청춘소주, 리큐르 좋은데이 컬러시리즈, 매실주 매실마을, 국화주 국화면 좋으리를 대표 브랜드로 두고 있는 종합주류회사이다.	 2006년 좋은데이를 출시하며 소주 트렌드 변화를 주도했다.	 '고객이 좋아하는 것을 하자'는 경영 방침을 실천하기 위해 자산 규모 약 250억원의 좋은데이 나눔재단을 통해 다양한 사회공헌활동으로 지역과 동반성장을 위해 노력하고 있다."
