23,"""트랜짓""이 현재의 프랑스를 배경으로 과거의 사건을 진행시키는 방식--1",실제로 삼일빌딩을 가까이서 보면 시그램빌딩과는 점이 있다는 것을 알게 된다	건축은 콘텍스트에 좌우되기 때문이다	건축평론가 윌리엄 커티스는 나라에 공사장에서 들리는 소리가 다르다는 이야기를 한 적이	인도와 미국의 예를 든 적이 있는데 노동집약적인 인도의 공사장이 농번기 사이에 동원된 농민들의 노동요로 대표된다면 기술집약적인 미국의 공사장은 에어건 쏘는 소리로 상징된다고한다	장소의 차이는 동일한 설계도 다르게 구현되도록 만든다	글로 쓰인 피에르 메나르의 돈키호테 는 텍스트의 동일함을 필요로 하는 반면에 삼일빌딩과 같은 건물을 인식하는 것은 멀리서 본 인상이다	정확히는 텍스트도 똑같아야 할 필요는 없다	누가 300년 전 소설을 정확히 알 수 있겠는가	화자를 이용해 설명하는 소설 속에서만 사실이 필요하다	트랜짓 은 현재의 프랑스를 배경으로 2차 세계대전 당시 나치를 피해 망명을 떠나는 사람들에 이야기를 다루고있다	시간여행을 주제로 한 영화라면 현재의 장소에서 과거의 사건이 진행되는 것이 이상하게 느껴지지 않겠지만 설명도 없이 현재의 장소와 과거의 사건이 공존하는 시대착오적인 방식은 트랜짓 특별하게 만들고	영화에서 구조가 드러나는 순간은 인상적이다	영화가 시작했을 오래된 건물들로 이루어진 파리와 나치를 피해 도피한 망명자들의 모습은 자연스러워 보였다	순간 불심검문을 하는 경찰차와 경찰관의 모습을 보고 영화가 20세기 초가 아니라 현재를 배경으로 하고 있다는 것을 깨달았다	2차 세계대전 당시의 망명자들이 현재의 경찰관에게 검문받는 모습은 의외로 낯설어 보이지 않았다	유대인이나 망명자들을 검문하는 과거의 경찰과 불법 난민들을 검문하는 현재의 경찰은 트랜짓 과거와 현재가 이질감없이 매끄럽게 연결되는 구실을 하고	트랜짓 피에르 메나르 돈키호테 저자 같은 구조가 되기 위해서는 원저를 필요로 한다	미국이나 멕시코로 떠나는 통과 비자를 얻기 위해 마르세유로 몰려드는 망명자들의 이야기는 자연스럽게 카사블랑카 떠오르게 한다	기억의 오류 때문이겠지만 2차 세계대전의 망명자들과 통행증에 소재는 카사블랑카 트랜짓 이야기가 동일할 같다는 생각을 갖게 한다	아마도 현대적인 배경이 망명자들의 이야기를 배경으로부터 분리시키고 이야기보다는 구조 자체에 더 집중하게 해서 트랜짓 카사블랑카 같은 이야기일 것이라는 착각을 만들어내고 있는
24,"""트랜짓""이 현재의 프랑스를 배경으로 과거의 사건을 진행시키는 방식--2",보통 피에르 메나르의 돈키호테 새로운 작품인 이유를 설명할 외국어 고어체 말하지만 하나는 편집에 것이다	피에르 메나르의 돈키호테 는 세르반테스의 돈키호테 중 1부의 9장과 38장 22장의 한 부분으로 구성되어	피에르 메나르는 세르반테스의 돈키호테 내용 중 지방색 같은 장소의 콘텍스트를 더 드러내는 부분을 제거하는 방식을 사용했다	트랜짓 카사블랑카 같은 북아프리카 도시 대신 파리나 마르세유를 배경으로 선택한 것을 같은 이유로 설명하는 것이 가능하다	특히 마르세유 장면에서 나오는 현대적인 공동주택 건물은 장소의 특징을 사라지게 만드는 요소다	트랜짓 은 카사블랑카 원전에서 장소의 콘텍스트를 최대한 제거하고 떠나는 사람과 남는 사람이라는 주제에 집중하고	트랜짓 은 망명이나 난민 문제가 현재진행형이라는 것을 보여주는 인상적인 구조로 시작한다	구조의 효과가 희미해질 주제인 남녀의 엇갈림으로 방향을 튼다	구조가 특별한 영화가 그것만으로 기억되는 숙명을 피하기 위한 현명한 방법이지만 현명한 방법이 항상 옳은 것인지는 잘 모르겠다	트랜짓 화자를 통해서 사건을 설명하고 피에르 메나르 돈키호테 저자 화자를 사용한 방식이 나에게 더 트랜짓 피에르 메나르 돈키호테 저자 같은 구조로 보게한 같기도 하다	너무 거창한 표현이지만 다시 한번 피에르 메나르 돈키호테 저자 한 문장을 빌리면 진실이란 실제로 일어난 사건이 아니라 우리가 일어났다고 생각하는 행위이다	글	윤웅원	저작권자
25,"""올드 가드"" 샤를리즈 테론, ""능력 있고, 싸울 줄 알고, 유머가 있고""--0",7월 10일 공개된 넷플릭스 오리지널 영화 올드 가드 는 샤를리즈 테론이 출연 이전에 제작부터 결심한 영화다	몬스터 아토믹 블론드 툴리 롱 샷 밤쉘	세상을 바꾼 폭탄선언 제작자로서도 개성 있는 안목을 증명하고있는 그답게 불멸의 전사들을 다룬 그레그 러카의 유명 그래픽노블을 영화화한다는 소식에도 즉각 반응했다	이후 출연을 결심하기까지 주효했던 것은 수백년 영생하며 보이지 않는 곳에서 활약해온 여성 전사 앤디의 특출난 카리스마였다	치명상에도 금세 회복하는 슈퍼히어로들의 리더를 연기한 샤를리즈 테론은 영화에서 온갖 전법과 무기에 능한 액션 스타의 진면모를 과시한다	캐스팅 과정부터 후속작 계획에 자신감으로 넘쳤던 샤를리즈 테론과의 인터뷰를 전한다	처음 작품에 대한 이야기를 시작할 가장 먼저 원작 만화부터 찾아봤다	세계관과 캐릭터들이 가질 잠재력을 엿볼 수 있었고 영화로 잘 만들 수 있겠다는 믿음이 가더라	뭐랄까 보다 근원적인 테마를 지닌 이야기에 대한 내 욕구를 자극했던 작품이다	산다는 죽는다는 것은 무엇일까 우리는 뭘 하고 있고 그게 의미를 가질까 우리의 행동은 세상을 바꾸고 있는가 같은 질문들	올드 가드 는 슈퍼히어로 장르를 빌려 존재론적인 물음과 씨름한다	언제나 나를 놀라게 하는 작품들을 택하려고 노력하는데 올드 가드 그런 요소가 있었다	항상 것에 끌린다	밤쉘 같은 소규모 영화를 찍는 것도 좋아하고 올드 가드 같은 블록버스터도 코미디 장르도 즐겁다	필모그래피가 꽤 다양한 장르와 스토리텔링을 지닌 영화들로 채워져 있는데 아마도 약간은 쉽게 싫증내는 성향이 작용한	개인적인 경험에서 가져올 수 있는 부분이 아니다보니 어려운 지점이었다	한편으로 확신도 있었다	세상에서 자신이 어디에 있고 무엇을 하고 있으며 세계가 돌아가고 있는지에 대한 고민과 염려가 없는 사람이 있을까	요즘 같은 코로나19 시대는 그러하다	사회적 불평등 경찰의 무자비함은 어떠한가
26,"""올드 가드"" 샤를리즈 테론, ""능력 있고, 싸울 줄 알고, 유머가 있고""--1",인류는 늘 우리가 무엇을 하고 있는지 되돌아봐왔기 지나치게 긴 삶을 관통해온 앤디가 가진 피로나 냉소주의에 관객이 쉽게 공감할 거라 생각한다	모두는 시점엔가 삶에 회의를 갖기 마련이다	인류에 대한 믿음을 상실한 앤디의 감정을 중점적으로 표현함으로써 앤디가 천년을 산 환상의 인물로만 받아들여지지 않았으면 했다	한 사람은 자신이 잃어버린 그간 스쳐 지나온 긴 삶을 애도하고 있고 한명은 새로운 삶을 인지하고 받아들여야 하는 지점에	두 인물은 서로가 없이는 각자의 삶에서 더 나아갈 수가 없다	굉장히 강력한 관계이고 현실에서 아직도 자세히 다루지 않는 부분이라고 생각한다	그동안 여성들이 서로 그런 좋은 영향을 주지 못한다고 믿기를 바라는 세상 속에 살아왔는데 사실이 아니지 않나	관계가 남성들 사이에서만 가능하고 여성은 할 수 없다는 뿌리 깊은 편견이 남성 중심 장르에서 강화되어왔다	올드 가드 비롯해 여러 영화를 통해 거짓으로 증명된 지 오래다	사람들이 여성 캐릭터가 이야기를 끌고 나가는 것을 보고 싶어 한다는 욕구도 확인됐다	키키 레인 베로니카 응고 두 배우와 함께할 수 있어 큰 행운이었다	후속편을 제작한다면 궁극적으로 세 여성 사이의 관계에 대해 이야기하지 않을까	개인적으로도 식으로 이야기를 풀면 좋을지 생각이 많아지는 요소다	퀸은 특히 오디션 과정에서 역할에 맞는 사람이 나타나지 않아 나까지 불면증을 겪을 지경이었는데 처음 베로니카의 얼굴을 보는 순간 드디어 찾은 같아	할 마음이 있는지 연락해보자	싶었다	준비할 시간이 부족한 상황이었는데도 정말 다행스럽게도 베로니카가 온 마음을 다해 함께해줬다	꼭 후속작을 만들어서 우리의 관계에 대한 이야기를 더 발전시키고 싶다	키키와 베로니카에게도 이미 약속했다	개인적으로도 그렇고 산업 차원에서도 매우 중요하고 반가운 현상이다
27,"""올드 가드"" 샤를리즈 테론, ""능력 있고, 싸울 줄 알고, 유머가 있고""--2",모든 제작 스튜디오와 회사들 스트리밍 회사들은 말만 할 게 아니라 실제로 여성감독을 기용하는 데 돈을 써야 한다고 생각한다	문제가 만연한 것이 자명한 분야이지만 여성들에게 기회를 제공하는 것이 중요하고 그런 부분에서 변화를 가져올 수 있는 힘이 우리에겐 분명히	우리는 여성감독을 지지하고 이번에 의상감독을 포함해서 능력 있는 사람들을 새롭게 발굴할 필요가 있다는 생각으로 동료들을 맞이했다	늘 일을 주던 사람들에게 관행적으로 일을 주는 게 아니라 적극적이고 능동적으로 신인 발굴에도 신경 써야 한다	여성이 가진 잠재력을 충분히 탐구하는 작품 의외성이 있는 영화들에 주목한다	유리천장에 도전함으로써 여성들도 동일하게 능력 있고 싸울 줄 알고 유머가 있고 롱 샷 에서처럼 주로 남성들이 맡은 역할도 충분히 할 수 있다는 사실을 알리는 영화에 참여할 것이다	스토리가 무엇이든 간에 여성 캐릭터에 대해 접근을 하지 않는 작품에 참여하는 것은 스스로 자랑스럽게 여기기 어려울	한마디로 오늘날 세상 속의 여성들을 반영한 작품이면 된다	글	김소미	저작권자
28,"<대인물> 우바이 감독 - ""베테랑""의 현실적인 형사, 중국에서도 사랑받았다--0",원작 못지않은 리메이크작이다	지난 9월 3일 VOD로 개봉한 대인물 은 류승완 감독의 베테랑 리메이크한 중국영화다	지난해 극장 개봉해 1052만명을 동원해 3억8천만위안을 벌어들였다	중국에서 개봉한 한국영화 리메이크작 가장 좋은 성적이다	정의로운 강력계 형사 쑨따셩이 거대 기업 자오스 그룹 2세 자오타이를 추적하는 이야기의 큰 줄기는 원작에 충실하되 사건의 세부적인 설정을 중국 문화에 맞게 각색해 관객에게 큰 공감을 얻었다	영화를 연출한 우바이 감독은 2009년 코미디 단편영화 천남일기 데뷔해 웰메이드 웹드라마 심리죄 연출해 재능을 인정받았다	그는 중국 영화산업에서 바링허우 대표하는 감독으로 알려져있다	그와 서면으로 주고받은 대화를 공개한다	중국에선 액션과 코미디 장르가 유독 인기	대인물 흥행한 것은 통쾌한 범죄오락 영화인 이유도 있지만 그보다는 기존의 중국영화와 달랐기 때문이다	경찰의 멋진 모습만 부각했던 기존의 중국 경찰영화와 달리 대인물 은 자식의 교육을 걱정하고 집에서는 아내에게 혼나기도 하는 현실적인 형사를 그려냈다	빠른 스토리 전개가 관객에게 어필했던	대인물 역시 온라인에서 밈 된 대사가 많다	우리가 돈이 없지 가오가 없어 같은 베테랑 명대사처럼 대인물 에서는 경찰 서장이 배후에는 국가가 고 말하는 장면이 관객의 사랑을 많이 받았다	영화의 마지막 장면에서 오늘 밤 자오타이님께서 골든벨을 울립니다 같은 대사도 많이 회자됐다	베테랑 은 개인적으로 정말 좋아하는 영화다	정의로운 경찰이 도덕적으로 부패한 권력자에 맞서는 원작의 스토리가 아주 보편적이라 문화 차이를 느끼지 못했다	디테일한 요소들만 중국 현지에 적합한 사건으로 각색했다	중국 관객이 쉽게 이해하고 공감할 수 있으면서도 흥미로운 디테일들을 살릴지 가장 많이 고민했다	한국에서 재벌은 역사가 중국보다 오래됐고 다양한 계열사를 지닌 거대 공룡 같은 존재이지 않나
29,"<대인물> 우바이 감독 - ""베테랑""의 현실적인 형사, 중국에서도 사랑받았다--1",재벌을 중국 상황에 맞게 지방 도시에서 급부상한 부동산 기업으로 설정해 관객이 특정 기업을 떠올리고 공감할 수 있도록 했다	오프닝 시퀀스에서 등장하는 황당한 위조화폐 사건은 실제로 산둥성 출신의 세 남자가 위조지폐 단속망을 피하려고 1위안짜리 동전을 위조하기 위해 18만위안을 투자하여 범죄를 저질렀다가 예상을 초과한 작업비만 지출하고 유통도 제대로 못한 채 경찰에 붙잡힌 사건이다	한국도 마찬가지겠지만 부동산을 개발하기 위해 저소득 빈민층의 주거 공간을 강제로 철거하는 영화 속 사건은 빠른 도시화와 빈부격차라는 현대 중국의 사회적 이슈를 반영했다	형사 쑨따셩도 자식 교육 앞에서는 고개를 숙일 수밖에 없는 설정인데 그건 중국의 학군 지역 과열 현상을 반영했다	많은 중국 관객이 영화를 보고 공감했던 것도 설정 덕분이다	경찰은 가슴 아픈 사건을 가장 먼저 마주해야 하는 직업이다	이후 흩어진 정보들 가운데 진실을 가려내고 사건의 진상을 파헤치기 위해 노력한다	과정에서 개인의 감정을 배제해야 뜨거운 정의감을 가지고 있어야 한다	장르적 특성이 매력적이다	가장 좋아하는 형사물은 봉준호 감독의 살인의 추억 이다	왕첸위안은 감독에게도 관객에게도 신뢰를 주는 연기자다	캐릭터가 현실적인지 깊이 고민하고 제작자와 감독의 작품성을 고민한다	그의 연기는 늘 최고다	중국 영화산업에서 그는 남자다운 남자 중국적인 남자 대명사로 유명하다	현재 중국은 극장 영업이 재개되어 산업이 회복되고	침체됐던 영화 시장은 분명 정상화되리라고 생각된다	코로나19 사태는 영화 드라마 업계가 의미에서 한 단계 발전할 수 있는 계기가 되었다고 생각한다	관객이 온라인 플랫폼이라는 새로운 콘텐츠 관람 방식을 받아들일 수 있게 되었고 이것은 향후 콘텐츠 전반을 더 발전시킬 수 있는 기회라고 생각한다	콘텐츠 시청 장비와 5G 발전으로 OTT를 통해 영화나 드라마를 감상하는 일이 보편화되고 관객의 만족도도 점점 높아지고	중국을 포함해 전세계적으로 온라인 동영상 플랫폼들이 우수한 콘텐츠를 개발 제작하고 있으며 이는 일시적인 현상이 아닌 산업의 자연스러운 흐름이 됐다
30,"<대인물> 우바이 감독 - ""베테랑""의 현실적인 형사, 중국에서도 사랑받았다--2",3D나 4D와 영화관에서 관람했을 더 만족도가 높은 영화들도	3D 4D 장비를 집에 구비해둘 수 없으니 시각적 효과가 장점인 영화들은 영화관에서 관람하는 것이 적합하다	산업이 변화를 겪고 있지만 사실 크게 걱정은 하지 않는다	기술의 발전은 콘텐츠 관람 배급의 방식을 바꿀 수는 있지만 스토리텔링을 바꿀 수는 없고 좋은 콘텐츠는 방식으로 공개돼도 좋은 반응을 얻기 때문이다	크리에이터로서 좋은 이야기로 좋은 작품을 만드는 것이 가장 중요하다	스릴러 범죄 수사 장르물에 대한 관심은 항상 가지고	볘커 감독이 도어락 촬영하고 있어 영화와 관련된 정보를 더 얘기하기가 아직은 조심스럽다	개봉하면 더 자세한 얘기를 나누자	글	김성훈	저작권자
31,"""테우리"" 이난 감독 - 알려지지 않은 시민운동가의 현재를 보여주는 영화--0",이전 영화들은 자의식이 강한 감독의 결과물이었었다	테우리 는 비선형적인 독립영화를 작업해온 이난 감독이 만든 가장 친절한 영화다	민주화 세대의 현재와 과거를 재현한 극영화 테우리 는 남산의 부장들 전두환을 연기한 배우 서현우가 국가폭력의 피해자 짱구를 연기해 삼촌의 시민운동 동지들을 찾아가는 이야기다	현대 한국 사회를 살아가고 있을 민주화 세대에게 발견할 수 있는 징후들을 섬세하게 살펴보고 과거사를 정확하게 재현하려는 영화적 시도는 일찍이 이난 감독에게서 볼 수 없었던 모습이다	어쩌면 그것은 딸에게 과거 사건을 알려주고 싶었다 는 마음에서 출발한 영화이기 때문인지도 모르겠다	사진과 뮤직비디오 작업을 넘나들면서도 제일 재밌는 건 영화를 생각하고 영화를 만드는 이라고 말하는 그의 신작을 부디 많은 관객들이 알아봐주고 이야기해주길	이난 감독과의 대화를 전한다	기이한 끌개 란 작품으로 트리트먼트로 부산국제영화제 아시아영화펀드 극영화 제작 지원을 받았는데 잘 안 써졌다	고민하던 중에 테우리 다루고 있는 이야기가 번뜩 떠올라 2015년 트리트먼트를 쓰고 2016년에 시나리오를 완성했다	하지 않는 이야기였기 때문이다	내 또래 감독들이 충분히 할 수 있고 해야 하는 이야기라고 생각했는데 하지 않았다	시민운동가 중 많이 알려진 이도 있고 아닌 이도 있는데 나는 알려지지 않은 사람들에 관해 이야기하고 싶었다	자신은 운동권에 몸을 담은 적이 없다	중학교 3학년 때부터 학교를 끝나고 집에 갈 때마다 항상 밤마다 아주대학교 학생들과 전경들이 길에서 항상 대치하고 투석전을 벌이고는 풍경을 익숙하게 봤다	고등학교 1학년이었던 1987년에는 투석전과 시위에 참여하긴 했다	테우리 는 과거 시민운동을 했던 사람들의 현재를 보여주는 영화다	과거의 사건을 영화 안에 잘 배치해야 잘 이해될 수 있겠구나 싶었다	세대에게 익숙한 얘기를 효과적으로 전달하려면 효과적인 전달 장치가 필요하지 않을까 생각하기도 했다	스릴러라는 형태가 필요한 건 때문이다	영화의 시간을 대과거 과거 현재로 나누고 이들을 조합하면서 이야기를 만들어나갔다
32,"""테우리"" 이난 감독 - 알려지지 않은 시민운동가의 현재를 보여주는 영화--1",어렸을 겪었던 세상이 끝난 것처럼 느꼈던 때가 있었다	이명박 대통령 정권이 들어선 뒤 과거가 소환되는 것처럼 느껴졌다	서울 광화문 일대에 생겼던 명박산성 그것이다	당시 청계천에서 딸아이를 목말 태우고 산책하고 돌아가는 길에 전경들에게 저지당했다	뒤를 돌아보니 수많은 사람들이 깃발을 들고 다가오고 있었다	중 고등학생때 많이 봤던 풍경이었다	목말 태운 아이의 다리를 꽉 잡고 양쪽을 둘러봤는데 육체적인 감각으로는 10분 뒤에 투석전이 일어나고 최루탄이 오갈 같은 느낌이 훅 끼쳤다	공포스러웠다	집으로 돌아오는 길에 내가 겁을 먹었는지 의문이 들었다	과거로부터 시간이 한참 흘렀는데도 말이다	과거사적 인물이 다시 나타나는 일들이 일어났다	대표적으로 김기춘 전 검찰총장이 다시 나타나 대통령 비서실장까지 했다	나는 과거를 다시 불러내는 사람들을 차 형사 캐릭터라고 생각했다	짱구 복순 장 반장 김 선생은 조금씩 다르게 과거를 다르게 생각하거나 망각하면서 살아간다	물리적인 억압은 사람들에게 식으로든 후유증으로 남아있으리라 생각했다	그건 내가 아이를 목말 태우고 시위 한가운데 있을 느꼈던 공포감이었다	20년 전에 느꼈던 공포감이 한순간에 돌아오는 것처럼 편지를 통해서 공포와 기억이 다시 나타나길 바랐다	짱구라는 캐릭터가 연관된 인물들을 하나씩 만나면서 본인 안에 있던 후유증까지 깨볼 수 있길 바랐다	그들을 불러 모으는 사람이 차 형사라면 더 극적일 수 있겠다고 생각했다	2018년 전주국제영화제에 마련된 독립영화인의 밤 행사에서 배우 서현우를 만났는데 이렇게 전주국제영화제에서 작품을 상영하게 되어서 신기하다
33,"""테우리"" 이난 감독 - 알려지지 않은 시민운동가의 현재를 보여주는 영화--2",둘끼리는 되게 신기하고 놀랍다고 이야기한다	당시 테우리 시나리오를 매니지먼트사에 보낸 상황이었는데 배우가 읽은 상태였고 꼭 하고 싶다고 하더라	일정 서현우를 6개월 기다려서 촬영에 들어갔다	군 생활을 제주도에서 했다	군 생활하면서 과거 있었던 4 3사건에 대해 알게 됐다	테우리 시나리오에서 대과거에 속하는 이야기는 6살 미취학 아동인 춘배가 제주도에 살면서 할아버지와 겪었던 일에 대한 것이다	할아버지가 겪은 4 3사건이 춘배에게 무의식적으로 전도됐고 식으로든 그에게 남았다고 생각했다	어린 나이의 춘배는 말을 돌보는 테우리라는 일을 하고 싶었다는 설정을 입혔다	드문드문 나타나는 말과 제주도 장면은 그렇게 탄생했다	첫 번째 관객은 딸이다	과거 시민운동이 있었다는 걸 딸에게 얘기하지 못했다	아마 내 안에 검열이 있었던	어둡고 고통스러운 이야기를 전하고 싶지 않은 마음이었다	딸이 종종 아빠는 내가 볼 수 없는 영화만 만드느냐 질문하곤 했다	그동안 나는 청소년 관람 불가 등급의 영화만 만들어왔다	전작 평범한 날들 은 15세 관람가였는데 당시 아이가 어려서 못 봤고 이전 영화들은 보편적으로 이해되기 어려운 이야기의 구조이거나 영상이 중심인 형태였다	자의식이 강한 감독의 결과물이었었다	테우리 아이가 볼 수 있는 영화가 만들어져서 기쁘다	아이가 볼 수 있으면 내 부모 세대도 볼 수 있는 거라고 생각한다	중학교 3학년인데 테우리 에도 출연한다
34,"""테우리"" 이난 감독 - 알려지지 않은 시민운동가의 현재를 보여주는 영화--3",장 반장에게 돈 달라고 따지는 어린 소녀가 딸이다	테우리 12세 관람가를 받아서 자신도 볼 수 있다고 좋아한다	차기작 생각보다 테우리 많은 사람들 사이에서 이야기됐으면 하는 바람이 크다	영화제를 통해 사람들이 많이 봤으면 좋겠고 개봉도 했으면 좋겠다	한명의 감독이 꾸준히 영화를 찍기 위해서는 사람들의 요구가 있어야 한다	과거에는 내가 하고 싶은 걸 하면 돼 내 방식이 옳아 라고 생각했다	시기를 지나왔다	사이 아이가 생기기도 했다	테우리 란 영화를 통해 나의 영화 세계가 단계로 나아간	글	배동미사진	백종헌	저작권자
